A1: Legenda:
A2: LB is the initial lower bound, max(Lcp, Lcpimp)
A3: PH is the solution after the execution of the Population Heuristic
A4: time PH is the computing time for the Population Heuristic
A5: init cols are the column stored into the initial pool for the column generation phase
A6: sol root is the solution of the column generation
A7: time root is the computing time for the column generation (time PH not included)
A8: root cols are the total columns after the solution of the column generation
A9: LB root is the lower bound after the execution of the column generation
A10: sol B&P is the best integer solution after the execution of the branch and price (time limit 10h)
A11: col B&P are the total columns after the solution of the B&P
A12: time B&P is the computing time for the B&P (including time root)
A13: opt is 1 if the instance is solved to optimality
A14: solved_after_PH is 1 if the instance is solved during the execution of the Population Heuristic
A15: solved_at_root is 1 if the instance is solved after the execution of the column generation
A16: improved_B&P is 1 if the B&P improved the current integer solution
A17: solved_B&P is 1 if the B&P solved the instance
B19: LB | C19: PH | D19: time PH | E19: init cols | F19: sol root | G19: time root | H19: root cols | I19: LB root | J19: sol B&P | K19: time B&P | L19: col B&P | M19: opt | N19: solved_after_PH | O19: solved_at_root | P19: improved_B&P | Q19: solved_B&P
A20: BPPC_1_0_1.txt | B20: 48 | C20: 48 | D20: 0 | E20: 194 | I20: =MAX(B20,CEILING(F20,1)) -> 48 | J20: 48 | K20: 0 | L20: 194 | M20: 1 | N20: =IF(B20=C20,1,0) -> 1 | O20: =IF(I20=C20,1,0)-N20 -> 0 | P20: =IF(J20<C20,1,0) -> 0 | Q20: =M20-N20-O20 -> 0
A21: BPPC_1_0_2.txt | B21: 49 | C21: 49 | D21: 0 | E21: 163 | I21: =MAX(B21,CEILING(F21,1)) -> 49 | J21: 49 | K21: 0 | L21: 163 | M21: 1 | N21: =IF(B21=C21,1,0) -> 1 | O21: =IF(I21=C21,1,0)-N21 -> 0 | P21: =IF(J21<C21,1,0) -> 0 | Q21: =M21-N21-O21 -> 0
A22: BPPC_1_0_3.txt | B22: 46 | C22: 46 | D22: 0 | E22: 180 | I22: =MAX(B22,CEILING(F22,1)) -> 46 | J22: 46 | K22: 0 | L22: 180 | M22: 1 | N22: =IF(B22=C22,1,0) -> 1 | O22: =IF(I22=C22,1,0)-N22 -> 0 | P22: =IF(J22<C22,1,0) -> 0 | Q22: =M22-N22-O22 -> 0
A23: BPPC_1_0_4.txt | B23: 49 | C23: 49 | D23: 0 | E23: 205 | I23: =MAX(B23,CEILING(F23,1)) -> 49 | J23: 49 | K23: 0 | L23: 205 | M23: 1 | N23: =IF(B23=C23,1,0) -> 1 | O23: =IF(I23=C23,1,0)-N23 -> 0 | P23: =IF(J23<C23,1,0) -> 0 | Q23: =M23-N23-O23 -> 0
A24: BPPC_1_0_5.txt | B24: 50 | C24: 50 | D24: 0 | E24: 171 | I24: =MAX(B24,CEILING(F24,1)) -> 50 | J24: 50 | K24: 0 | L24: 171 | M24: 1 | N24: =IF(B24=C24,1,0) -> 1 | O24: =IF(I24=C24,1,0)-N24 -> 0 | P24: =IF(J24<C24,1,0) -> 0 | Q24: =M24-N24-O24 -> 0
A25: BPPC_1_0_6.txt | B25: 48 | C25: 48 | D25: 0 | E25: 221 | I25: =MAX(B25,CEILING(F25,1)) -> 48 | J25: 48 | K25: 0 | L25: 221 | M25: 1 | N25: =IF(B25=C25,1,0) -> 1 | O25: =IF(I25=C25,1,0)-N25 -> 0 | P25: =IF(J25<C25,1,0) -> 0 | Q25: =M25-N25-O25 -> 0
A26: BPPC_1_0_7.txt | B26: 48 | C26: 48 | D26: 1 | E26: 187 | I26: =MAX(B26,CEILING(F26,1)) -> 48 | J26: 48 | K26: 0 | L26: 187 | M26: 1 | N26: =IF(B26=C26,1,0) -> 1 | O26: =IF(I26=C26,1,0)-N26 -> 0 | P26: =IF(J26<C26,1,0) -> 0 | Q26: =M26-N26-O26 -> 0
A27: BPPC_1_0_8.txt | B27: 49 | C27: 49 | D27: 0 | E27: 207 | I27: =MAX(B27,CEILING(F27,1)) -> 49 | J27: 49 | K27: 0 | L27: 207 | M27: 1 | N27: =IF(B27=C27,1,0) -> 1 | O27: =IF(I27=C27,1,0)-N27 -> 0 | P27: =IF(J27<C27,1,0) -> 0 | Q27: =M27-N27-O27 -> 0
A28: BPPC_1_0_9.txt | B28: 50 | C28: 50 | D28: 21 | E28: 214 | I28: =MAX(B28,CEILING(F28,1)) -> 50 | J28: 50 | K28: 0 | L28: 214 | M28: 1 | N28: =IF(B28=C28,1,0) -> 1 | O28: =IF(I28=C28,1,0)-N28 -> 0 | P28: =IF(J28<C28,1,0) -> 0 | Q28: =M28-N28-O28 -> 0
A29: BPPC_1_0_10.txt | B29: 46 | C29: 46 | D29: 1 | E29: 184 | I29: =MAX(B29,CEILING(F29,1)) -> 46 | J29: 46 | K29: 0 | L29: 184 | M29: 1 | N29: =IF(B29=C29,1,0) -> 1 | O29: =IF(I29=C29,1,0)-N29 -> 0 | P29: =IF(J29<C29,1,0) -> 0 | Q29: =M29-N29-O29 -> 0
A30: BPPC_1_1_1.txt | B30: 48 | C30: 48 | D30: 0 | E30: 343 | I30: =MAX(B30,CEILING(F30,1)) -> 48 | J30: 48 | K30: 0 | L30: 343 | M30: 1 | N30: =IF(B30=C30,1,0) -> 1 | O30: =IF(I30=C30,1,0)-N30 -> 0 | P30: =IF(J30<C30,1,0) -> 0 | Q30: =M30-N30-O30 -> 0
A31: BPPC_1_1_2.txt | B31: 49 | C31: 49 | D31: 0 | E31: 377 | I31: =MAX(B31,CEILING(F31,1)) -> 49 | J31: 49 | K31: 0 | L31: 377 | M31: 1 | N31: =IF(B31=C31,1,0) -> 1 | O31: =IF(I31=C31,1,0)-N31 -> 0 | P31: =IF(J31<C31,1,0) -> 0 | Q31: =M31-N31-O31 -> 0
A32: BPPC_1_1_3.txt | B32: 46 | C32: 46 | D32: 0 | E32: 465 | I32: =MAX(B32,CEILING(F32,1)) -> 46 | J32: 46 | K32: 0 | L32: 465 | M32: 1 | N32: =IF(B32=C32,1,0) -> 1 | O32: =IF(I32=C32,1,0)-N32 -> 0 | P32: =IF(J32<C32,1,0) -> 0 | Q32: =M32-N32-O32 -> 0
A33: BPPC_1_1_4.txt | B33: 49 | C33: 49 | D33: 0 | E33: 320 | I33: =MAX(B33,CEILING(F33,1)) -> 49 | J33: 49 | K33: 0 | L33: 320 | M33: 1 | N33: =IF(B33=C33,1,0) -> 1 | O33: =IF(I33=C33,1,0)-N33 -> 0 | P33: =IF(J33<C33,1,0) -> 0 | Q33: =M33-N33-O33 -> 0
A34: BPPC_1_1_5.txt | B34: 50 | C34: 50 | D34: 0 | E34: 281 | I34: =MAX(B34,CEILING(F34,1)) -> 50 | J34: 50 | K34: 0 | L34: 281 | M34: 1 | N34: =IF(B34=C34,1,0) -> 1 | O34: =IF(I34=C34,1,0)-N34 -> 0 | P34: =IF(J34<C34,1,0) -> 0 | Q34: =M34-N34-O34 -> 0
A35: BPPC_1_1_6.txt | B35: 48 | C35: 48 | D35: 1 | E35: 360 | I35: =MAX(B35,CEILING(F35,1)) -> 48 | J35: 48 | K35: 0 | L35: 360 | M35: 1 | N35: =IF(B35=C35,1,0) -> 1 | O35: =IF(I35=C35,1,0)-N35 -> 0 | P35: =IF(J35<C35,1,0) -> 0 | Q35: =M35-N35-O35 -> 0
A36: BPPC_1_1_7.txt | B36: 48 | C36: 48 | D36: 0 | E36: 446 | I36: =MAX(B36,CEILING(F36,1)) -> 48 | J36: 48 | K36: 0 | L36: 446 | M36: 1 | N36: =IF(B36=C36,1,0) -> 1 | O36: =IF(I36=C36,1,0)-N36 -> 0 | P36: =IF(J36<C36,1,0) -> 0 | Q36: =M36-N36-O36 -> 0
A37: BPPC_1_1_8.txt | B37: 49 | C37: 49 | D37: 0 | E37: 386 | I37: =MAX(B37,CEILING(F37,1)) -> 49 | J37: 49 | K37: 0 | L37: 386 | M37: 1 | N37: =IF(B37=C37,1,0) -> 1 | O37: =IF(I37=C37,1,0)-N37 -> 0 | P37: =IF(J37<C37,1,0) -> 0 | Q37: =M37-N37-O37 -> 0
A38: BPPC_1_1_9.txt | B38: 50 | C38: 50 | D38: 20 | E38: 362 | I38: =MAX(B38,CEILING(F38,1)) -> 50 | J38: 50 | K38: 0 | L38: 362 | M38: 1 | N38: =IF(B38=C38,1,0) -> 1 | O38: =IF(I38=C38,1,0)-N38 -> 0 | P38: =IF(J38<C38,1,0) -> 0 | Q38: =M38-N38-O38 -> 0
A39: BPPC_1_1_10.txt | B39: 46 | C39: 46 | D39: 1 | E39: 394 | I39: =MAX(B39,CEILING(F39,1)) -> 46 | J39: 46 | K39: 0 | L39: 394 | M39: 1 | N39: =IF(B39=C39,1,0) -> 1 | O39: =IF(I39=C39,1,0)-N39 -> 0 | P39: =IF(J39<C39,1,0) -> 0 | Q39: =M39-N39-O39 -> 0
A40: BPPC_1_2_1.txt | B40: 48 | C40: 48 | D40: 0 | E40: 561 | I40: =MAX(B40,CEILING(F40,1)) -> 48 | J40: 48 | K40: 0 | L40: 561 | M40: 1 | N40: =IF(B40=C40,1,0) -> 1 | O40: =IF(I40=C40,1,0)-N40 -> 0 | P40: =IF(J40<C40,1,0) -> 0 | Q40: =M40-N40-O40 -> 0
A41: BPPC_1_2_2.txt | B41: 49 | C41: 49 | D41: 0 | E41: 574 | I41: =MAX(B41,CEILING(F41,1)) -> 49 | J41: 49 | K41: 0 | L41: 574 | M41: 1 | N41: =IF(B41=C41,1,0) -> 1 | O41: =IF(I41=C41,1,0)-N41 -> 0 | P41: =IF(J41<C41,1,0) -> 0 | Q41: =M41-N41-O41 -> 0
A42: BPPC_1_2_3.txt | B42: 46 | C42: 46 | D42: 1 | E42: 656 | I42: =MAX(B42,CEILING(F42,1)) -> 46 | J42: 46 | K42: 0 | L42: 656 | M42: 1 | N42: =IF(B42=C42,1,0) -> 1 | O42: =IF(I42=C42,1,0)-N42 -> 0 | P42: =IF(J42<C42,1,0) -> 0 | Q42: =M42-N42-O42 -> 0
A43: BPPC_1_2_4.txt | B43: 49 | C43: 49 | D43: 0 | E43: 563 | I43: =MAX(B43,CEILING(F43,1)) -> 49 | J43: 49 | K43: 0 | L43: 563 | M43: 1 | N43: =IF(B43=C43,1,0) -> 1 | O43: =IF(I43=C43,1,0)-N43 -> 0 | P43: =IF(J43<C43,1,0) -> 0 | Q43: =M43-N43-O43 -> 0
A44: BPPC_1_2_5.txt | B44: 50 | C44: 50 | D44: 0 | E44: 431 | I44: =MAX(B44,CEILING(F44,1)) -> 50 | J44: 50 | K44: 0 | L44: 431 | M44: 1 | N44: =IF(B44=C44,1,0) -> 1 | O44: =IF(I44=C44,1,0)-N44 -> 0 | P44: =IF(J44<C44,1,0) -> 0 | Q44: =M44-N44-O44 -> 0
A45: BPPC_1_2_6.txt | B45: 48 | C45: 48 | D45: 0 | E45: 551 | I45: =MAX(B45,CEILING(F45,1)) -> 48 | J45: 48 | K45: 0 | L45: 551 | M45: 1 | N45: =IF(B45=C45,1,0) -> 1 | O45: =IF(I45=C45,1,0)-N45 -> 0 | P45: =IF(J45<C45,1,0) -> 0 | Q45: =M45-N45-O45 -> 0
A46: BPPC_1_2_7.txt | B46: 48 | C46: 48 | D46: 0 | E46: 636 | I46: =MAX(B46,CEILING(F46,1)) -> 48 | J46: 48 | K46: 0 | L46: 636 | M46: 1 | N46: =IF(B46=C46,1,0) -> 1 | O46: =IF(I46=C46,1,0)-N46 -> 0 | P46: =IF(J46<C46,1,0) -> 0 | Q46: =M46-N46-O46 -> 0
A47: BPPC_1_2_8.txt | B47: 49 | C47: 49 | D47: 1 | E47: 624 | I47: =MAX(B47,CEILING(F47,1)) -> 49 | J47: 49 | K47: 0 | L47: 624 | M47: 1 | N47: =IF(B47=C47,1,0) -> 1 | O47: =IF(I47=C47,1,0)-N47 -> 0 | P47: =IF(J47<C47,1,0) -> 0 | Q47: =M47-N47-O47 -> 0
A48: BPPC_1_2_9.txt | B48: 50 | C48: 50 | D48: 2 | E48: 590 | I48: =MAX(B48,CEILING(F48,1)) -> 50 | J48: 50 | K48: 0 | L48: 590 | M48: 1 | N48: =IF(B48=C48,1,0) -> 1 | O48: =IF(I48=C48,1,0)-N48 -> 0 | P48: =IF(J48<C48,1,0) -> 0 | Q48: =M48-N48-O48 -> 0
A49: BPPC_1_2_10.txt | B49: 46 | C49: 46 | D49: 1 | E49: 645 | I49: =MAX(B49,CEILING(F49,1)) -> 46 | J49: 46 | K49: 0 | L49: 645 | M49: 1 | N49: =IF(B49=C49,1,0) -> 1 | O49: =IF(I49=C49,1,0)-N49 -> 0 | P49: =IF(J49<C49,1,0) -> 0 | Q49: =M49-N49-O49 -> 0
A50: BPPC_1_3_1.txt | B50: 48 | C50: 48 | D50: 0 | E50: 744 | I50: =MAX(B50,CEILING(F50,1)) -> 48 | J50: 48 | K50: 0 | L50: 744 | M50: 1 | N50: =IF(B50=C50,1,0) -> 1 | O50: =IF(I50=C50,1,0)-N50 -> 0 | P50: =IF(J50<C50,1,0) -> 0 | Q50: =M50-N50-O50 -> 0
A51: BPPC_1_3_2.txt | B51: 49 | C51: 49 | D51: 0 | E51: 650 | I51: =MAX(B51,CEILING(F51,1)) -> 49 | J51: 49 | K51: 0 | L51: 650 | M51: 1 | N51: =IF(B51=C51,1,0) -> 1 | O51: =IF(I51=C51,1,0)-N51 -> 0 | P51: =IF(J51<C51,1,0) -> 0 | Q51: =M51-N51-O51 -> 0
A52: BPPC_1_3_3.txt | B52: 46 | C52: 46 | D52: 1 | E52: 845 | I52: =MAX(B52,CEILING(F52,1)) -> 46 | J52: 46 | K52: 0 | L52: 845 | M52: 1 | N52: =IF(B52=C52,1,0) -> 1 | O52: =IF(I52=C52,1,0)-N52 -> 0 | P52: =IF(J52<C52,1,0) -> 0 | Q52: =M52-N52-O52 -> 0
A53: BPPC_1_3_4.txt | B53: 49 | C53: 49 | D53: 0 | E53: 682 | I53: =MAX(B53,CEILING(F53,1)) -> 49 | J53: 49 | K53: 0 | L53: 682 | M53: 1 | N53: =IF(B53=C53,1,0) -> 1 | O53: =IF(I53=C53,1,0)-N53 -> 0 | P53: =IF(J53<C53,1,0) -> 0 | Q53: =M53-N53-O53 -> 0
A54: BPPC_1_3_5.txt | B54: 50 | C54: 50 | D54: 0 | E54: 673 | I54: =MAX(B54,CEILING(F54,1)) -> 50 | J54: 50 | K54: 0 | L54: 673 | M54: 1 | N54: =IF(B54=C54,1,0) -> 1 | O54: =IF(I54=C54,1,0)-N54 -> 0 | P54: =IF(J54<C54,1,0) -> 0 | Q54: =M54-N54-O54 -> 0
A55: BPPC_1_3_6.txt | B55: 48 | C55: 48 | D55: 1 | E55: 729 | I55: =MAX(B55,CEILING(F55,1)) -> 48 | J55: 48 | K55: 0 | L55: 729 | M55: 1 | N55: =IF(B55=C55,1,0) -> 1 | O55: =IF(I55=C55,1,0)-N55 -> 0 | P55: =IF(J55<C55,1,0) -> 0 | Q55: =M55-N55-O55 -> 0
A56: BPPC_1_3_7.txt | B56: 48 | C56: 48 | D56: 0 | E56: 704 | I56: =MAX(B56,CEILING(F56,1)) -> 48 | J56: 48 | K56: 0 | L56: 704 | M56: 1 | N56: =IF(B56=C56,1,0) -> 1 | O56: =IF(I56=C56,1,0)-N56 -> 0 | P56: =IF(J56<C56,1,0) -> 0 | Q56: =M56-N56-O56 -> 0
A57: BPPC_1_3_8.txt | B57: 49 | C57: 50 | D57: 121 | E57: 680 | F57: 48.992420000000003 | G57: 11 | H57: 786 | I57: =MAX(B57,CEILING(F57,1)) -> 49 | J57: 49 | K57: 654 | L57: 1395 | M57: 1 | N57: =IF(B57=C57,1,0) -> 0 | O57: =IF(I57=C57,1,0)-N57 -> 0 | P57: =IF(J57<C57,1,0) -> 1 | Q57: =M57-N57-O57 -> 1
A58: BPPC_1_3_9.txt | B58: 50 | C58: 51 | D58: 121 | E58: 679 | F58: 49.96996 | G58: 7 | H58: 803 | I58: =MAX(B58,CEILING(F58,1)) -> 50 | J58: 50 | K58: 34 | L58: 979 | M58: 1 | N58: =IF(B58=C58,1,0) -> 0 | O58: =IF(I58=C58,1,0)-N58 -> 0 | P58: =IF(J58<C58,1,0) -> 1 | Q58: =M58-N58-O58 -> 1
A59: BPPC_1_3_10.txt | B59: 46 | C59: 46 | D59: 2 | E59: 718 | I59: =MAX(B59,CEILING(F59,1)) -> 46 | J59: 46 | K59: 0 | L59: 718 | M59: 1 | N59: =IF(B59=C59,1,0) -> 1 | O59: =IF(I59=C59,1,0)-N59 -> 0 | P59: =IF(J59<C59,1,0) -> 0 | Q59: =M59-N59-O59 -> 0
A60: BPPC_1_4_1.txt | B60: 48 | C60: 49 | D60: 121 | E60: 752 | F60: 48 | G60: 2 | H60: 788 | I60: =MAX(B60,CEILING(F60,1)) -> 48 | J60: 48 | K60: 6 | L60: 841 | M60: 1 | N60: =IF(B60=C60,1,0) -> 0 | O60: =IF(I60=C60,1,0)-N60 -> 0 | P60: =IF(J60<C60,1,0) -> 1 | Q60: =M60-N60-O60 -> 1
A61: BPPC_1_4_2.txt | B61: 53 | C61: 53 | D61: 0 | E61: 665 | I61: =MAX(B61,CEILING(F61,1)) -> 53 | J61: 53 | K61: 0 | L61: 665 | M61: 1 | N61: =IF(B61=C61,1,0) -> 1 | O61: =IF(I61=C61,1,0)-N61 -> 0 | P61: =IF(J61<C61,1,0) -> 0 | Q61: =M61-N61-O61 -> 0
A62: BPPC_1_4_3.txt | B62: 54 | C62: 54 | D62: 0 | E62: 753 | I62: =MAX(B62,CEILING(F62,1)) -> 54 | J62: 54 | K62: 0 | L62: 753 | M62: 1 | N62: =IF(B62=C62,1,0) -> 1 | O62: =IF(I62=C62,1,0)-N62 -> 0 | P62: =IF(J62<C62,1,0) -> 0 | Q62: =M62-N62-O62 -> 0
A63: BPPC_1_4_4.txt | B63: 49 | C63: 50 | D63: 121 | E63: 729 | F63: 49 | G63: 1 | H63: 782 | I63: =MAX(B63,CEILING(F63,1)) -> 49 | J63: 49 | K63: 2 | L63: 799 | M63: 1 | N63: =IF(B63=C63,1,0) -> 0 | O63: =IF(I63=C63,1,0)-N63 -> 0 | P63: =IF(J63<C63,1,0) -> 1 | Q63: =M63-N63-O63 -> 1
A64: BPPC_1_4_5.txt | B64: 50 | C64: 50 | D64: 0 | E64: 732 | I64: =MAX(B64,CEILING(F64,1)) -> 50 | J64: 50 | K64: 0 | L64: 732 | M64: 1 | N64: =IF(B64=C64,1,0) -> 1 | O64: =IF(I64=C64,1,0)-N64 -> 0 | P64: =IF(J64<C64,1,0) -> 0 | Q64: =M64-N64-O64 -> 0
A65: BPPC_1_4_6.txt | B65: 51 | C65: 52 | D65: 121 | E65: 742 | F65: 52 | G65: 0 | H65: 742 | I65: =MAX(B65,CEILING(F65,1)) -> 52 | J65: 52 | K65: 0 | L65: 742 | M65: 1 | N65: =IF(B65=C65,1,0) -> 0 | O65: =IF(I65=C65,1,0)-N65 -> 1 | P65: =IF(J65<C65,1,0) -> 0 | Q65: =M65-N65-O65 -> 0
A66: BPPC_1_4_7.txt | B66: 55 | C66: 55 | D66: 0 | E66: 776 | I66: =MAX(B66,CEILING(F66,1)) -> 55 | J66: 55 | K66: 0 | L66: 776 | M66: 1 | N66: =IF(B66=C66,1,0) -> 1 | O66: =IF(I66=C66,1,0)-N66 -> 0 | P66: =IF(J66<C66,1,0) -> 0 | Q66: =M66-N66-O66 -> 0
A67: BPPC_1_4_8.txt | B67: 59 | C67: 59 | D67: 0 | E67: 630 | I67: =MAX(B67,CEILING(F67,1)) -> 59 | J67: 59 | K67: 0 | L67: 630 | M67: 1 | N67: =IF(B67=C67,1,0) -> 1 | O67: =IF(I67=C67,1,0)-N67 -> 0 | P67: =IF(J67<C67,1,0) -> 0 | Q67: =M67-N67-O67 -> 0
A68: BPPC_1_4_9.txt | B68: 54 | C68: 54 | D68: 0 | E68: 660 | I68: =MAX(B68,CEILING(F68,1)) -> 54 | J68: 54 | K68: 0 | L68: 660 | M68: 1 | N68: =IF(B68=C68,1,0) -> 1 | O68: =IF(I68=C68,1,0)-N68 -> 0 | P68: =IF(J68<C68,1,0) -> 0 | Q68: =M68-N68-O68 -> 0
A69: BPPC_1_4_10.txt | B69: 54 | C69: 54 | D69: 0 | E69: 702 | I69: =MAX(B69,CEILING(F69,1)) -> 54 | J69: 54 | K69: 0 | L69: 702 | M69: 1 | N69: =IF(B69=C69,1,0) -> 1 | O69: =IF(I69=C69,1,0)-N69 -> 0 | P69: =IF(J69<C69,1,0) -> 0 | Q69: =M69-N69-O69 -> 0
A70: BPPC_1_5_1.txt | B70: 65 | C70: 65 | D70: 0 | E70: 583 | I70: =MAX(B70,CEILING(F70,1)) -> 65 | J70: 65 | K70: 0 | L70: 583 | M70: 1 | N70: =IF(B70=C70,1,0) -> 1 | O70: =IF(I70=C70,1,0)-N70 -> 0 | P70: =IF(J70<C70,1,0) -> 0 | Q70: =M70-N70-O70 -> 0
A71: BPPC_1_5_2.txt | B71: 67 | C71: 67 | D71: 0 | E71: 565 | I71: =MAX(B71,CEILING(F71,1)) -> 67 | J71: 67 | K71: 0 | L71: 565 | M71: 1 | N71: =IF(B71=C71,1,0) -> 1 | O71: =IF(I71=C71,1,0)-N71 -> 0 | P71: =IF(J71<C71,1,0) -> 0 | Q71: =M71-N71-O71 -> 0
A72: BPPC_1_5_3.txt | B72: 65 | C72: 65 | D72: 0 | E72: 580 | I72: =MAX(B72,CEILING(F72,1)) -> 65 | J72: 65 | K72: 0 | L72: 580 | M72: 1 | N72: =IF(B72=C72,1,0) -> 1 | O72: =IF(I72=C72,1,0)-N72 -> 0 | P72: =IF(J72<C72,1,0) -> 0 | Q72: =M72-N72-O72 -> 0
A73: BPPC_1_5_4.txt | B73: 58 | C73: 59 | D73: 121 | E73: 545 | F73: 58 | G73: 0 | H73: 554 | I73: =MAX(B73,CEILING(F73,1)) -> 58 | J73: 58 | K73: 0 | L73: 562 | M73: 1 | N73: =IF(B73=C73,1,0) -> 0 | O73: =IF(I73=C73,1,0)-N73 -> 0 | P73: =IF(J73<C73,1,0) -> 1 | Q73: =M73-N73-O73 -> 1
A74: BPPC_1_5_5.txt | B74: 57 | C74: 57 | D74: 0 | E74: 628 | I74: =MAX(B74,CEILING(F74,1)) -> 57 | J74: 57 | K74: 0 | L74: 628 | M74: 1 | N74: =IF(B74=C74,1,0) -> 1 | O74: =IF(I74=C74,1,0)-N74 -> 0 | P74: =IF(J74<C74,1,0) -> 0 | Q74: =M74-N74-O74 -> 0
A75: BPPC_1_5_6.txt | B75: 65 | C75: 65 | D75: 0 | E75: 579 | I75: =MAX(B75,CEILING(F75,1)) -> 65 | J75: 65 | K75: 0 | L75: 579 | M75: 1 | N75: =IF(B75=C75,1,0) -> 1 | O75: =IF(I75=C75,1,0)-N75 -> 0 | P75: =IF(J75<C75,1,0) -> 0 | Q75: =M75-N75-O75 -> 0
A76: BPPC_1_5_7.txt | B76: 65 | C76: 65 | D76: 0 | E76: 571 | I76: =MAX(B76,CEILING(F76,1)) -> 65 | J76: 65 | K76: 0 | L76: 571 | M76: 1 | N76: =IF(B76=C76,1,0) -> 1 | O76: =IF(I76=C76,1,0)-N76 -> 0 | P76: =IF(J76<C76,1,0) -> 0 | Q76: =M76-N76-O76 -> 0
A77: BPPC_1_5_8.txt | B77: 71 | C77: 71 | D77: 0 | E77: 467 | I77: =MAX(B77,CEILING(F77,1)) -> 71 | J77: 71 | K77: 0 | L77: 467 | M77: 1 | N77: =IF(B77=C77,1,0) -> 1 | O77: =IF(I77=C77,1,0)-N77 -> 0 | P77: =IF(J77<C77,1,0) -> 0 | Q77: =M77-N77-O77 -> 0
A78: BPPC_1_5_9.txt | B78: 65 | C78: 65 | D78: 0 | E78: 502 | I78: =MAX(B78,CEILING(F78,1)) -> 65 | J78: 65 | K78: 0 | L78: 502 | M78: 1 | N78: =IF(B78=C78,1,0) -> 1 | O78: =IF(I78=C78,1,0)-N78 -> 0 | P78: =IF(J78<C78,1,0) -> 0 | Q78: =M78-N78-O78 -> 0
A79: BPPC_1_5_10.txt | B79: 65 | C79: 65 | D79: 1 | E79: 591 | I79: =MAX(B79,CEILING(F79,1)) -> 65 | J79: 65 | K79: 0 | L79: 591 | M79: 1 | N79: =IF(B79=C79,1,0) -> 1 | O79: =IF(I79=C79,1,0)-N79 -> 0 | P79: =IF(J79<C79,1,0) -> 0 | Q79: =M79-N79-O79 -> 0
A80: BPPC_1_6_1.txt | B80: 76 | C80: 76 | D80: 0 | E80: 476 | I80: =MAX(B80,CEILING(F80,1)) -> 76 | J80: 76 | K80: 0 | L80: 476 | M80: 1 | N80: =IF(B80=C80,1,0) -> 1 | O80: =IF(I80=C80,1,0)-N80 -> 0 | P80: =IF(J80<C80,1,0) -> 0 | Q80: =M80-N80-O80 -> 0
A81: BPPC_1_6_2.txt | B81: 79 | C81: 80 | D81: 121 | E81: 425 | F81: 79.25 | G81: 0 | H81: 429 | I81: =MAX(B81,CEILING(F81,1)) -> 80 | J81: 80 | K81: 0 | L81: 429 | M81: 1 | N81: =IF(B81=C81,1,0) -> 0 | O81: =IF(I81=C81,1,0)-N81 -> 1 | P81: =IF(J81<C81,1,0) -> 0 | Q81: =M81-N81-O81 -> 0
A82: BPPC_1_6_3.txt | B82: 75 | C82: 75 | D82: 0 | E82: 452 | I82: =MAX(B82,CEILING(F82,1)) -> 75 | J82: 75 | K82: 0 | L82: 452 | M82: 1 | N82: =IF(B82=C82,1,0) -> 1 | O82: =IF(I82=C82,1,0)-N82 -> 0 | P82: =IF(J82<C82,1,0) -> 0 | Q82: =M82-N82-O82 -> 0
A83: BPPC_1_6_4.txt | B83: 69 | C83: 70 | D83: 121 | E83: 426 | F83: 69.214290000000005 | G83: 4 | H83: 465 | I83: =MAX(B83,CEILING(F83,1)) -> 70 | J83: 70 | K83: 4 | L83: 465 | M83: 1 | N83: =IF(B83=C83,1,0) -> 0 | O83: =IF(I83=C83,1,0)-N83 -> 1 | P83: =IF(J83<C83,1,0) -> 0 | Q83: =M83-N83-O83 -> 0
A84: BPPC_1_6_5.txt | B84: 72 | C84: 72 | D84: 0 | E84: 474 | I84: =MAX(B84,CEILING(F84,1)) -> 72 | J84: 72 | K84: 0 | L84: 474 | M84: 1 | N84: =IF(B84=C84,1,0) -> 1 | O84: =IF(I84=C84,1,0)-N84 -> 0 | P84: =IF(J84<C84,1,0) -> 0 | Q84: =M84-N84-O84 -> 0
A85: BPPC_1_6_6.txt | B85: 78 | C85: 78 | D85: 0 | E85: 433 | I85: =MAX(B85,CEILING(F85,1)) -> 78 | J85: 78 | K85: 0 | L85: 433 | M85: 1 | N85: =IF(B85=C85,1,0) -> 1 | O85: =IF(I85=C85,1,0)-N85 -> 0 | P85: =IF(J85<C85,1,0) -> 0 | Q85: =M85-N85-O85 -> 0
A86: BPPC_1_6_7.txt | B86: 73 | C86: 74 | D86: 121 | E86: 445 | F86: 73.416669999999996 | G86: 0 | H86: 456 | I86: =MAX(B86,CEILING(F86,1)) -> 74 | J86: 74 | K86: 0 | L86: 456 | M86: 1 | N86: =IF(B86=C86,1,0) -> 0 | O86: =IF(I86=C86,1,0)-N86 -> 1 | P86: =IF(J86<C86,1,0) -> 0 | Q86: =M86-N86-O86 -> 0
A87: BPPC_1_6_8.txt | B87: 80 | C87: 81 | D87: 121 | E87: 363 | F87: 81 | G87: 0 | H87: 363 | I87: =MAX(B87,CEILING(F87,1)) -> 81 | J87: 81 | K87: 0 | L87: 363 | M87: 1 | N87: =IF(B87=C87,1,0) -> 0 | O87: =IF(I87=C87,1,0)-N87 -> 1 | P87: =IF(J87<C87,1,0) -> 0 | Q87: =M87-N87-O87 -> 0
A88: BPPC_1_6_9.txt | B88: 78 | C88: 78 | D88: 0 | E88: 406 | I88: =MAX(B88,CEILING(F88,1)) -> 78 | J88: 78 | K88: 0 | L88: 406 | M88: 1 | N88: =IF(B88=C88,1,0) -> 1 | O88: =IF(I88=C88,1,0)-N88 -> 0 | P88: =IF(J88<C88,1,0) -> 0 | Q88: =M88-N88-O88 -> 0
A89: BPPC_1_6_10.txt | B89: 74 | C89: 74 | D89: 0 | E89: 489 | I89: =MAX(B89,CEILING(F89,1)) -> 74 | J89: 74 | K89: 0 | L89: 489 | M89: 1 | N89: =IF(B89=C89,1,0) -> 1 | O89: =IF(I89=C89,1,0)-N89 -> 0 | P89: =IF(J89<C89,1,0) -> 0 | Q89: =M89-N89-O89 -> 0
A90: BPPC_1_7_1.txt | B90: 87 | C90: 87 | D90: 0 | E90: 353 | I90: =MAX(B90,CEILING(F90,1)) -> 87 | J90: 87 | K90: 0 | L90: 353 | M90: 1 | N90: =IF(B90=C90,1,0) -> 1 | O90: =IF(I90=C90,1,0)-N90 -> 0 | P90: =IF(J90<C90,1,0) -> 0 | Q90: =M90-N90-O90 -> 0
A91: BPPC_1_7_2.txt | B91: 91 | C91: 91 | D91: 0 | E91: 338 | I91: =MAX(B91,CEILING(F91,1)) -> 91 | J91: 91 | K91: 0 | L91: 338 | M91: 1 | N91: =IF(B91=C91,1,0) -> 1 | O91: =IF(I91=C91,1,0)-N91 -> 0 | P91: =IF(J91<C91,1,0) -> 0 | Q91: =M91-N91-O91 -> 0
A92: BPPC_1_7_3.txt | B92: 88 | C92: 88 | D92: 0 | E92: 378 | I92: =MAX(B92,CEILING(F92,1)) -> 88 | J92: 88 | K92: 0 | L92: 378 | M92: 1 | N92: =IF(B92=C92,1,0) -> 1 | O92: =IF(I92=C92,1,0)-N92 -> 0 | P92: =IF(J92<C92,1,0) -> 0 | Q92: =M92-N92-O92 -> 0
A93: BPPC_1_7_4.txt | B93: 82 | C93: 82 | D93: 0 | E93: 394 | I93: =MAX(B93,CEILING(F93,1)) -> 82 | J93: 82 | K93: 0 | L93: 394 | M93: 1 | N93: =IF(B93=C93,1,0) -> 1 | O93: =IF(I93=C93,1,0)-N93 -> 0 | P93: =IF(J93<C93,1,0) -> 0 | Q93: =M93-N93-O93 -> 0
A94: BPPC_1_7_5.txt | B94: 85 | C94: 85 | D94: 0 | E94: 363 | I94: =MAX(B94,CEILING(F94,1)) -> 85 | J94: 85 | K94: 0 | L94: 363 | M94: 1 | N94: =IF(B94=C94,1,0) -> 1 | O94: =IF(I94=C94,1,0)-N94 -> 0 | P94: =IF(J94<C94,1,0) -> 0 | Q94: =M94-N94-O94 -> 0
A95: BPPC_1_7_6.txt | B95: 90 | C95: 90 | D95: 0 | E95: 355 | I95: =MAX(B95,CEILING(F95,1)) -> 90 | J95: 90 | K95: 0 | L95: 355 | M95: 1 | N95: =IF(B95=C95,1,0) -> 1 | O95: =IF(I95=C95,1,0)-N95 -> 0 | P95: =IF(J95<C95,1,0) -> 0 | Q95: =M95-N95-O95 -> 0
A96: BPPC_1_7_7.txt | B96: 86 | C96: 86 | D96: 0 | E96: 362 | I96: =MAX(B96,CEILING(F96,1)) -> 86 | J96: 86 | K96: 0 | L96: 362 | M96: 1 | N96: =IF(B96=C96,1,0) -> 1 | O96: =IF(I96=C96,1,0)-N96 -> 0 | P96: =IF(J96<C96,1,0) -> 0 | Q96: =M96-N96-O96 -> 0
A97: BPPC_1_7_8.txt | B97: 88 | C97: 88 | D97: 0 | E97: 301 | I97: =MAX(B97,CEILING(F97,1)) -> 88 | J97: 88 | K97: 0 | L97: 301 | M97: 1 | N97: =IF(B97=C97,1,0) -> 1 | O97: =IF(I97=C97,1,0)-N97 -> 0 | P97: =IF(J97<C97,1,0) -> 0 | Q97: =M97-N97-O97 -> 0
A98: BPPC_1_7_9.txt | B98: 93 | C98: 93 | D98: 0 | E98: 298 | I98: =MAX(B98,CEILING(F98,1)) -> 93 | J98: 93 | K98: 0 | L98: 298 | M98: 1 | N98: =IF(B98=C98,1,0) -> 1 | O98: =IF(I98=C98,1,0)-N98 -> 0 | P98: =IF(J98<C98,1,0) -> 0 | Q98: =M98-N98-O98 -> 0
A99: BPPC_1_7_10.txt | B99: 84 | C99: 85 | D99: 121 | E99: 360 | F99: 84.090909999999994 | G99: 0 | H99: 374 | I99: =MAX(B99,CEILING(F99,1)) -> 85 | J99: 85 | K99: 0 | L99: 374 | M99: 1 | N99: =IF(B99=C99,1,0) -> 0 | O99: =IF(I99=C99,1,0)-N99 -> 1 | P99: =IF(J99<C99,1,0) -> 0 | Q99: =M99-N99-O99 -> 0
A100: BPPC_1_8_1.txt | B100: 97 | C100: 97 | D100: 0 | E100: 256 | I100: =MAX(B100,CEILING(F100,1)) -> 97 | J100: 97 | K100: 0 | L100: 256 | M100: 1 | N100: =IF(B100=C100,1,0) -> 1 | O100: =IF(I100=C100,1,0)-N100 -> 0 | P100: =IF(J100<C100,1,0) -> 0 | Q100: =M100-N100-O100 -> 0
A101: BPPC_1_8_2.txt | B101: 98 | C101: 99 | D101: 121 | E101: 252 | F101: 98.5 | G101: 0 | H101: 253 | I101: =MAX(B101,CEILING(F101,1)) -> 99 | J101: 99 | K101: 0 | L101: 253 | M101: 1 | N101: =IF(B101=C101,1,0) -> 0 | O101: =IF(I101=C101,1,0)-N101 -> 1 | P101: =IF(J101<C101,1,0) -> 0 | Q101: =M101-N101-O101 -> 0
A102: BPPC_1_8_3.txt | B102: 98 | C102: 99 | D102: 121 | E102: 247 | F102: 98 | G102: 1 | H102: 260 | I102: =MAX(B102,CEILING(F102,1)) -> 98 | J102: 99 | K102: 2 | L102: 274 | M102: 1 | N102: =IF(B102=C102,1,0) -> 0 | O102: =IF(I102=C102,1,0)-N102 -> 0 | P102: =IF(J102<C102,1,0) -> 0 | Q102: =M102-N102-O102 -> 1
A103: BPPC_1_8_4.txt | B103: 94 | C103: 94 | D103: 0 | E103: 227 | I103: =MAX(B103,CEILING(F103,1)) -> 94 | J103: 94 | K103: 0 | L103: 227 | M103: 1 | N103: =IF(B103=C103,1,0) -> 1 | O103: =IF(I103=C103,1,0)-N103 -> 0 | P103: =IF(J103<C103,1,0) -> 0 | Q103: =M103-N103-O103 -> 0
A104: BPPC_1_8_5.txt | B104: 99 | C104: 99 | D104: 0 | E104: 239 | I104: =MAX(B104,CEILING(F104,1)) -> 99 | J104: 99 | K104: 0 | L104: 239 | M104: 1 | N104: =IF(B104=C104,1,0) -> 1 | O104: =IF(I104=C104,1,0)-N104 -> 0 | P104: =IF(J104<C104,1,0) -> 0 | Q104: =M104-N104-O104 -> 0
A105: BPPC_1_8_6.txt | B105: 99 | C105: 99 | D105: 1 | E105: 239 | I105: =MAX(B105,CEILING(F105,1)) -> 99 | J105: 99 | K105: 0 | L105: 239 | M105: 1 | N105: =IF(B105=C105,1,0) -> 1 | O105: =IF(I105=C105,1,0)-N105 -> 0 | P105: =IF(J105<C105,1,0) -> 0 | Q105: =M105-N105-O105 -> 0
A106: BPPC_1_8_7.txt | B106: 95 | C106: 95 | D106: 0 | E106: 285 | I106: =MAX(B106,CEILING(F106,1)) -> 95 | J106: 95 | K106: 0 | L106: 285 | M106: 1 | N106: =IF(B106=C106,1,0) -> 1 | O106: =IF(I106=C106,1,0)-N106 -> 0 | P106: =IF(J106<C106,1,0) -> 0 | Q106: =M106-N106-O106 -> 0
A107: BPPC_1_8_8.txt | B107: 98 | C107: 99 | D107: 121 | E107: 226 | F107: 98.222219999999993 | G107: 1 | H107: 248 | I107: =MAX(B107,CEILING(F107,1)) -> 99 | J107: 99 | K107: 1 | L107: 248 | M107: 1 | N107: =IF(B107=C107,1,0) -> 0 | O107: =IF(I107=C107,1,0)-N107 -> 1 | P107: =IF(J107<C107,1,0) -> 0 | Q107: =M107-N107-O107 -> 0
A108: BPPC_1_8_9.txt | B108: 104 | C108: 105 | D108: 121 | E108: 211 | F108: 105 | G108: 0 | H108: 211 | I108: =MAX(B108,CEILING(F108,1)) -> 105 | J108: 105 | K108: 0 | L108: 211 | M108: 1 | N108: =IF(B108=C108,1,0) -> 0 | O108: =IF(I108=C108,1,0)-N108 -> 1 | P108: =IF(J108<C108,1,0) -> 0 | Q108: =M108-N108-O108 -> 0
A109: BPPC_1_8_10.txt | B109: 97 | C109: 97 | D109: 0 | E109: 275 | I109: =MAX(B109,CEILING(F109,1)) -> 97 | J109: 97 | K109: 0 | L109: 275 | M109: 1 | N109: =IF(B109=C109,1,0) -> 1 | O109: =IF(I109=C109,1,0)-N109 -> 0 | P109: =IF(J109<C109,1,0) -> 0 | Q109: =M109-N109-O109 -> 0
A110: BPPC_1_9_1.txt | B110: 110 | C110: 110 | D110: 0 | E110: 159 | I110: =MAX(B110,CEILING(F110,1)) -> 110 | J110: 110 | K110: 0 | L110: 159 | M110: 1 | N110: =IF(B110=C110,1,0) -> 1 | O110: =IF(I110=C110,1,0)-N110 -> 0 | P110: =IF(J110<C110,1,0) -> 0 | Q110: =M110-N110-O110 -> 0
A111: BPPC_1_9_2.txt | B111: 106 | C111: 107 | D111: 121 | E111: 164 | F111: 106.16667 | G111: 0 | H111: 174 | I111: =MAX(B111,CEILING(F111,1)) -> 107 | J111: 107 | K111: 0 | L111: 174 | M111: 1 | N111: =IF(B111=C111,1,0) -> 0 | O111: =IF(I111=C111,1,0)-N111 -> 1 | P111: =IF(J111<C111,1,0) -> 0 | Q111: =M111-N111-O111 -> 0
A112: BPPC_1_9_3.txt | B112: 114 | C112: 114 | D112: 0 | E112: 141 | I112: =MAX(B112,CEILING(F112,1)) -> 114 | J112: 114 | K112: 0 | L112: 141 | M112: 1 | N112: =IF(B112=C112,1,0) -> 1 | O112: =IF(I112=C112,1,0)-N112 -> 0 | P112: =IF(J112<C112,1,0) -> 0 | Q112: =M112-N112-O112 -> 0
A113: BPPC_1_9_4.txt | B113: 110 | C113: 110 | D113: 0 | E113: 145 | I113: =MAX(B113,CEILING(F113,1)) -> 110 | J113: 110 | K113: 0 | L113: 145 | M113: 1 | N113: =IF(B113=C113,1,0) -> 1 | O113: =IF(I113=C113,1,0)-N113 -> 0 | P113: =IF(J113<C113,1,0) -> 0 | Q113: =M113-N113-O113 -> 0
A114: BPPC_1_9_5.txt | B114: 111 | C114: 111 | D114: 0 | E114: 143 | I114: =MAX(B114,CEILING(F114,1)) -> 111 | J114: 111 | K114: 0 | L114: 143 | M114: 1 | N114: =IF(B114=C114,1,0) -> 1 | O114: =IF(I114=C114,1,0)-N114 -> 0 | P114: =IF(J114<C114,1,0) -> 0 | Q114: =M114-N114-O114 -> 0
A115: BPPC_1_9_6.txt | B115: 110 | C115: 110 | D115: 0 | E115: 157 | I115: =MAX(B115,CEILING(F115,1)) -> 110 | J115: 110 | K115: 0 | L115: 157 | M115: 1 | N115: =IF(B115=C115,1,0) -> 1 | O115: =IF(I115=C115,1,0)-N115 -> 0 | P115: =IF(J115<C115,1,0) -> 0 | Q115: =M115-N115-O115 -> 0
A116: BPPC_1_9_7.txt | B116: 106 | C116: 107 | D116: 122 | E116: 180 | F116: 106.66667 | G116: 0 | H116: 185 | I116: =MAX(B116,CEILING(F116,1)) -> 107 | J116: 107 | K116: 0 | L116: 185 | M116: 1 | N116: =IF(B116=C116,1,0) -> 0 | O116: =IF(I116=C116,1,0)-N116 -> 1 | P116: =IF(J116<C116,1,0) -> 0 | Q116: =M116-N116-O116 -> 0
A117: BPPC_1_9_8.txt | B117: 110 | C117: 110 | D117: 0 | E117: 161 | I117: =MAX(B117,CEILING(F117,1)) -> 110 | J117: 110 | K117: 0 | L117: 161 | M117: 1 | N117: =IF(B117=C117,1,0) -> 1 | O117: =IF(I117=C117,1,0)-N117 -> 0 | P117: =IF(J117<C117,1,0) -> 0 | Q117: =M117-N117-O117 -> 0
A118: BPPC_1_9_9.txt | B118: 112 | C118: 112 | D118: 0 | E118: 138 | I118: =MAX(B118,CEILING(F118,1)) -> 112 | J118: 112 | K118: 0 | L118: 138 | M118: 1 | N118: =IF(B118=C118,1,0) -> 1 | O118: =IF(I118=C118,1,0)-N118 -> 0 | P118: =IF(J118<C118,1,0) -> 0 | Q118: =M118-N118-O118 -> 0
A119: BPPC_1_9_10.txt | B119: 106 | C119: 107 | D119: 121 | E119: 172 | F119: 106.44444 | G119: 0 | H119: 174 | I119: =MAX(B119,CEILING(F119,1)) -> 107 | J119: 107 | K119: 0 | L119: 174 | M119: 1 | N119: =IF(B119=C119,1,0) -> 0 | O119: =IF(I119=C119,1,0)-N119 -> 1 | P119: =IF(J119<C119,1,0) -> 0 | Q119: =M119-N119-O119 -> 0
A120: BPPC_2_0_1.txt | B120: 99 | C120: 99 | D120: 52 | E120: 429 | I120: =MAX(B120,CEILING(F120,1)) -> 99 | J120: 99 | K120: 0 | L120: 429 | M120: 1 | N120: =IF(B120=C120,1,0) -> 1 | O120: =IF(I120=C120,1,0)-N120 -> 0 | P120: =IF(J120<C120,1,0) -> 0 | Q120: =M120-N120-O120 -> 0
A121: BPPC_2_0_2.txt | B121: 100 | C121: 100 | D121: 0 | E121: 410 | I121: =MAX(B121,CEILING(F121,1)) -> 100 | J121: 100 | K121: 0 | L121: 410 | M121: 1 | N121: =IF(B121=C121,1,0) -> 1 | O121: =IF(I121=C121,1,0)-N121 -> 0 | P121: =IF(J121<C121,1,0) -> 0 | Q121: =M121-N121-O121 -> 0
A122: BPPC_2_0_3.txt | B122: 102 | C122: 103 | D122: 121 | E122: 404 | F122: 101.42177 | G122: 6 | H122: 843 | I122: =MAX(B122,CEILING(F122,1)) -> 102 | J122: 102 | K122: 41 | L122: 1910 | M122: 1 | N122: =IF(B122=C122,1,0) -> 0 | O122: =IF(I122=C122,1,0)-N122 -> 0 | P122: =IF(J122<C122,1,0) -> 1 | Q122: =M122-N122-O122 -> 1
A123: BPPC_2_0_4.txt | B123: 100 | C123: 100 | D123: 0 | E123: 388 | I123: =MAX(B123,CEILING(F123,1)) -> 100 | J123: 100 | K123: 1 | L123: 388 | M123: 1 | N123: =IF(B123=C123,1,0) -> 1 | O123: =IF(I123=C123,1,0)-N123 -> 0 | P123: =IF(J123<C123,1,0) -> 0 | Q123: =M123-N123-O123 -> 0
A124: BPPC_2_0_5.txt | B124: 101 | C124: 101 | D124: 110 | E124: 407 | I124: =MAX(B124,CEILING(F124,1)) -> 101 | J124: 101 | K124: 0 | L124: 407 | M124: 1 | N124: =IF(B124=C124,1,0) -> 1 | O124: =IF(I124=C124,1,0)-N124 -> 0 | P124: =IF(J124<C124,1,0) -> 0 | Q124: =M124-N124-O124 -> 0
A125: BPPC_2_0_6.txt | B125: 101 | C125: 102 | D125: 200 | E125: 453 | F125: 100.82666999999999 | G125: 5 | H125: 833 | I125: =MAX(B125,CEILING(F125,1)) -> 101 | J125: 101 | K125: 17 | L125: 1805 | M125: 1 | N125: =IF(B125=C125,1,0) -> 0 | O125: =IF(I125=C125,1,0)-N125 -> 0 | P125: =IF(J125<C125,1,0) -> 1 | Q125: =M125-N125-O125 -> 1
A126: BPPC_2_0_7.txt | B126: 102 | C126: 102 | D126: 0 | E126: 410 | I126: =MAX(B126,CEILING(F126,1)) -> 102 | J126: 102 | K126: 0 | L126: 410 | M126: 1 | N126: =IF(B126=C126,1,0) -> 1 | O126: =IF(I126=C126,1,0)-N126 -> 0 | P126: =IF(J126<C126,1,0) -> 0 | Q126: =M126-N126-O126 -> 0
A127: BPPC_2_0_8.txt | B127: 103 | C127: 104 | D127: 122 | E127: 405 | F127: 102.88518999999999 | G127: 10 | H127: 894 | I127: =MAX(B127,CEILING(F127,1)) -> 103 | J127: 103 | K127: 69 | L127: 1606 | M127: 1 | N127: =IF(B127=C127,1,0) -> 0 | O127: =IF(I127=C127,1,0)-N127 -> 0 | P127: =IF(J127<C127,1,0) -> 1 | Q127: =M127-N127-O127 -> 1
A128: BPPC_2_0_9.txt | B128: 105 | C128: 106 | D128: 122 | E128: 411 | F128: 104.91837 | G128: 4 | H128: 724 | I128: =MAX(B128,CEILING(F128,1)) -> 105 | J128: 105 | K128: 38 | L128: 1605 | M128: 1 | N128: =IF(B128=C128,1,0) -> 0 | O128: =IF(I128=C128,1,0)-N128 -> 0 | P128: =IF(J128<C128,1,0) -> 1 | Q128: =M128-N128-O128 -> 1
A129: BPPC_2_0_10.txt | B129: 101 | C129: 101 | D129: 1 | E129: 424 | I129: =MAX(B129,CEILING(F129,1)) -> 101 | J129: 101 | K129: 0 | L129: 424 | M129: 1 | N129: =IF(B129=C129,1,0) -> 1 | O129: =IF(I129=C129,1,0)-N129 -> 0 | P129: =IF(J129<C129,1,0) -> 0 | Q129: =M129-N129-O129 -> 0
A130: BPPC_2_1_1.txt | B130: 99 | C130: 99 | D130: 4 | E130: 961 | I130: =MAX(B130,CEILING(F130,1)) -> 99 | J130: 99 | K130: 0 | L130: 961 | M130: 1 | N130: =IF(B130=C130,1,0) -> 1 | O130: =IF(I130=C130,1,0)-N130 -> 0 | P130: =IF(J130<C130,1,0) -> 0 | Q130: =M130-N130-O130 -> 0
A131: BPPC_2_1_2.txt | B131: 100 | C131: 100 | D131: 0 | E131: 1053 | I131: =MAX(B131,CEILING(F131,1)) -> 100 | J131: 100 | K131: 0 | L131: 1053 | M131: 1 | N131: =IF(B131=C131,1,0) -> 1 | O131: =IF(I131=C131,1,0)-N131 -> 0 | P131: =IF(J131<C131,1,0) -> 0 | Q131: =M131-N131-O131 -> 0
A132: BPPC_2_1_3.txt | B132: 102 | C132: 102 | D132: 4 | E132: 1091 | I132: =MAX(B132,CEILING(F132,1)) -> 102 | J132: 102 | K132: 0 | L132: 1091 | M132: 1 | N132: =IF(B132=C132,1,0) -> 1 | O132: =IF(I132=C132,1,0)-N132 -> 0 | P132: =IF(J132<C132,1,0) -> 0 | Q132: =M132-N132-O132 -> 0
A133: BPPC_2_1_4.txt | B133: 100 | C133: 100 | D133: 1 | E133: 974 | I133: =MAX(B133,CEILING(F133,1)) -> 100 | J133: 100 | K133: 0 | L133: 974 | M133: 1 | N133: =IF(B133=C133,1,0) -> 1 | O133: =IF(I133=C133,1,0)-N133 -> 0 | P133: =IF(J133<C133,1,0) -> 0 | Q133: =M133-N133-O133 -> 0
A134: BPPC_2_1_5.txt | B134: 101 | C134: 101 | D134: 1 | E134: 861 | I134: =MAX(B134,CEILING(F134,1)) -> 101 | J134: 101 | K134: 0 | L134: 861 | M134: 1 | N134: =IF(B134=C134,1,0) -> 1 | O134: =IF(I134=C134,1,0)-N134 -> 0 | P134: =IF(J134<C134,1,0) -> 0 | Q134: =M134-N134-O134 -> 0
A135: BPPC_2_1_6.txt | B135: 101 | C135: 101 | D135: 27 | E135: 1211 | I135: =MAX(B135,CEILING(F135,1)) -> 101 | J135: 101 | K135: 0 | L135: 1211 | M135: 1 | N135: =IF(B135=C135,1,0) -> 1 | O135: =IF(I135=C135,1,0)-N135 -> 0 | P135: =IF(J135<C135,1,0) -> 0 | Q135: =M135-N135-O135 -> 0
A136: BPPC_2_1_7.txt | B136: 102 | C136: 102 | D136: 0 | E136: 937 | I136: =MAX(B136,CEILING(F136,1)) -> 102 | J136: 102 | K136: 0 | L136: 937 | M136: 1 | N136: =IF(B136=C136,1,0) -> 1 | O136: =IF(I136=C136,1,0)-N136 -> 0 | P136: =IF(J136<C136,1,0) -> 0 | Q136: =M136-N136-O136 -> 0
A137: BPPC_2_1_8.txt | B137: 103 | C137: 104 | D137: 121 | E137: 870 | F137: 102.88518999999999 | G137: 16 | H137: 1202 | I137: =MAX(B137,CEILING(F137,1)) -> 103 | J137: 103 | K137: 94 | L137: 2064 | M137: 1 | N137: =IF(B137=C137,1,0) -> 0 | O137: =IF(I137=C137,1,0)-N137 -> 0 | P137: =IF(J137<C137,1,0) -> 1 | Q137: =M137-N137-O137 -> 1
A138: BPPC_2_1_9.txt | B138: 105 | C138: 106 | D138: 121 | E138: 1103 | F138: 104.91837 | G138: 4 | H138: 1242 | I138: =MAX(B138,CEILING(F138,1)) -> 105 | J138: 105 | K138: 92 | L138: 2344 | M138: 1 | N138: =IF(B138=C138,1,0) -> 0 | O138: =IF(I138=C138,1,0)-N138 -> 0 | P138: =IF(J138<C138,1,0) -> 1 | Q138: =M138-N138-O138 -> 1
A139: BPPC_2_1_10.txt | B139: 101 | C139: 101 | D139: 1 | E139: 982 | I139: =MAX(B139,CEILING(F139,1)) -> 101 | J139: 101 | K139: 0 | L139: 982 | M139: 1 | N139: =IF(B139=C139,1,0) -> 1 | O139: =IF(I139=C139,1,0)-N139 -> 0 | P139: =IF(J139<C139,1,0) -> 0 | Q139: =M139-N139-O139 -> 0
A140: BPPC_2_2_1.txt | B140: 99 | C140: 99 | D140: 3 | E140: 1318 | I140: =MAX(B140,CEILING(F140,1)) -> 99 | J140: 99 | K140: 0 | L140: 1318 | M140: 1 | N140: =IF(B140=C140,1,0) -> 1 | O140: =IF(I140=C140,1,0)-N140 -> 0 | P140: =IF(J140<C140,1,0) -> 0 | Q140: =M140-N140-O140 -> 0
A141: BPPC_2_2_2.txt | B141: 100 | C141: 100 | D141: 1 | E141: 1735 | I141: =MAX(B141,CEILING(F141,1)) -> 100 | J141: 100 | K141: 0 | L141: 1735 | M141: 1 | N141: =IF(B141=C141,1,0) -> 1 | O141: =IF(I141=C141,1,0)-N141 -> 0 | P141: =IF(J141<C141,1,0) -> 0 | Q141: =M141-N141-O141 -> 0
A142: BPPC_2_2_3.txt | B142: 102 | C142: 102 | D142: 2 | E142: 1599 | I142: =MAX(B142,CEILING(F142,1)) -> 102 | J142: 102 | K142: 0 | L142: 1599 | M142: 1 | N142: =IF(B142=C142,1,0) -> 1 | O142: =IF(I142=C142,1,0)-N142 -> 0 | P142: =IF(J142<C142,1,0) -> 0 | Q142: =M142-N142-O142 -> 0
A143: BPPC_2_2_4.txt | B143: 100 | C143: 100 | D143: 1 | E143: 1351 | I143: =MAX(B143,CEILING(F143,1)) -> 100 | J143: 100 | K143: 0 | L143: 1351 | M143: 1 | N143: =IF(B143=C143,1,0) -> 1 | O143: =IF(I143=C143,1,0)-N143 -> 0 | P143: =IF(J143<C143,1,0) -> 0 | Q143: =M143-N143-O143 -> 0
A144: BPPC_2_2_5.txt | B144: 101 | C144: 101 | D144: 4 | E144: 1259 | I144: =MAX(B144,CEILING(F144,1)) -> 101 | J144: 101 | K144: 0 | L144: 1259 | M144: 1 | N144: =IF(B144=C144,1,0) -> 1 | O144: =IF(I144=C144,1,0)-N144 -> 0 | P144: =IF(J144<C144,1,0) -> 0 | Q144: =M144-N144-O144 -> 0
A145: BPPC_2_2_6.txt | B145: 101 | C145: 101 | D145: 11 | E145: 1512 | I145: =MAX(B145,CEILING(F145,1)) -> 101 | J145: 101 | K145: 0 | L145: 1512 | M145: 1 | N145: =IF(B145=C145,1,0) -> 1 | O145: =IF(I145=C145,1,0)-N145 -> 0 | P145: =IF(J145<C145,1,0) -> 0 | Q145: =M145-N145-O145 -> 0
A146: BPPC_2_2_7.txt | B146: 102 | C146: 102 | D146: 0 | E146: 1388 | I146: =MAX(B146,CEILING(F146,1)) -> 102 | J146: 102 | K146: 0 | L146: 1388 | M146: 1 | N146: =IF(B146=C146,1,0) -> 1 | O146: =IF(I146=C146,1,0)-N146 -> 0 | P146: =IF(J146<C146,1,0) -> 0 | Q146: =M146-N146-O146 -> 0
A147: BPPC_2_2_8.txt | B147: 103 | C147: 104 | D147: 121 | E147: 1271 | F147: 102.88518999999999 | G147: 15 | H147: 1487 | I147: =MAX(B147,CEILING(F147,1)) -> 103 | J147: 103 | K147: 255 | L147: 2565 | M147: 1 | N147: =IF(B147=C147,1,0) -> 0 | O147: =IF(I147=C147,1,0)-N147 -> 0 | P147: =IF(J147<C147,1,0) -> 1 | Q147: =M147-N147-O147 -> 1
A148: BPPC_2_2_9.txt | B148: 105 | C148: 106 | D148: 121 | E148: 1559 | F148: 104.93197000000001 | G148: 7 | H148: 1663 | I148: =MAX(B148,CEILING(F148,1)) -> 105 | J148: 105 | K148: 147 | L148: 2692 | M148: 1 | N148: =IF(B148=C148,1,0) -> 0 | O148: =IF(I148=C148,1,0)-N148 -> 0 | P148: =IF(J148<C148,1,0) -> 1 | Q148: =M148-N148-O148 -> 1
A149: BPPC_2_2_10.txt | B149: 101 | C149: 101 | D149: 1 | E149: 1556 | I149: =MAX(B149,CEILING(F149,1)) -> 101 | J149: 101 | K149: 0 | L149: 1556 | M149: 1 | N149: =IF(B149=C149,1,0) -> 1 | O149: =IF(I149=C149,1,0)-N149 -> 0 | P149: =IF(J149<C149,1,0) -> 0 | Q149: =M149-N149-O149 -> 0
A150: BPPC_2_3_1.txt | B150: 99 | C150: 99 | D150: 5 | E150: 1725 | I150: =MAX(B150,CEILING(F150,1)) -> 99 | J150: 99 | K150: 0 | L150: 1725 | M150: 1 | N150: =IF(B150=C150,1,0) -> 1 | O150: =IF(I150=C150,1,0)-N150 -> 0 | P150: =IF(J150<C150,1,0) -> 0 | Q150: =M150-N150-O150 -> 0
A151: BPPC_2_3_2.txt | B151: 100 | C151: 100 | D151: 2 | E151: 1787 | I151: =MAX(B151,CEILING(F151,1)) -> 100 | J151: 100 | K151: 0 | L151: 1787 | M151: 1 | N151: =IF(B151=C151,1,0) -> 1 | O151: =IF(I151=C151,1,0)-N151 -> 0 | P151: =IF(J151<C151,1,0) -> 0 | Q151: =M151-N151-O151 -> 0
A152: BPPC_2_3_3.txt | B152: 102 | C152: 102 | D152: 4 | E152: 1780 | I152: =MAX(B152,CEILING(F152,1)) -> 102 | J152: 102 | K152: 0 | L152: 1780 | M152: 1 | N152: =IF(B152=C152,1,0) -> 1 | O152: =IF(I152=C152,1,0)-N152 -> 0 | P152: =IF(J152<C152,1,0) -> 0 | Q152: =M152-N152-O152 -> 0
A153: BPPC_2_3_4.txt | B153: 100 | C153: 100 | D153: 1 | E153: 1540 | I153: =MAX(B153,CEILING(F153,1)) -> 100 | J153: 100 | K153: 0 | L153: 1540 | M153: 1 | N153: =IF(B153=C153,1,0) -> 1 | O153: =IF(I153=C153,1,0)-N153 -> 0 | P153: =IF(J153<C153,1,0) -> 0 | Q153: =M153-N153-O153 -> 0
A154: BPPC_2_3_5.txt | B154: 101 | C154: 101 | D154: 5 | E154: 1738 | I154: =MAX(B154,CEILING(F154,1)) -> 101 | J154: 101 | K154: 0 | L154: 1738 | M154: 1 | N154: =IF(B154=C154,1,0) -> 1 | O154: =IF(I154=C154,1,0)-N154 -> 0 | P154: =IF(J154<C154,1,0) -> 0 | Q154: =M154-N154-O154 -> 0
A155: BPPC_2_3_6.txt | B155: 101 | C155: 102 | D155: 121 | E155: 1724 | F155: 100.84354 | G155: 35 | H155: 1956 | I155: =MAX(B155,CEILING(F155,1)) -> 101 | J155: 101 | K155: 218 | L155: 2807 | M155: 1 | N155: =IF(B155=C155,1,0) -> 0 | O155: =IF(I155=C155,1,0)-N155 -> 0 | P155: =IF(J155<C155,1,0) -> 1 | Q155: =M155-N155-O155 -> 1
A156: BPPC_2_3_7.txt | B156: 102 | C156: 102 | D156: 1 | E156: 1704 | I156: =MAX(B156,CEILING(F156,1)) -> 102 | J156: 102 | K156: 0 | L156: 1704 | M156: 1 | N156: =IF(B156=C156,1,0) -> 1 | O156: =IF(I156=C156,1,0)-N156 -> 0 | P156: =IF(J156<C156,1,0) -> 0 | Q156: =M156-N156-O156 -> 0
A157: BPPC_2_3_8.txt | B157: 103 | C157: 104 | D157: 121 | E157: 1621 | F157: 102.91110999999999 | G157: 34 | H157: 1852 | I157: =MAX(B157,CEILING(F157,1)) -> 103 | J157: 103 | K157: 413 | L157: 2654 | M157: 1 | N157: =IF(B157=C157,1,0) -> 0 | O157: =IF(I157=C157,1,0)-N157 -> 0 | P157: =IF(J157<C157,1,0) -> 1 | Q157: =M157-N157-O157 -> 1
A158: BPPC_2_3_9.txt | B158: 105 | C158: 106 | D158: 123 | E158: 1610 | F158: 104.98936 | G158: 195 | H158: 1906 | I158: =MAX(B158,CEILING(F158,1)) -> 105 | J158: 105 | K158: 833 | L158: 2540 | M158: 1 | N158: =IF(B158=C158,1,0) -> 0 | O158: =IF(I158=C158,1,0)-N158 -> 0 | P158: =IF(J158<C158,1,0) -> 1 | Q158: =M158-N158-O158 -> 1
A159: BPPC_2_3_10.txt | B159: 101 | C159: 101 | D159: 1 | E159: 1666 | I159: =MAX(B159,CEILING(F159,1)) -> 101 | J159: 101 | K159: 0 | L159: 1666 | M159: 1 | N159: =IF(B159=C159,1,0) -> 1 | O159: =IF(I159=C159,1,0)-N159 -> 0 | P159: =IF(J159<C159,1,0) -> 0 | Q159: =M159-N159-O159 -> 0
A160: BPPC_2_4_1.txt | B160: 99 | C160: 99 | D160: 10 | E160: 1654 | I160: =MAX(B160,CEILING(F160,1)) -> 99 | J160: 99 | K160: 0 | L160: 1654 | M160: 1 | N160: =IF(B160=C160,1,0) -> 1 | O160: =IF(I160=C160,1,0)-N160 -> 0 | P160: =IF(J160<C160,1,0) -> 0 | Q160: =M160-N160-O160 -> 0
A161: BPPC_2_4_2.txt | B161: 105 | C161: 107 | D161: 121 | E161: 1669 | F161: 106 | G161: 0 | H161: 1670 | I161: =MAX(B161,CEILING(F161,1)) -> 106 | J161: 106 | K161: 5 | L161: 1680 | M161: 1 | N161: =IF(B161=C161,1,0) -> 0 | O161: =IF(I161=C161,1,0)-N161 -> 0 | P161: =IF(J161<C161,1,0) -> 1 | Q161: =M161-N161-O161 -> 1
A162: BPPC_2_4_3.txt | B162: 102 | C162: 103 | D162: 121 | E162: 1688 | F162: 101.5158 | G162: 284 | H162: 2077 | I162: =MAX(B162,CEILING(F162,1)) -> 102 | J162: 102 | K162: 1644 | L162: 3108 | M162: 1 | N162: =IF(B162=C162,1,0) -> 0 | O162: =IF(I162=C162,1,0)-N162 -> 0 | P162: =IF(J162<C162,1,0) -> 1 | Q162: =M162-N162-O162 -> 1
A163: BPPC_2_4_4.txt | B163: 103 | C163: 104 | D163: 121 | E163: 1607 | F163: 103 | G163: 0 | H163: 1614 | I163: =MAX(B163,CEILING(F163,1)) -> 103 | J163: 103 | K163: 15 | L163: 1737 | M163: 1 | N163: =IF(B163=C163,1,0) -> 0 | O163: =IF(I163=C163,1,0)-N163 -> 0 | P163: =IF(J163<C163,1,0) -> 1 | Q163: =M163-N163-O163 -> 1
A164: BPPC_2_4_5.txt | B164: 101 | C164: 103 | D164: 121 | E164: 1742 | F164: 101.5 | G164: 41 | H164: 1824 | I164: =MAX(B164,CEILING(F164,1)) -> 102 | J164: 102 | K164: 217 | L164: 2396 | M164: 1 | N164: =IF(B164=C164,1,0) -> 0 | O164: =IF(I164=C164,1,0)-N164 -> 0 | P164: =IF(J164<C164,1,0) -> 1 | Q164: =M164-N164-O164 -> 1
A165: BPPC_2_4_6.txt | B165: 109 | C165: 109 | D165: 0 | E165: 1687 | I165: =MAX(B165,CEILING(F165,1)) -> 109 | J165: 109 | K165: 0 | L165: 1687 | M165: 1 | N165: =IF(B165=C165,1,0) -> 1 | O165: =IF(I165=C165,1,0)-N165 -> 0 | P165: =IF(J165<C165,1,0) -> 0 | Q165: =M165-N165-O165 -> 0
A166: BPPC_2_4_7.txt | B166: 103 | C166: 105 | D166: 121 | E166: 1737 | F166: 102.625 | G166: 0 | H166: 1738 | I166: =MAX(B166,CEILING(F166,1)) -> 103 | J166: 103 | K166: 20 | L166: 1900 | M166: 1 | N166: =IF(B166=C166,1,0) -> 0 | O166: =IF(I166=C166,1,0)-N166 -> 0 | P166: =IF(J166<C166,1,0) -> 1 | Q166: =M166-N166-O166 -> 1
A167: BPPC_2_4_8.txt | B167: 103 | C167: 105 | D167: 122 | E167: 1741 | F167: 103.02857 | G167: 92 | H167: 2012 | I167: =MAX(B167,CEILING(F167,1)) -> 104 | J167: 104 | K167: 550 | L167: 3075 | M167: 1 | N167: =IF(B167=C167,1,0) -> 0 | O167: =IF(I167=C167,1,0)-N167 -> 0 | P167: =IF(J167<C167,1,0) -> 1 | Q167: =M167-N167-O167 -> 1
A168: BPPC_2_4_9.txt | B168: 115 | C168: 116 | D168: 121 | E168: 1580 | F168: 115.27778000000001 | G168: 1 | H168: 1588 | I168: =MAX(B168,CEILING(F168,1)) -> 116 | J168: 116 | K168: 1 | L168: 1588 | M168: 1 | N168: =IF(B168=C168,1,0) -> 0 | O168: =IF(I168=C168,1,0)-N168 -> 1 | P168: =IF(J168<C168,1,0) -> 0 | Q168: =M168-N168-O168 -> 0
A169: BPPC_2_4_10.txt | B169: 104 | C169: 104 | D169: 0 | E169: 1628 | I169: =MAX(B169,CEILING(F169,1)) -> 104 | J169: 104 | K169: 0 | L169: 1628 | M169: 1 | N169: =IF(B169=C169,1,0) -> 1 | O169: =IF(I169=C169,1,0)-N169 -> 0 | P169: =IF(J169<C169,1,0) -> 0 | Q169: =M169-N169-O169 -> 0
A170: BPPC_2_5_1.txt | B170: 111 | C170: 111 | D170: 9 | E170: 1521 | I170: =MAX(B170,CEILING(F170,1)) -> 111 | J170: 111 | K170: 0 | L170: 1521 | M170: 1 | N170: =IF(B170=C170,1,0) -> 1 | O170: =IF(I170=C170,1,0)-N170 -> 0 | P170: =IF(J170<C170,1,0) -> 0 | Q170: =M170-N170-O170 -> 0
A171: BPPC_2_5_2.txt | B171: 130 | C171: 131 | D171: 121 | E171: 1307 | F171: 130.2 | G171: 0 | H171: 1307 | I171: =MAX(B171,CEILING(F171,1)) -> 131 | J171: 131 | K171: 0 | L171: 1307 | M171: 1 | N171: =IF(B171=C171,1,0) -> 0 | O171: =IF(I171=C171,1,0)-N171 -> 1 | P171: =IF(J171<C171,1,0) -> 0 | Q171: =M171-N171-O171 -> 0
A172: BPPC_2_5_3.txt | B172: 118 | C172: 118 | D172: 0 | E172: 1385 | I172: =MAX(B172,CEILING(F172,1)) -> 118 | J172: 118 | K172: 0 | L172: 1385 | M172: 1 | N172: =IF(B172=C172,1,0) -> 1 | O172: =IF(I172=C172,1,0)-N172 -> 0 | P172: =IF(J172<C172,1,0) -> 0 | Q172: =M172-N172-O172 -> 0
A173: BPPC_2_5_4.txt | B173: 132 | C173: 132 | D173: 0 | E173: 1266 | I173: =MAX(B173,CEILING(F173,1)) -> 132 | J173: 132 | K173: 0 | L173: 1266 | M173: 1 | N173: =IF(B173=C173,1,0) -> 1 | O173: =IF(I173=C173,1,0)-N173 -> 0 | P173: =IF(J173<C173,1,0) -> 0 | Q173: =M173-N173-O173 -> 0
A174: BPPC_2_5_5.txt | B174: 127 | C174: 127 | D174: 0 | E174: 1379 | I174: =MAX(B174,CEILING(F174,1)) -> 127 | J174: 127 | K174: 0 | L174: 1379 | M174: 1 | N174: =IF(B174=C174,1,0) -> 1 | O174: =IF(I174=C174,1,0)-N174 -> 0 | P174: =IF(J174<C174,1,0) -> 0 | Q174: =M174-N174-O174 -> 0
A175: BPPC_2_5_6.txt | B175: 129 | C175: 130 | D175: 122 | E175: 1328 | F175: 129 | G175: 0 | H175: 1328 | I175: =MAX(B175,CEILING(F175,1)) -> 129 | J175: 129 | K175: 3 | L175: 1335 | M175: 1 | N175: =IF(B175=C175,1,0) -> 0 | O175: =IF(I175=C175,1,0)-N175 -> 0 | P175: =IF(J175<C175,1,0) -> 1 | Q175: =M175-N175-O175 -> 1
A176: BPPC_2_5_7.txt | B176: 126 | C176: 126 | D176: 1 | E176: 1418 | I176: =MAX(B176,CEILING(F176,1)) -> 126 | J176: 126 | K176: 0 | L176: 1418 | M176: 1 | N176: =IF(B176=C176,1,0) -> 1 | O176: =IF(I176=C176,1,0)-N176 -> 0 | P176: =IF(J176<C176,1,0) -> 0 | Q176: =M176-N176-O176 -> 0
A177: BPPC_2_5_8.txt | B177: 115 | C177: 115 | D177: 0 | E177: 1390 | I177: =MAX(B177,CEILING(F177,1)) -> 115 | J177: 115 | K177: 0 | L177: 1390 | M177: 1 | N177: =IF(B177=C177,1,0) -> 1 | O177: =IF(I177=C177,1,0)-N177 -> 0 | P177: =IF(J177<C177,1,0) -> 0 | Q177: =M177-N177-O177 -> 0
A178: BPPC_2_5_9.txt | B178: 143 | C178: 143 | D178: 0 | E178: 1166 | I178: =MAX(B178,CEILING(F178,1)) -> 143 | J178: 143 | K178: 0 | L178: 1166 | M178: 1 | N178: =IF(B178=C178,1,0) -> 1 | O178: =IF(I178=C178,1,0)-N178 -> 0 | P178: =IF(J178<C178,1,0) -> 0 | Q178: =M178-N178-O178 -> 0
A179: BPPC_2_5_10.txt | B179: 126 | C179: 128 | D179: 122 | E179: 1305 | F179: 127.125 | G179: 0 | H179: 1310 | I179: =MAX(B179,CEILING(F179,1)) -> 128 | J179: 128 | K179: 0 | L179: 1310 | M179: 1 | N179: =IF(B179=C179,1,0) -> 0 | O179: =IF(I179=C179,1,0)-N179 -> 1 | P179: =IF(J179<C179,1,0) -> 0 | Q179: =M179-N179-O179 -> 0
A180: BPPC_2_6_1.txt | B180: 146 | C180: 146 | D180: 1 | E180: 1268 | I180: =MAX(B180,CEILING(F180,1)) -> 146 | J180: 146 | K180: 0 | L180: 1268 | M180: 1 | N180: =IF(B180=C180,1,0) -> 1 | O180: =IF(I180=C180,1,0)-N180 -> 0 | P180: =IF(J180<C180,1,0) -> 0 | Q180: =M180-N180-O180 -> 0
A181: BPPC_2_6_2.txt | B181: 156 | C181: 157 | D181: 121 | E181: 1092 | F181: 157 | G181: 0 | H181: 1092 | I181: =MAX(B181,CEILING(F181,1)) -> 157 | J181: 157 | K181: 0 | L181: 1092 | M181: 1 | N181: =IF(B181=C181,1,0) -> 0 | O181: =IF(I181=C181,1,0)-N181 -> 1 | P181: =IF(J181<C181,1,0) -> 0 | Q181: =M181-N181-O181 -> 0
A182: BPPC_2_6_3.txt | B182: 149 | C182: 149 | D182: 0 | E182: 1129 | I182: =MAX(B182,CEILING(F182,1)) -> 149 | J182: 149 | K182: 0 | L182: 1129 | M182: 1 | N182: =IF(B182=C182,1,0) -> 1 | O182: =IF(I182=C182,1,0)-N182 -> 0 | P182: =IF(J182<C182,1,0) -> 0 | Q182: =M182-N182-O182 -> 0
A183: BPPC_2_6_4.txt | B183: 157 | C183: 158 | D183: 121 | E183: 1072 | F183: 157.25 | G183: 0 | H183: 1072 | I183: =MAX(B183,CEILING(F183,1)) -> 158 | J183: 158 | K183: 0 | L183: 1072 | M183: 1 | N183: =IF(B183=C183,1,0) -> 0 | O183: =IF(I183=C183,1,0)-N183 -> 1 | P183: =IF(J183<C183,1,0) -> 0 | Q183: =M183-N183-O183 -> 0
A184: BPPC_2_6_5.txt | B184: 152 | C184: 153 | D184: 121 | E184: 1084 | F184: 152 | G184: 1 | H184: 1092 | I184: =MAX(B184,CEILING(F184,1)) -> 152 | J184: 152 | K184: 4 | L184: 1104 | M184: 1 | N184: =IF(B184=C184,1,0) -> 0 | O184: =IF(I184=C184,1,0)-N184 -> 0 | P184: =IF(J184<C184,1,0) -> 1 | Q184: =M184-N184-O184 -> 1
A185: BPPC_2_6_6.txt | B185: 153 | C185: 153 | D185: 0 | E185: 1136 | I185: =MAX(B185,CEILING(F185,1)) -> 153 | J185: 153 | K185: 0 | L185: 1136 | M185: 1 | N185: =IF(B185=C185,1,0) -> 1 | O185: =IF(I185=C185,1,0)-N185 -> 0 | P185: =IF(J185<C185,1,0) -> 0 | Q185: =M185-N185-O185 -> 0
A186: BPPC_2_6_7.txt | B186: 147 | C186: 147 | D186: 1 | E186: 1268 | I186: =MAX(B186,CEILING(F186,1)) -> 147 | J186: 147 | K186: 0 | L186: 1268 | M186: 1 | N186: =IF(B186=C186,1,0) -> 1 | O186: =IF(I186=C186,1,0)-N186 -> 0 | P186: =IF(J186<C186,1,0) -> 0 | Q186: =M186-N186-O186 -> 0
A187: BPPC_2_6_8.txt | B187: 137 | C187: 140 | D187: 121 | E187: 1163 | F187: 138.5 | G187: 0 | H187: 1163 | I187: =MAX(B187,CEILING(F187,1)) -> 139 | J187: 139 | K187: 3 | L187: 1169 | M187: 1 | N187: =IF(B187=C187,1,0) -> 0 | O187: =IF(I187=C187,1,0)-N187 -> 0 | P187: =IF(J187<C187,1,0) -> 1 | Q187: =M187-N187-O187 -> 1
A188: BPPC_2_6_9.txt | B188: 165 | C188: 166 | D188: 122 | E188: 946 | F188: 165.5 | G188: 0 | H188: 947 | I188: =MAX(B188,CEILING(F188,1)) -> 166 | J188: 166 | K188: 0 | L188: 947 | M188: 1 | N188: =IF(B188=C188,1,0) -> 0 | O188: =IF(I188=C188,1,0)-N188 -> 1 | P188: =IF(J188<C188,1,0) -> 0 | Q188: =M188-N188-O188 -> 0
A189: BPPC_2_6_10.txt | B189: 155 | C189: 155 | D189: 0 | E189: 1060 | I189: =MAX(B189,CEILING(F189,1)) -> 155 | J189: 155 | K189: 0 | L189: 1060 | M189: 1 | N189: =IF(B189=C189,1,0) -> 1 | O189: =IF(I189=C189,1,0)-N189 -> 0 | P189: =IF(J189<C189,1,0) -> 0 | Q189: =M189-N189-O189 -> 0
A190: BPPC_2_7_1.txt | B190: 174 | C190: 175 | D190: 122 | E190: 998 | F190: 174.2 | G190: 0 | H190: 1003 | I190: =MAX(B190,CEILING(F190,1)) -> 175 | J190: 175 | K190: 0 | L190: 1003 | M190: 1 | N190: =IF(B190=C190,1,0) -> 0 | O190: =IF(I190=C190,1,0)-N190 -> 1 | P190: =IF(J190<C190,1,0) -> 0 | Q190: =M190-N190-O190 -> 0
A191: BPPC_2_7_2.txt | B191: 180 | C191: 180 | D191: 1 | E191: 816 | I191: =MAX(B191,CEILING(F191,1)) -> 180 | J191: 180 | K191: 0 | L191: 816 | M191: 1 | N191: =IF(B191=C191,1,0) -> 1 | O191: =IF(I191=C191,1,0)-N191 -> 0 | P191: =IF(J191<C191,1,0) -> 0 | Q191: =M191-N191-O191 -> 0
A192: BPPC_2_7_3.txt | B192: 173 | C192: 174 | D192: 121 | E192: 866 | F192: 173.25 | G192: 0 | H192: 869 | I192: =MAX(B192,CEILING(F192,1)) -> 174 | J192: 174 | K192: 0 | L192: 869 | M192: 1 | N192: =IF(B192=C192,1,0) -> 0 | O192: =IF(I192=C192,1,0)-N192 -> 1 | P192: =IF(J192<C192,1,0) -> 0 | Q192: =M192-N192-O192 -> 0
A193: BPPC_2_7_4.txt | B193: 180 | C193: 181 | D193: 122 | E193: 787 | F193: 180 | G193: 0 | H193: 791 | I193: =MAX(B193,CEILING(F193,1)) -> 180 | J193: 180 | K193: 0 | L193: 791 | M193: 1 | N193: =IF(B193=C193,1,0) -> 0 | O193: 1 | P193: 0 | Q193: 0
A194: BPPC_2_7_5.txt | B194: 181 | C194: 181 | D194: 1 | E194: 820 | I194: =MAX(B194,CEILING(F194,1)) -> 181 | J194: 181 | K194: 0 | L194: 820 | M194: 1 | N194: =IF(B194=C194,1,0) -> 1 | O194: =IF(I194=C194,1,0)-N194 -> 0 | P194: =IF(J194<C194,1,0) -> 0 | Q194: =M194-N194-O194 -> 0
A195: BPPC_2_7_6.txt | B195: 175 | C195: 176 | D195: 122 | E195: 856 | F195: 176 | G195: 0 | H195: 856 | I195: =MAX(B195,CEILING(F195,1)) -> 176 | J195: 176 | K195: 0 | L195: 856 | M195: 1 | N195: =IF(B195=C195,1,0) -> 0 | O195: =IF(I195=C195,1,0)-N195 -> 1 | P195: =IF(J195<C195,1,0) -> 0 | Q195: =M195-N195-O195 -> 0
A196: BPPC_2_7_7.txt | B196: 168 | C196: 170 | D196: 122 | E196: 925 | F196: 168.54761999999999 | G196: 189 | H196: 1018 | I196: =MAX(B196,CEILING(F196,1)) -> 169 | J196: 169 | K196: 628 | L196: 1245 | M196: 1 | N196: =IF(B196=C196,1,0) -> 0 | O196: =IF(I196=C196,1,0)-N196 -> 0 | P196: =IF(J196<C196,1,0) -> 1 | Q196: =M196-N196-O196 -> 1
A197: BPPC_2_7_8.txt | B197: 163 | C197: 164 | D197: 122 | E197: 897 | F197: 164 | G197: 0 | H197: 897 | I197: =MAX(B197,CEILING(F197,1)) -> 164 | J197: 164 | K197: 0 | L197: 897 | M197: 1 | N197: =IF(B197=C197,1,0) -> 0 | O197: =IF(I197=C197,1,0)-N197 -> 1 | P197: =IF(J197<C197,1,0) -> 0 | Q197: =M197-N197-O197 -> 0
A198: BPPC_2_7_9.txt | B198: 186 | C198: 187 | D198: 121 | E198: 707 | F198: 187 | G198: 0 | H198: 707 | I198: =MAX(B198,CEILING(F198,1)) -> 187 | J198: 187 | K198: 0 | L198: 707 | M198: 1 | N198: =IF(B198=C198,1,0) -> 0 | O198: =IF(I198=C198,1,0)-N198 -> 1 | P198: =IF(J198<C198,1,0) -> 0 | Q198: =M198-N198-O198 -> 0
A199: BPPC_2_7_10.txt | B199: 182 | C199: 183 | D199: 121 | E199: 875 | F199: 182.5 | G199: 0 | H199: 875 | I199: =MAX(B199,CEILING(F199,1)) -> 183 | J199: 183 | K199: 0 | L199: 875 | M199: 1 | N199: =IF(B199=C199,1,0) -> 0 | O199: =IF(I199=C199,1,0)-N199 -> 1 | P199: =IF(J199<C199,1,0) -> 0 | Q199: =M199-N199-O199 -> 0
A200: BPPC_2_8_1.txt | B200: 196 | C200: 197 | D200: 121 | E200: 718 | F200: 197 | G200: 0 | H200: 718 | I200: =MAX(B200,CEILING(F200,1)) -> 197 | J200: 197 | K200: 0 | L200: 718 | M200: 1 | N200: =IF(B200=C200,1,0) -> 0 | O200: =IF(I200=C200,1,0)-N200 -> 1 | P200: =IF(J200<C200,1,0) -> 0 | Q200: =M200-N200-O200 -> 0
A201: BPPC_2_8_2.txt | B201: 208 | C201: 208 | D201: 0 | E201: 632 | I201: =MAX(B201,CEILING(F201,1)) -> 208 | J201: 208 | K201: 0 | L201: 632 | M201: 1 | N201: =IF(B201=C201,1,0) -> 1 | O201: =IF(I201=C201,1,0)-N201 -> 0 | P201: =IF(J201<C201,1,0) -> 0 | Q201: =M201-N201-O201 -> 0
A202: BPPC_2_8_3.txt | B202: 204 | C202: 205 | D202: 122 | E202: 591 | F202: 205 | G202: 0 | H202: 591 | I202: =MAX(B202,CEILING(F202,1)) -> 205 | J202: 205 | K202: 0 | L202: 591 | M202: 1 | N202: =IF(B202=C202,1,0) -> 0 | O202: =IF(I202=C202,1,0)-N202 -> 1 | P202: =IF(J202<C202,1,0) -> 0 | Q202: =M202-N202-O202 -> 0
A203: BPPC_2_8_4.txt | B203: 210 | C203: 210 | D203: 0 | E203: 588 | I203: =MAX(B203,CEILING(F203,1)) -> 210 | J203: 210 | K203: 0 | L203: 588 | M203: 1 | N203: =IF(B203=C203,1,0) -> 1 | O203: =IF(I203=C203,1,0)-N203 -> 0 | P203: =IF(J203<C203,1,0) -> 0 | Q203: =M203-N203-O203 -> 0
A204: BPPC_2_8_5.txt | B204: 205 | C204: 205 | D204: 1 | E204: 557 | I204: =MAX(B204,CEILING(F204,1)) -> 205 | J204: 205 | K204: 0 | L204: 557 | M204: 1 | N204: =IF(B204=C204,1,0) -> 1 | O204: =IF(I204=C204,1,0)-N204 -> 0 | P204: =IF(J204<C204,1,0) -> 0 | Q204: =M204-N204-O204 -> 0
A205: BPPC_2_8_6.txt | B205: 202 | C205: 202 | D205: 1 | E205: 580 | I205: =MAX(B205,CEILING(F205,1)) -> 202 | J205: 202 | K205: 0 | L205: 580 | M205: 1 | N205: =IF(B205=C205,1,0) -> 1 | O205: =IF(I205=C205,1,0)-N205 -> 0 | P205: =IF(J205<C205,1,0) -> 0 | Q205: =M205-N205-O205 -> 0
A206: BPPC_2_8_7.txt | B206: 192 | C206: 193 | D206: 122 | E206: 685 | F206: 191.84614999999999 | G206: 110 | H206: 747 | I206: =MAX(B206,CEILING(F206,1)) -> 192 | J206: 192 | K206: 167 | L206: 777 | M206: 1 | N206: =IF(B206=C206,1,0) -> 0 | O206: =IF(I206=C206,1,0)-N206 -> 0 | P206: =IF(J206<C206,1,0) -> 1 | Q206: =M206-N206-O206 -> 1
A207: BPPC_2_8_8.txt | B207: 191 | C207: 191 | D207: 0 | E207: 720 | I207: =MAX(B207,CEILING(F207,1)) -> 191 | J207: 191 | K207: 0 | L207: 720 | M207: 1 | N207: =IF(B207=C207,1,0) -> 1 | O207: =IF(I207=C207,1,0)-N207 -> 0 | P207: =IF(J207<C207,1,0) -> 0 | Q207: =M207-N207-O207 -> 0
A208: BPPC_2_8_9.txt | B208: 208 | C208: 209 | D208: 122 | E208: 506 | F208: 208.08332999999999 | G208: 1 | H208: 513 | I208: =MAX(B208,CEILING(F208,1)) -> 209 | J208: 209 | K208: 1 | L208: 513 | M208: 1 | N208: =IF(B208=C208,1,0) -> 0 | O208: =IF(I208=C208,1,0)-N208 -> 1 | P208: =IF(J208<C208,1,0) -> 0 | Q208: =M208-N208-O208 -> 0
A209: BPPC_2_8_10.txt | B209: 207 | C209: 207 | D209: 0 | E209: 586 | I209: =MAX(B209,CEILING(F209,1)) -> 207 | J209: 207 | K209: 0 | L209: 586 | M209: 1 | N209: =IF(B209=C209,1,0) -> 1 | O209: =IF(I209=C209,1,0)-N209 -> 0 | P209: =IF(J209<C209,1,0) -> 0 | Q209: =M209-N209-O209 -> 0
A210: BPPC_2_9_1.txt | B210: 217 | C210: 218 | D210: 122 | E210: 448 | F210: 217.11348000000001 | G210: 24 | H210: 478 | I210: =MAX(B210,CEILING(F210,1)) -> 218 | J210: 218 | K210: 24 | L210: 478 | M210: 1 | N210: =IF(B210=C210,1,0) -> 0 | O210: =IF(I210=C210,1,0)-N210 -> 1 | P210: =IF(J210<C210,1,0) -> 0 | Q210: =M210-N210-O210 -> 0
A211: BPPC_2_9_2.txt | B211: 225 | C211: 225 | D211: 1 | E211: 384 | I211: =MAX(B211,CEILING(F211,1)) -> 225 | J211: 225 | K211: 0 | L211: 384 | M211: 1 | N211: =IF(B211=C211,1,0) -> 1 | O211: =IF(I211=C211,1,0)-N211 -> 0 | P211: =IF(J211<C211,1,0) -> 0 | Q211: =M211-N211-O211 -> 0
A212: BPPC_2_9_3.txt | B212: 225 | C212: 226 | D212: 121 | E212: 343 | F212: 225.1 | G212: 3 | H212: 358 | I212: =MAX(B212,CEILING(F212,1)) -> 226 | J212: 226 | K212: 3 | L212: 358 | M212: 1 | N212: =IF(B212=C212,1,0) -> 0 | O212: =IF(I212=C212,1,0)-N212 -> 1 | P212: =IF(J212<C212,1,0) -> 0 | Q212: =M212-N212-O212 -> 0
A213: BPPC_2_9_4.txt | B213: 229 | C213: 229 | D213: 1 | E213: 359 | I213: =MAX(B213,CEILING(F213,1)) -> 229 | J213: 229 | K213: 0 | L213: 359 | M213: 1 | N213: =IF(B213=C213,1,0) -> 1 | O213: =IF(I213=C213,1,0)-N213 -> 0 | P213: =IF(J213<C213,1,0) -> 0 | Q213: =M213-N213-O213 -> 0
A214: BPPC_2_9_5.txt | B214: 233 | C214: 233 | D214: 0 | E214: 337 | I214: =MAX(B214,CEILING(F214,1)) -> 233 | J214: 233 | K214: 0 | L214: 337 | M214: 1 | N214: =IF(B214=C214,1,0) -> 1 | O214: =IF(I214=C214,1,0)-N214 -> 0 | P214: =IF(J214<C214,1,0) -> 0 | Q214: =M214-N214-O214 -> 0
A215: BPPC_2_9_6.txt | B215: 229 | C215: 229 | D215: 1 | E215: 346 | I215: =MAX(B215,CEILING(F215,1)) -> 229 | J215: 229 | K215: 0 | L215: 346 | M215: 1 | N215: =IF(B215=C215,1,0) -> 1 | O215: =IF(I215=C215,1,0)-N215 -> 0 | P215: =IF(J215<C215,1,0) -> 0 | Q215: =M215-N215-O215 -> 0
A216: BPPC_2_9_7.txt | B216: 226 | C216: 226 | D216: 0 | E216: 411 | I216: =MAX(B216,CEILING(F216,1)) -> 226 | J216: 226 | K216: 0 | L216: 411 | M216: 1 | N216: =IF(B216=C216,1,0) -> 1 | O216: =IF(I216=C216,1,0)-N216 -> 0 | P216: =IF(J216<C216,1,0) -> 0 | Q216: =M216-N216-O216 -> 0
A217: BPPC_2_9_8.txt | B217: 221 | C217: 221 | D217: 1 | E217: 398 | I217: =MAX(B217,CEILING(F217,1)) -> 221 | J217: 221 | K217: 0 | L217: 398 | M217: 1 | N217: =IF(B217=C217,1,0) -> 1 | O217: =IF(I217=C217,1,0)-N217 -> 0 | P217: =IF(J217<C217,1,0) -> 0 | Q217: =M217-N217-O217 -> 0
A218: BPPC_2_9_9.txt | B218: 234 | C218: 234 | D218: 0 | E218: 332 | I218: =MAX(B218,CEILING(F218,1)) -> 234 | J218: 234 | K218: 0 | L218: 332 | M218: 1 | N218: =IF(B218=C218,1,0) -> 1 | O218: =IF(I218=C218,1,0)-N218 -> 0 | P218: =IF(J218<C218,1,0) -> 0 | Q218: =M218-N218-O218 -> 0
A219: BPPC_2_9_10.txt | B219: 227 | C219: 227 | D219: 2 | E219: 361 | I219: =MAX(B219,CEILING(F219,1)) -> 227 | J219: 227 | K219: 0 | L219: 361 | M219: 1 | N219: =IF(B219=C219,1,0) -> 1 | O219: =IF(I219=C219,1,0)-N219 -> 0 | P219: =IF(J219<C219,1,0) -> 0 | Q219: =M219-N219-O219 -> 0
A220: BPPC_3_0_1.txt | B220: 198 | C220: 199 | D220: 122 | E220: 898 | F220: 197.58 | G220: 12 | H220: 1407 | I220: =MAX(B220,CEILING(F220,1)) -> 198 | J220: 198 | K220: 42 | L220: 2555 | M220: 1 | N220: =IF(B220=C220,1,0) -> 0 | O220: =IF(I220=C220,1,0)-N220 -> 0 | P220: =IF(J220<C220,1,0) -> 1 | Q220: =M220-N220-O220 -> 1
A221: BPPC_3_0_2.txt | B221: 201 | C221: 202 | D221: 122 | E221: 888 | F221: 200.84666999999999 | G221: 10 | H221: 1213 | I221: =MAX(B221,CEILING(F221,1)) -> 201 | J221: 201 | K221: 40 | L221: 2552 | M221: 1 | N221: =IF(B221=C221,1,0) -> 0 | O221: =IF(I221=C221,1,0)-N221 -> 0 | P221: =IF(J221<C221,1,0) -> 1 | Q221: =M221-N221-O221 -> 1
A222: BPPC_3_0_3.txt | B222: 202 | C222: 203 | D222: 123 | E222: 937 | F222: 201.44 | G222: 10 | H222: 1354 | I222: =MAX(B222,CEILING(F222,1)) -> 202 | J222: 202 | K222: 30 | L222: 2522 | M222: 1 | N222: =IF(B222=C222,1,0) -> 0 | O222: =IF(I222=C222,1,0)-N222 -> 0 | P222: =IF(J222<C222,1,0) -> 1 | Q222: =M222-N222-O222 -> 1
A223: BPPC_3_0_4.txt | B223: 204 | C223: 205 | D223: 124 | E223: 907 | F223: 203.81333000000001 | G223: 12 | H223: 1405 | I223: =MAX(B223,CEILING(F223,1)) -> 204 | J223: 204 | K223: 40 | L223: 2899 | M223: 1 | N223: =IF(B223=C223,1,0) -> 0 | O223: =IF(I223=C223,1,0)-N223 -> 0 | P223: =IF(J223<C223,1,0) -> 1 | Q223: =M223-N223-O223 -> 1
A224: BPPC_3_0_5.txt | B224: 206 | C224: 207 | D224: 121 | E224: 912 | F224: 205.11332999999999 | G224: 10 | H224: 1366 | I224: =MAX(B224,CEILING(F224,1)) -> 206 | J224: 206 | K224: 38 | L224: 2795 | M224: 1 | N224: =IF(B224=C224,1,0) -> 0 | O224: =IF(I224=C224,1,0)-N224 -> 0 | P224: =IF(J224<C224,1,0) -> 1 | Q224: =M224-N224-O224 -> 1
A225: BPPC_3_0_6.txt | B225: 206 | C225: 206 | D225: 7 | E225: 854 | I225: =MAX(B225,CEILING(F225,1)) -> 206 | J225: 206 | K225: 0 | L225: 854 | M225: 1 | N225: =IF(B225=C225,1,0) -> 1 | O225: =IF(I225=C225,1,0)-N225 -> 0 | P225: =IF(J225<C225,1,0) -> 0 | Q225: =M225-N225-O225 -> 0
A226: BPPC_3_0_7.txt | B226: 207 | C226: 208 | D226: 124 | E226: 885 | F226: 206.9058 | G226: 16 | H226: 1298 | I226: =MAX(B226,CEILING(F226,1)) -> 207 | J226: 207 | K226: 825 | L226: 2710 | M226: 1 | N226: =IF(B226=C226,1,0) -> 0 | O226: =IF(I226=C226,1,0)-N226 -> 0 | P226: =IF(J226<C226,1,0) -> 1 | Q226: =M226-N226-O226 -> 1
A227: BPPC_3_0_8.txt | B227: 204 | C227: 206 | D227: 121 | E227: 822 | F227: 203.98 | G227: 14 | H227: 1417 | I227: =MAX(B227,CEILING(F227,1)) -> 204 | J227: 204 | K227: 39 | L227: 2786 | M227: 1 | N227: =IF(B227=C227,1,0) -> 0 | O227: =IF(I227=C227,1,0)-N227 -> 0 | P227: =IF(J227<C227,1,0) -> 1 | Q227: =M227-N227-O227 -> 1
A228: BPPC_3_0_9.txt | B228: 196 | C228: 197 | D228: 122 | E228: 848 | F228: 195.68 | G228: 10 | H228: 1297 | I228: =MAX(B228,CEILING(F228,1)) -> 196 | J228: 196 | K228: 31 | L228: 2476 | M228: 1 | N228: =IF(B228=C228,1,0) -> 0 | O228: =IF(I228=C228,1,0)-N228 -> 0 | P228: =IF(J228<C228,1,0) -> 1 | Q228: =M228-N228-O228 -> 1
A229: BPPC_3_0_10.txt | B229: 202 | C229: 202 | D229: 1 | E229: 877 | I229: =MAX(B229,CEILING(F229,1)) -> 202 | J229: 202 | K229: 0 | L229: 877 | M229: 1 | N229: =IF(B229=C229,1,0) -> 1 | O229: =IF(I229=C229,1,0)-N229 -> 0 | P229: =IF(J229<C229,1,0) -> 0 | Q229: =M229-N229-O229 -> 0
A230: BPPC_3_1_1.txt | B230: 198 | C230: 198 | D230: 35 | E230: 2808 | I230: =MAX(B230,CEILING(F230,1)) -> 198 | J230: 198 | K230: 0 | L230: 2808 | M230: 1 | N230: =IF(B230=C230,1,0) -> 1 | O230: =IF(I230=C230,1,0)-N230 -> 0 | P230: =IF(J230<C230,1,0) -> 0 | Q230: =M230-N230-O230 -> 0
A231: BPPC_3_1_2.txt | B231: 201 | C231: 201 | D231: 47 | E231: 2478 | I231: =MAX(B231,CEILING(F231,1)) -> 201 | J231: 201 | K231: 0 | L231: 2478 | M231: 1 | N231: =IF(B231=C231,1,0) -> 1 | O231: =IF(I231=C231,1,0)-N231 -> 0 | P231: =IF(J231<C231,1,0) -> 0 | Q231: =M231-N231-O231 -> 0
A232: BPPC_3_1_3.txt | B232: 202 | C232: 202 | D232: 18 | E232: 2521 | I232: =MAX(B232,CEILING(F232,1)) -> 202 | J232: 202 | K232: 0 | L232: 2521 | M232: 1 | N232: =IF(B232=C232,1,0) -> 1 | O232: =IF(I232=C232,1,0)-N232 -> 0 | P232: =IF(J232<C232,1,0) -> 0 | Q232: =M232-N232-O232 -> 0
A233: BPPC_3_1_4.txt | B233: 204 | C233: 205 | D233: 126 | E233: 2342 | F233: 203.81333000000001 | G233: 11 | H233: 2544 | I233: =MAX(B233,CEILING(F233,1)) -> 204 | J233: 204 | K233: 69 | L233: 4187 | M233: 1 | N233: =IF(B233=C233,1,0) -> 0 | O233: =IF(I233=C233,1,0)-N233 -> 0 | P233: =IF(J233<C233,1,0) -> 1 | Q233: =M233-N233-O233 -> 1
A234: BPPC_3_1_5.txt | B234: 206 | C234: 206 | D234: 12 | E234: 2811 | I234: =MAX(B234,CEILING(F234,1)) -> 206 | J234: 206 | K234: 0 | L234: 2811 | M234: 1 | N234: =IF(B234=C234,1,0) -> 1 | O234: =IF(I234=C234,1,0)-N234 -> 0 | P234: =IF(J234<C234,1,0) -> 0 | Q234: =M234-N234-O234 -> 0
A235: BPPC_3_1_6.txt | B235: 206 | C235: 206 | D235: 11 | E235: 3182 | I235: =MAX(B235,CEILING(F235,1)) -> 206 | J235: 206 | K235: 0 | L235: 3182 | M235: 1 | N235: =IF(B235=C235,1,0) -> 1 | O235: =IF(I235=C235,1,0)-N235 -> 0 | P235: =IF(J235<C235,1,0) -> 0 | Q235: =M235-N235-O235 -> 0
A236: BPPC_3_1_7.txt | B236: 207 | C236: 208 | D236: 132 | E236: 2232 | F236: 206.9058 | G236: 28 | H236: 2412 | I236: =MAX(B236,CEILING(F236,1)) -> 207 | J236: 207 | K236: 1168 | L236: 4050 | M236: 1 | N236: =IF(B236=C236,1,0) -> 0 | O236: =IF(I236=C236,1,0)-N236 -> 0 | P236: =IF(J236<C236,1,0) -> 1 | Q236: =M236-N236-O236 -> 1
A237: BPPC_3_1_8.txt | B237: 204 | C237: 205 | D237: 129 | E237: 2276 | F237: 203.98 | G237: 11 | H237: 2476 | I237: =MAX(B237,CEILING(F237,1)) -> 204 | J237: 204 | K237: 73 | L237: 4337 | M237: 1 | N237: =IF(B237=C237,1,0) -> 0 | O237: =IF(I237=C237,1,0)-N237 -> 0 | P237: =IF(J237<C237,1,0) -> 1 | Q237: =M237-N237-O237 -> 1
A238: BPPC_3_1_9.txt | B238: 196 | C238: 196 | D238: 41 | E238: 2596 | I238: =MAX(B238,CEILING(F238,1)) -> 196 | J238: 196 | K238: 0 | L238: 2596 | M238: 1 | N238: =IF(B238=C238,1,0) -> 1 | O238: =IF(I238=C238,1,0)-N238 -> 0 | P238: =IF(J238<C238,1,0) -> 0 | Q238: =M238-N238-O238 -> 0
A239: BPPC_3_1_10.txt | B239: 202 | C239: 202 | D239: 11 | E239: 2340 | I239: =MAX(B239,CEILING(F239,1)) -> 202 | J239: 202 | K239: 0 | L239: 2340 | M239: 1 | N239: =IF(B239=C239,1,0) -> 1 | O239: =IF(I239=C239,1,0)-N239 -> 0 | P239: =IF(J239<C239,1,0) -> 0 | Q239: =M239-N239-O239 -> 0
A240: BPPC_3_2_1.txt | B240: 198 | C240: 198 | D240: 49 | E240: 3640 | I240: =MAX(B240,CEILING(F240,1)) -> 198 | J240: 198 | K240: 0 | L240: 3640 | M240: 1 | N240: =IF(B240=C240,1,0) -> 1 | O240: =IF(I240=C240,1,0)-N240 -> 0 | P240: =IF(J240<C240,1,0) -> 0 | Q240: =M240-N240-O240 -> 0
A241: BPPC_3_2_2.txt | B241: 201 | C241: 201 | D241: 56 | E241: 3248 | I241: =MAX(B241,CEILING(F241,1)) -> 201 | J241: 201 | K241: 0 | L241: 3248 | M241: 1 | N241: =IF(B241=C241,1,0) -> 1 | O241: =IF(I241=C241,1,0)-N241 -> 0 | P241: =IF(J241<C241,1,0) -> 0 | Q241: =M241-N241-O241 -> 0
A242: BPPC_3_2_3.txt | B242: 202 | C242: 202 | D242: 23 | E242: 3747 | I242: =MAX(B242,CEILING(F242,1)) -> 202 | J242: 202 | K242: 0 | L242: 3747 | M242: 1 | N242: =IF(B242=C242,1,0) -> 1 | O242: =IF(I242=C242,1,0)-N242 -> 0 | P242: =IF(J242<C242,1,0) -> 0 | Q242: =M242-N242-O242 -> 0
A243: BPPC_3_2_4.txt | B243: 204 | C243: 205 | D243: 126 | E243: 2985 | F243: 203.81333000000001 | G243: 24 | H243: 3085 | I243: =MAX(B243,CEILING(F243,1)) -> 204 | J243: 204 | K243: 231 | L243: 4809 | M243: 1 | N243: =IF(B243=C243,1,0) -> 0 | O243: =IF(I243=C243,1,0)-N243 -> 0 | P243: =IF(J243<C243,1,0) -> 1 | Q243: =M243-N243-O243 -> 1
A244: BPPC_3_2_5.txt | B244: 206 | C244: 206 | D244: 23 | E244: 3482 | I244: =MAX(B244,CEILING(F244,1)) -> 206 | J244: 206 | K244: 0 | L244: 3482 | M244: 1 | N244: =IF(B244=C244,1,0) -> 1 | O244: =IF(I244=C244,1,0)-N244 -> 0 | P244: =IF(J244<C244,1,0) -> 0 | Q244: =M244-N244-O244 -> 0
A245: BPPC_3_2_6.txt | B245: 206 | C245: 206 | D245: 25 | E245: 3662 | I245: =MAX(B245,CEILING(F245,1)) -> 206 | J245: 206 | K245: 0 | L245: 3662 | M245: 1 | N245: =IF(B245=C245,1,0) -> 1 | O245: =IF(I245=C245,1,0)-N245 -> 0 | P245: =IF(J245<C245,1,0) -> 0 | Q245: =M245-N245-O245 -> 0
A246: BPPC_3_2_7.txt | B246: 207 | C246: 208 | D246: 130 | E246: 3149 | F246: 206.9058 | G246: 181 | H246: 3245 | I246: =MAX(B246,CEILING(F246,1)) -> 207 | J246: 207 | K246: 5266 | L246: 4809 | M246: 1 | N246: =IF(B246=C246,1,0) -> 0 | O246: =IF(I246=C246,1,0)-N246 -> 0 | P246: =IF(J246<C246,1,0) -> 1 | Q246: =M246-N246-O246 -> 1
A247: BPPC_3_2_8.txt | B247: 204 | C247: 205 | D247: 129 | E247: 3125 | F247: 203.98 | G247: 17 | H247: 3220 | I247: =MAX(B247,CEILING(F247,1)) -> 204 | J247: 204 | K247: 155 | L247: 4967 | M247: 1 | N247: =IF(B247=C247,1,0) -> 0 | O247: =IF(I247=C247,1,0)-N247 -> 0 | P247: =IF(J247<C247,1,0) -> 1 | Q247: =M247-N247-O247 -> 1
A248: BPPC_3_2_9.txt | B248: 196 | C248: 196 | D248: 37 | E248: 3294 | I248: =MAX(B248,CEILING(F248,1)) -> 196 | J248: 196 | K248: 0 | L248: 3294 | M248: 1 | N248: =IF(B248=C248,1,0) -> 1 | O248: =IF(I248=C248,1,0)-N248 -> 0 | P248: =IF(J248<C248,1,0) -> 0 | Q248: =M248-N248-O248 -> 0
A249: BPPC_3_2_10.txt | B249: 202 | C249: 202 | D249: 10 | E249: 3321 | I249: =MAX(B249,CEILING(F249,1)) -> 202 | J249: 202 | K249: 0 | L249: 3321 | M249: 1 | N249: =IF(B249=C249,1,0) -> 1 | O249: =IF(I249=C249,1,0)-N249 -> 0 | P249: =IF(J249<C249,1,0) -> 0 | Q249: =M249-N249-O249 -> 0
A250: BPPC_3_3_1.txt | B250: 198 | C250: 198 | D250: 47 | E250: 4011 | I250: =MAX(B250,CEILING(F250,1)) -> 198 | J250: 198 | K250: 0 | L250: 4011 | M250: 1 | N250: =IF(B250=C250,1,0) -> 1 | O250: =IF(I250=C250,1,0)-N250 -> 0 | P250: =IF(J250<C250,1,0) -> 0 | Q250: =M250-N250-O250 -> 0
A251: BPPC_3_3_2.txt | B251: 201 | C251: 202 | D251: 127 | E251: 4015 | F251: 200.84666999999999 | G251: 54 | H251: 4100 | I251: =MAX(B251,CEILING(F251,1)) -> 201 | J251: 201 | K251: 618 | L251: 5942 | M251: 1 | N251: =IF(B251=C251,1,0) -> 0 | O251: =IF(I251=C251,1,0)-N251 -> 0 | P251: =IF(J251<C251,1,0) -> 1 | Q251: =M251-N251-O251 -> 1
A252: BPPC_3_3_3.txt | B252: 202 | C252: 202 | D252: 44 | E252: 4273 | I252: =MAX(B252,CEILING(F252,1)) -> 202 | J252: 202 | K252: 0 | L252: 4273 | M252: 1 | N252: =IF(B252=C252,1,0) -> 1 | O252: =IF(I252=C252,1,0)-N252 -> 0 | P252: =IF(J252<C252,1,0) -> 0 | Q252: =M252-N252-O252 -> 0
A253: BPPC_3_3_4.txt | B253: 204 | C253: 205 | D253: 133 | E253: 3775 | F253: 203.81333000000001 | G253: 99 | H253: 3941 | I253: =MAX(B253,CEILING(F253,1)) -> 204 | J253: 204 | K253: 600 | L253: 5920 | M253: 1 | N253: =IF(B253=C253,1,0) -> 0 | O253: =IF(I253=C253,1,0)-N253 -> 0 | P253: =IF(J253<C253,1,0) -> 1 | Q253: =M253-N253-O253 -> 1
A254: BPPC_3_3_5.txt | B254: 206 | C254: 206 | D254: 22 | E254: 3735 | I254: =MAX(B254,CEILING(F254,1)) -> 206 | J254: 206 | K254: 0 | L254: 3735 | M254: 1 | N254: =IF(B254=C254,1,0) -> 1 | O254: =IF(I254=C254,1,0)-N254 -> 0 | P254: =IF(J254<C254,1,0) -> 0 | Q254: =M254-N254-O254 -> 0
A255: BPPC_3_3_6.txt | B255: 206 | C255: 206 | D255: 35 | E255: 3985 | I255: =MAX(B255,CEILING(F255,1)) -> 206 | J255: 206 | K255: 0 | L255: 3985 | M255: 1 | N255: =IF(B255=C255,1,0) -> 1 | O255: =IF(I255=C255,1,0)-N255 -> 0 | P255: =IF(J255<C255,1,0) -> 0 | Q255: =M255-N255-O255 -> 0
A256: BPPC_3_3_7.txt | B256: 207 | C256: 208 | D256: 140 | E256: 4259 | F256: 206.9058 | G256: 70 | H256: 4372 | I256: =MAX(B256,CEILING(F256,1)) -> 207 | J256: 207 | K256: 20064 | L256: 6311 | M256: 1 | N256: =IF(B256=C256,1,0) -> 0 | O256: =IF(I256=C256,1,0)-N256 -> 0 | P256: =IF(J256<C256,1,0) -> 1 | Q256: =M256-N256-O256 -> 1
A257: BPPC_3_3_8.txt | B257: 204 | C257: 205 | D257: 139 | E257: 3674 | F257: 203.98 | G257: 88 | H257: 3834 | I257: =MAX(B257,CEILING(F257,1)) -> 204 | J257: 204 | K257: 682 | L257: 6172 | M257: 1 | N257: =IF(B257=C257,1,0) -> 0 | O257: =IF(I257=C257,1,0)-N257 -> 0 | P257: =IF(J257<C257,1,0) -> 1 | Q257: =M257-N257-O257 -> 1
A258: BPPC_3_3_9.txt | B258: 196 | C258: 196 | D258: 55 | E258: 4192 | I258: =MAX(B258,CEILING(F258,1)) -> 196 | J258: 196 | K258: 0 | L258: 4192 | M258: 1 | N258: =IF(B258=C258,1,0) -> 1 | O258: =IF(I258=C258,1,0)-N258 -> 0 | P258: =IF(J258<C258,1,0) -> 0 | Q258: =M258-N258-O258 -> 0
A259: BPPC_3_3_10.txt | B259: 202 | C259: 202 | D259: 20 | E259: 3920 | I259: =MAX(B259,CEILING(F259,1)) -> 202 | J259: 202 | K259: 0 | L259: 3920 | M259: 1 | N259: =IF(B259=C259,1,0) -> 1 | O259: =IF(I259=C259,1,0)-N259 -> 0 | P259: =IF(J259<C259,1,0) -> 0 | Q259: =M259-N259-O259 -> 0
A260: BPPC_3_4_1.txt | B260: 214 | C260: 216 | D260: 122 | E260: 3713 | F260: 215.5 | G260: 0 | H260: 3713 | I260: =MAX(B260,CEILING(F260,1)) -> 216 | J260: 216 | K260: 0 | L260: 3713 | M260: 1 | N260: =IF(B260=C260,1,0) -> 0 | O260: =IF(I260=C260,1,0)-N260 -> 1 | P260: =IF(J260<C260,1,0) -> 0 | Q260: =M260-N260-O260 -> 0
A261: BPPC_3_4_2.txt | B261: 209 | C261: 211 | D261: 122 | E261: 3598 | F261: 209 | G261: 1 | H261: 3604 | I261: =MAX(B261,CEILING(F261,1)) -> 209 | J261: 209 | K261: 125 | L261: 3827 | M261: 1 | N261: =IF(B261=C261,1,0) -> 0 | O261: =IF(I261=C261,1,0)-N261 -> 0 | P261: =IF(J261<C261,1,0) -> 1 | Q261: =M261-N261-O261 -> 1
A262: BPPC_3_4_3.txt | B262: 218 | C262: 219 | D262: 122 | E262: 3900 | F262: 218 | G262: 0 | H262: 3901 | I262: =MAX(B262,CEILING(F262,1)) -> 218 | J262: 218 | K262: 23 | L262: 3911 | M262: 1 | N262: =IF(B262=C262,1,0) -> 0 | O262: =IF(I262=C262,1,0)-N262 -> 0 | P262: =IF(J262<C262,1,0) -> 1 | Q262: =M262-N262-O262 -> 1
A263: BPPC_3_4_4.txt | B263: 204 | C263: 207 | D263: 132 | E263: 3763 | F263: 203.91216 | G263: 5411 | H263: 4535 | I263: =MAX(B263,CEILING(F263,1)) -> 204 | J263: 207 | K263: 36002 | L263: 5555 | M263: 0 | N263: =IF(B263=C263,1,0) -> 0 | O263: =IF(I263=C263,1,0)-N263 -> 0 | P263: =IF(J263<C263,1,0) -> 0 | Q263: =M263-N263-O263 -> 0
A264: BPPC_3_4_5.txt | B264: 206 | C264: 207 | D264: 137 | E264: 3563 | F264: 205.13813999999999 | G264: 8236 | H264: 4101 | I264: =MAX(B264,CEILING(F264,1)) -> 206 | J264: 207 | K264: 36105 | L264: 4280 | M264: 0 | N264: =IF(B264=C264,1,0) -> 0 | O264: =IF(I264=C264,1,0)-N264 -> 0 | P264: =IF(J264<C264,1,0) -> 0 | Q264: =M264-N264-O264 -> 0
A265: BPPC_3_4_6.txt | B265: 215 | C265: 217 | D265: 122 | E265: 3664 | F265: 214.25 | G265: 3 | H265: 3675 | I265: =MAX(B265,CEILING(F265,1)) -> 215 | J265: 215 | K265: 85 | L265: 3826 | M265: 1 | N265: =IF(B265=C265,1,0) -> 0 | O265: =IF(I265=C265,1,0)-N265 -> 0 | P265: =IF(J265<C265,1,0) -> 1 | Q265: =M265-N265-O265 -> 1
A266: BPPC_3_4_7.txt | B266: 207 | C266: 212 | D266: 122 | E266: 3655 | F266: 207.06874999999999 | G266: 27048 | H266: 4631 | I266: =MAX(B266,CEILING(F266,1)) -> 208 | J266: 212 | K266: 36267 | L266: 4651 | M266: 0 | N266: =IF(B266=C266,1,0) -> 0 | O266: =IF(I266=C266,1,0)-N266 -> 0 | P266: =IF(J266<C266,1,0) -> 0 | Q266: =M266-N266-O266 -> 0
A267: BPPC_3_4_8.txt | B267: 204 | C267: 206 | D267: 129 | E267: 3918 | F267: 204.06081 | G267: 1042 | H267: 4405 | I267: =MAX(B267,CEILING(F267,1)) -> 205 | J267: 206 | K267: 36133 | L267: 4656 | M267: 0 | N267: =IF(B267=C267,1,0) -> 0 | O267: =IF(I267=C267,1,0)-N267 -> 0 | P267: =IF(J267<C267,1,0) -> 0 | Q267: =M267-N267-O267 -> 0
A268: BPPC_3_4_9.txt | B268: 196 | C268: 200 | D268: 122 | E268: 3730 | F268: 195.77419 | G268: 6958 | H268: 4549 | I268: =MAX(B268,CEILING(F268,1)) -> 196 | J268: 200 | K268: 36158 | L268: 4707 | M268: 0 | N268: =IF(B268=C268,1,0) -> 0 | O268: =IF(I268=C268,1,0)-N268 -> 0 | P268: =IF(J268<C268,1,0) -> 0 | Q268: =M268-N268-O268 -> 0
A269: BPPC_3_4_10.txt | B269: 212 | C269: 212 | D269: 1 | E269: 3703 | I269: =MAX(B269,CEILING(F269,1)) -> 212 | J269: 212 | K269: 0 | L269: 3703 | M269: 1 | N269: =IF(B269=C269,1,0) -> 1 | O269: =IF(I269=C269,1,0)-N269 -> 0 | P269: =IF(J269<C269,1,0) -> 0 | Q269: =M269-N269-O269 -> 0
A270: BPPC_3_5_1.txt | B270: 256 | C270: 257 | D270: 123 | E270: 3069 | F270: 257 | G270: 0 | H270: 3069 | I270: =MAX(B270,CEILING(F270,1)) -> 257 | J270: 257 | K270: 0 | L270: 3069 | M270: 1 | N270: =IF(B270=C270,1,0) -> 0 | O270: =IF(I270=C270,1,0)-N270 -> 1 | P270: =IF(J270<C270,1,0) -> 0 | Q270: =M270-N270-O270 -> 0
A271: BPPC_3_5_2.txt | B271: 253 | C271: 254 | D271: 130 | E271: 2879 | F271: 253 | G271: 36 | H271: 2903 | I271: =MAX(B271,CEILING(F271,1)) -> 253 | J271: 253 | K271: 171 | L271: 2966 | M271: 1 | N271: =IF(B271=C271,1,0) -> 0 | O271: =IF(I271=C271,1,0)-N271 -> 0 | P271: =IF(J271<C271,1,0) -> 1 | Q271: =M271-N271-O271 -> 1
A272: BPPC_3_5_3.txt | B272: 259 | C272: 260 | D272: 127 | E272: 3017 | F272: 259.16667000000001 | G272: 120 | H272: 3059 | I272: =MAX(B272,CEILING(F272,1)) -> 260 | J272: 260 | K272: 120 | L272: 3059 | M272: 1 | N272: =IF(B272=C272,1,0) -> 0 | O272: =IF(I272=C272,1,0)-N272 -> 1 | P272: =IF(J272<C272,1,0) -> 0 | Q272: =M272-N272-O272 -> 0
A273: BPPC_3_5_4.txt | B273: 246 | C273: 246 | D273: 4 | E273: 3003 | I273: =MAX(B273,CEILING(F273,1)) -> 246 | J273: 246 | K273: 0 | L273: 3003 | M273: 1 | N273: =IF(B273=C273,1,0) -> 1 | O273: =IF(I273=C273,1,0)-N273 -> 0 | P273: =IF(J273<C273,1,0) -> 0 | Q273: =M273-N273-O273 -> 0
A274: BPPC_3_5_5.txt | B274: 240 | C274: 241 | D274: 124 | E274: 3000 | F274: 240.375 | G274: 4 | H274: 3009 | I274: =MAX(B274,CEILING(F274,1)) -> 241 | J274: 241 | K274: 4 | L274: 3009 | M274: 1 | N274: =IF(B274=C274,1,0) -> 0 | O274: =IF(I274=C274,1,0)-N274 -> 1 | P274: =IF(J274<C274,1,0) -> 0 | Q274: =M274-N274-O274 -> 0
A275: BPPC_3_5_6.txt | B275: 267 | C275: 268 | D275: 123 | E275: 2780 | F275: 267.5 | G275: 0 | H275: 2780 | I275: =MAX(B275,CEILING(F275,1)) -> 268 | J275: 268 | K275: 0 | L275: 2780 | M275: 1 | N275: =IF(B275=C275,1,0) -> 0 | O275: =IF(I275=C275,1,0)-N275 -> 1 | P275: =IF(J275<C275,1,0) -> 0 | Q275: =M275-N275-O275 -> 0
A276: BPPC_3_5_7.txt | B276: 251 | C276: 253 | D276: 124 | E276: 2962 | F276: 252.5 | G276: 1 | H276: 2965 | I276: =MAX(B276,CEILING(F276,1)) -> 253 | J276: 253 | K276: 1 | L276: 2965 | M276: 1 | N276: =IF(B276=C276,1,0) -> 0 | O276: =IF(I276=C276,1,0)-N276 -> 1 | P276: =IF(J276<C276,1,0) -> 0 | Q276: =M276-N276-O276 -> 0
A277: BPPC_3_5_8.txt | B277: 241 | C277: 241 | D277: 3 | E277: 3180 | I277: =MAX(B277,CEILING(F277,1)) -> 241 | J277: 241 | K277: 0 | L277: 3180 | M277: 1 | N277: =IF(B277=C277,1,0) -> 1 | O277: =IF(I277=C277,1,0)-N277 -> 0 | P277: =IF(J277<C277,1,0) -> 0 | Q277: =M277-N277-O277 -> 0
A278: BPPC_3_5_9.txt | B278: 240 | C278: 241 | D278: 124 | E278: 3168 | F278: 240.25 | G278: 2 | H278: 3173 | I278: =MAX(B278,CEILING(F278,1)) -> 241 | J278: 241 | K278: 2 | L278: 3173 | M278: 1 | N278: =IF(B278=C278,1,0) -> 0 | O278: =IF(I278=C278,1,0)-N278 -> 1 | P278: =IF(J278<C278,1,0) -> 0 | Q278: =M278-N278-O278 -> 0
A279: BPPC_3_5_10.txt | B279: 262 | C279: 262 | D279: 2 | E279: 2965 | I279: =MAX(B279,CEILING(F279,1)) -> 262 | J279: 262 | K279: 0 | L279: 2965 | M279: 1 | N279: =IF(B279=C279,1,0) -> 1 | O279: =IF(I279=C279,1,0)-N279 -> 0 | P279: =IF(J279<C279,1,0) -> 0 | Q279: =M279-N279-O279 -> 0
A280: BPPC_3_6_1.txt | B280: 301 | C280: 301 | D280: 2 | E280: 2592 | I280: =MAX(B280,CEILING(F280,1)) -> 301 | J280: 301 | K280: 0 | L280: 2592 | M280: 1 | N280: =IF(B280=C280,1,0) -> 1 | O280: =IF(I280=C280,1,0)-N280 -> 0 | P280: =IF(J280<C280,1,0) -> 0 | Q280: =M280-N280-O280 -> 0
A281: BPPC_3_6_2.txt | B281: 303 | C281: 306 | D281: 124 | E281: 2336 | F281: 304.27273000000002 | G281: 22 | H281: 2354 | I281: =MAX(B281,CEILING(F281,1)) -> 305 | J281: 305 | K281: 203 | L281: 2388 | M281: 1 | N281: =IF(B281=C281,1,0) -> 0 | O281: =IF(I281=C281,1,0)-N281 -> 0 | P281: =IF(J281<C281,1,0) -> 1 | Q281: =M281-N281-O281 -> 1
A282: BPPC_3_6_3.txt | B282: 311 | C282: 312 | D282: 123 | E282: 2420 | F282: 312 | G282: 0 | H282: 2420 | I282: =MAX(B282,CEILING(F282,1)) -> 312 | J282: 312 | K282: 0 | L282: 2420 | M282: 1 | N282: =IF(B282=C282,1,0) -> 0 | O282: =IF(I282=C282,1,0)-N282 -> 1 | P282: =IF(J282<C282,1,0) -> 0 | Q282: =M282-N282-O282 -> 0
A283: BPPC_3_6_4.txt | B283: 307 | C283: 307 | D283: 2 | E283: 2474 | I283: =MAX(B283,CEILING(F283,1)) -> 307 | J283: 307 | K283: 0 | L283: 2474 | M283: 1 | N283: =IF(B283=C283,1,0) -> 1 | O283: =IF(I283=C283,1,0)-N283 -> 0 | P283: =IF(J283<C283,1,0) -> 0 | Q283: =M283-N283-O283 -> 0
A284: BPPC_3_6_5.txt | B284: 293 | C284: 293 | D284: 2 | E284: 2481 | I284: =MAX(B284,CEILING(F284,1)) -> 293 | J284: 293 | K284: 0 | L284: 2481 | M284: 1 | N284: =IF(B284=C284,1,0) -> 1 | O284: =IF(I284=C284,1,0)-N284 -> 0 | P284: =IF(J284<C284,1,0) -> 0 | Q284: =M284-N284-O284 -> 0
A285: BPPC_3_6_6.txt | B285: 309 | C285: 311 | D285: 124 | E285: 2320 | F285: 310.7 | G285: 2 | H285: 2323 | I285: =MAX(B285,CEILING(F285,1)) -> 311 | J285: 311 | K285: 2 | L285: 2323 | M285: 1 | N285: =IF(B285=C285,1,0) -> 0 | O285: =IF(I285=C285,1,0)-N285 -> 1 | P285: =IF(J285<C285,1,0) -> 0 | Q285: =M285-N285-O285 -> 0
A286: BPPC_3_6_7.txt | B286: 310 | C286: 310 | D286: 2 | E286: 2297 | I286: =MAX(B286,CEILING(F286,1)) -> 310 | J286: 310 | K286: 0 | L286: 2297 | M286: 1 | N286: =IF(B286=C286,1,0) -> 1 | O286: =IF(I286=C286,1,0)-N286 -> 0 | P286: =IF(J286<C286,1,0) -> 0 | Q286: =M286-N286-O286 -> 0
A287: BPPC_3_6_8.txt | B287: 293 | C287: 294 | D287: 123 | E287: 2656 | F287: 294 | G287: 0 | H287: 2656 | I287: =MAX(B287,CEILING(F287,1)) -> 294 | J287: 294 | K287: 0 | L287: 2656 | M287: 1 | N287: =IF(B287=C287,1,0) -> 0 | O287: =IF(I287=C287,1,0)-N287 -> 1 | P287: =IF(J287<C287,1,0) -> 0 | Q287: =M287-N287-O287 -> 0
A288: BPPC_3_6_9.txt | B288: 298 | C288: 298 | D288: 2 | E288: 2567 | I288: =MAX(B288,CEILING(F288,1)) -> 298 | J288: 298 | K288: 0 | L288: 2567 | M288: 1 | N288: =IF(B288=C288,1,0) -> 1 | O288: =IF(I288=C288,1,0)-N288 -> 0 | P288: =IF(J288<C288,1,0) -> 0 | Q288: =M288-N288-O288 -> 0
A289: BPPC_3_6_10.txt | B289: 309 | C289: 310 | D289: 129 | E289: 2446 | F289: 309.4375 | G289: 29 | H289: 2475 | I289: =MAX(B289,CEILING(F289,1)) -> 310 | J289: 310 | K289: 29 | L289: 2475 | M289: 1 | N289: =IF(B289=C289,1,0) -> 0 | O289: =IF(I289=C289,1,0)-N289 -> 1 | P289: =IF(J289<C289,1,0) -> 0 | Q289: =M289-N289-O289 -> 0
A290: BPPC_3_7_1.txt | B290: 342 | C290: 342 | D290: 3 | E290: 1968 | I290: =MAX(B290,CEILING(F290,1)) -> 342 | J290: 342 | K290: 0 | L290: 1968 | M290: 1 | N290: =IF(B290=C290,1,0) -> 1 | O290: =IF(I290=C290,1,0)-N290 -> 0 | P290: =IF(J290<C290,1,0) -> 0 | Q290: =M290-N290-O290 -> 0
A291: BPPC_3_7_2.txt | B291: 358 | C291: 360 | D291: 124 | E291: 1914 | F291: 360 | G291: 0 | H291: 1914 | I291: =MAX(B291,CEILING(F291,1)) -> 360 | J291: 360 | K291: 0 | L291: 1914 | M291: 1 | N291: =IF(B291=C291,1,0) -> 0 | O291: =IF(I291=C291,1,0)-N291 -> 1 | P291: =IF(J291<C291,1,0) -> 0 | Q291: =M291-N291-O291 -> 0
A292: BPPC_3_7_3.txt | B292: 352 | C292: 352 | D292: 71 | E292: 1909 | I292: =MAX(B292,CEILING(F292,1)) -> 352 | J292: 352 | K292: 0 | L292: 1909 | M292: 1 | N292: =IF(B292=C292,1,0) -> 1 | O292: =IF(I292=C292,1,0)-N292 -> 0 | P292: =IF(J292<C292,1,0) -> 0 | Q292: =M292-N292-O292 -> 0
A293: BPPC_3_7_4.txt | B293: 356 | C293: 356 | D293: 3 | E293: 1977 | I293: =MAX(B293,CEILING(F293,1)) -> 356 | J293: 356 | K293: 0 | L293: 1977 | M293: 1 | N293: =IF(B293=C293,1,0) -> 1 | O293: =IF(I293=C293,1,0)-N293 -> 0 | P293: =IF(J293<C293,1,0) -> 0 | Q293: =M293-N293-O293 -> 0
A294: BPPC_3_7_5.txt | B294: 343 | C294: 343 | D294: 3 | E294: 1984 | I294: =MAX(B294,CEILING(F294,1)) -> 343 | J294: 343 | K294: 0 | L294: 1984 | M294: 1 | N294: =IF(B294=C294,1,0) -> 1 | O294: =IF(I294=C294,1,0)-N294 -> 0 | P294: =IF(J294<C294,1,0) -> 0 | Q294: =M294-N294-O294 -> 0
A295: BPPC_3_7_6.txt | B295: 354 | C295: 357 | D295: 125 | E295: 1717 | F295: 355.66667000000001 | G295: 43 | H295: 1731 | I295: =MAX(B295,CEILING(F295,1)) -> 356 | J295: 356 | K295: 207 | L295: 1766 | M295: 1 | N295: =IF(B295=C295,1,0) -> 0 | O295: =IF(I295=C295,1,0)-N295 -> 0 | P295: =IF(J295<C295,1,0) -> 1 | Q295: =M295-N295-O295 -> 1
A296: BPPC_3_7_7.txt | B296: 353 | C296: 356 | D296: 135 | E296: 1721 | F296: 355 | G296: 86 | H296: 1746 | I296: =MAX(B296,CEILING(F296,1)) -> 355 | J296: 355 | K296: 86 | L296: 1746 | M296: 1 | N296: =IF(B296=C296,1,0) -> 0 | O296: =IF(I296=C296,1,0)-N296 -> 0 | P296: =IF(J296<C296,1,0) -> 1 | Q296: =M296-N296-O296 -> 1
A297: BPPC_3_7_8.txt | B297: 338 | C297: 340 | D297: 124 | E297: 1995 | F297: 338.28570999999999 | G297: 11 | H297: 2010 | I297: =MAX(B297,CEILING(F297,1)) -> 339 | J297: 339 | K297: 91 | L297: 2042 | M297: 1 | N297: =IF(B297=C297,1,0) -> 0 | O297: =IF(I297=C297,1,0)-N297 -> 0 | P297: =IF(J297<C297,1,0) -> 1 | Q297: =M297-N297-O297 -> 1
A298: BPPC_3_7_9.txt | B298: 336 | C298: 338 | D298: 133 | E298: 1952 | F298: 336.66667000000001 | G298: 426 | H298: 2037 | I298: =MAX(B298,CEILING(F298,1)) -> 337 | J298: 337 | K298: 663 | L298: 2096 | M298: 1 | N298: =IF(B298=C298,1,0) -> 0 | O298: =IF(I298=C298,1,0)-N298 -> 0 | P298: =IF(J298<C298,1,0) -> 1 | Q298: =M298-N298-O298 -> 1
A299: BPPC_3_7_10.txt | B299: 359 | C299: 360 | D299: 124 | E299: 1871 | F299: 360 | G299: 1 | H299: 1872 | I299: =MAX(B299,CEILING(F299,1)) -> 360 | J299: 360 | K299: 1 | L299: 1872 | M299: 1 | N299: =IF(B299=C299,1,0) -> 0 | O299: =IF(I299=C299,1,0)-N299 -> 1 | P299: =IF(J299<C299,1,0) -> 0 | Q299: =M299-N299-O299 -> 0
A300: BPPC_3_8_1.txt | B300: 389 | C300: 389 | D300: 3 | E300: 1486 | I300: =MAX(B300,CEILING(F300,1)) -> 389 | J300: 389 | K300: 0 | L300: 1486 | M300: 1 | N300: =IF(B300=C300,1,0) -> 1 | O300: =IF(I300=C300,1,0)-N300 -> 0 | P300: =IF(J300<C300,1,0) -> 0 | Q300: =M300-N300-O300 -> 0
A301: BPPC_3_8_2.txt | B301: 406 | C301: 406 | D301: 3 | E301: 1245 | I301: =MAX(B301,CEILING(F301,1)) -> 406 | J301: 406 | K301: 0 | L301: 1245 | M301: 1 | N301: =IF(B301=C301,1,0) -> 1 | O301: =IF(I301=C301,1,0)-N301 -> 0 | P301: =IF(J301<C301,1,0) -> 0 | Q301: =M301-N301-O301 -> 0
A302: BPPC_3_8_3.txt | B302: 400 | C302: 400 | D302: 4 | E302: 1355 | I302: =MAX(B302,CEILING(F302,1)) -> 400 | J302: 400 | K302: 0 | L302: 1355 | M302: 1 | N302: =IF(B302=C302,1,0) -> 1 | O302: =IF(I302=C302,1,0)-N302 -> 0 | P302: =IF(J302<C302,1,0) -> 0 | Q302: =M302-N302-O302 -> 0
A303: BPPC_3_8_4.txt | B303: 402 | C303: 402 | D303: 3 | E303: 1355 | I303: =MAX(B303,CEILING(F303,1)) -> 402 | J303: 402 | K303: 0 | L303: 1355 | M303: 1 | N303: =IF(B303=C303,1,0) -> 1 | O303: =IF(I303=C303,1,0)-N303 -> 0 | P303: =IF(J303<C303,1,0) -> 0 | Q303: =M303-N303-O303 -> 0
A304: BPPC_3_8_5.txt | B304: 396 | C304: 396 | D304: 3 | E304: 1448 | I304: =MAX(B304,CEILING(F304,1)) -> 396 | J304: 396 | K304: 0 | L304: 1448 | M304: 1 | N304: =IF(B304=C304,1,0) -> 1 | O304: =IF(I304=C304,1,0)-N304 -> 0 | P304: =IF(J304<C304,1,0) -> 0 | Q304: =M304-N304-O304 -> 0
A305: BPPC_3_8_6.txt | B305: 403 | C305: 403 | D305: 4 | E305: 1274 | I305: =MAX(B305,CEILING(F305,1)) -> 403 | J305: 403 | K305: 0 | L305: 1274 | M305: 1 | N305: =IF(B305=C305,1,0) -> 1 | O305: =IF(I305=C305,1,0)-N305 -> 0 | P305: =IF(J305<C305,1,0) -> 0 | Q305: =M305-N305-O305 -> 0
A306: BPPC_3_8_7.txt | B306: 408 | C306: 409 | D306: 124 | E306: 1324 | F306: 408.25 | G306: 2 | H306: 1326 | I306: =MAX(B306,CEILING(F306,1)) -> 409 | J306: 409 | K306: 2 | L306: 1326 | M306: 1 | N306: =IF(B306=C306,1,0) -> 0 | O306: =IF(I306=C306,1,0)-N306 -> 1 | P306: =IF(J306<C306,1,0) -> 0 | Q306: =M306-N306-O306 -> 0
A307: BPPC_3_8_8.txt | B307: 391 | C307: 392 | D307: 130 | E307: 1447 | F307: 391.5 | G307: 1 | H307: 1447 | I307: =MAX(B307,CEILING(F307,1)) -> 392 | J307: 392 | K307: 1 | L307: 1447 | M307: 1 | N307: =IF(B307=C307,1,0) -> 0 | O307: =IF(I307=C307,1,0)-N307 -> 1 | P307: =IF(J307<C307,1,0) -> 0 | Q307: =M307-N307-O307 -> 0
A308: BPPC_3_8_9.txt | B308: 393 | C308: 393 | D308: 2 | E308: 1420 | I308: =MAX(B308,CEILING(F308,1)) -> 393 | J308: 393 | K308: 0 | L308: 1420 | M308: 1 | N308: =IF(B308=C308,1,0) -> 1 | O308: =IF(I308=C308,1,0)-N308 -> 0 | P308: =IF(J308<C308,1,0) -> 0 | Q308: =M308-N308-O308 -> 0
A309: BPPC_3_8_10.txt | B309: 399 | C309: 400 | D309: 125 | E309: 1322 | F309: 398.95238000000001 | G309: 39 | H309: 1348 | I309: =MAX(B309,CEILING(F309,1)) -> 399 | J309: 399 | K309: 43 | L309: 1348 | M309: 1 | N309: =IF(B309=C309,1,0) -> 0 | O309: =IF(I309=C309,1,0)-N309 -> 0 | P309: =IF(J309<C309,1,0) -> 1 | Q309: =M309-N309-O309 -> 1
A310: BPPC_3_9_1.txt | B310: 443 | C310: 443 | D310: 3 | E310: 970 | I310: =MAX(B310,CEILING(F310,1)) -> 443 | J310: 443 | K310: 0 | L310: 970 | M310: 1 | N310: =IF(B310=C310,1,0) -> 1 | O310: =IF(I310=C310,1,0)-N310 -> 0 | P310: =IF(J310<C310,1,0) -> 0 | Q310: =M310-N310-O310 -> 0
A311: BPPC_3_9_2.txt | B311: 459 | C311: 459 | D311: 3 | E311: 775 | I311: =MAX(B311,CEILING(F311,1)) -> 459 | J311: 459 | K311: 0 | L311: 775 | M311: 1 | N311: =IF(B311=C311,1,0) -> 1 | O311: =IF(I311=C311,1,0)-N311 -> 0 | P311: =IF(J311<C311,1,0) -> 0 | Q311: =M311-N311-O311 -> 0
A312: BPPC_3_9_3.txt | B312: 450 | C312: 450 | D312: 4 | E312: 852 | I312: =MAX(B312,CEILING(F312,1)) -> 450 | J312: 450 | K312: 0 | L312: 852 | M312: 1 | N312: =IF(B312=C312,1,0) -> 1 | O312: =IF(I312=C312,1,0)-N312 -> 0 | P312: =IF(J312<C312,1,0) -> 0 | Q312: =M312-N312-O312 -> 0
A313: BPPC_3_9_4.txt | B313: 450 | C313: 452 | D313: 125 | E313: 803 | F313: 451.17500000000001 | G313: 37 | H313: 820 | I313: =MAX(B313,CEILING(F313,1)) -> 452 | J313: 452 | K313: 37 | L313: 820 | M313: 1 | N313: =IF(B313=C313,1,0) -> 0 | O313: =IF(I313=C313,1,0)-N313 -> 1 | P313: =IF(J313<C313,1,0) -> 0 | Q313: =M313-N313-O313 -> 0
A314: BPPC_3_9_5.txt | B314: 444 | C314: 444 | D314: 3 | E314: 925 | I314: =MAX(B314,CEILING(F314,1)) -> 444 | J314: 444 | K314: 0 | L314: 925 | M314: 1 | N314: =IF(B314=C314,1,0) -> 1 | O314: =IF(I314=C314,1,0)-N314 -> 0 | P314: =IF(J314<C314,1,0) -> 0 | Q314: =M314-N314-O314 -> 0
A315: BPPC_3_9_6.txt | B315: 467 | C315: 467 | D315: 3 | E315: 718 | I315: =MAX(B315,CEILING(F315,1)) -> 467 | J315: 467 | K315: 0 | L315: 718 | M315: 1 | N315: =IF(B315=C315,1,0) -> 1 | O315: =IF(I315=C315,1,0)-N315 -> 0 | P315: =IF(J315<C315,1,0) -> 0 | Q315: =M315-N315-O315 -> 0
A316: BPPC_3_9_7.txt | B316: 456 | C316: 456 | D316: 4 | E316: 780 | I316: =MAX(B316,CEILING(F316,1)) -> 456 | J316: 456 | K316: 0 | L316: 780 | M316: 1 | N316: =IF(B316=C316,1,0) -> 1 | O316: =IF(I316=C316,1,0)-N316 -> 0 | P316: =IF(J316<C316,1,0) -> 0 | Q316: =M316-N316-O316 -> 0
A317: BPPC_3_9_8.txt | B317: 450 | C317: 450 | D317: 3 | E317: 815 | I317: =MAX(B317,CEILING(F317,1)) -> 450 | J317: 450 | K317: 0 | L317: 815 | M317: 1 | N317: =IF(B317=C317,1,0) -> 1 | O317: =IF(I317=C317,1,0)-N317 -> 0 | P317: =IF(J317<C317,1,0) -> 0 | Q317: =M317-N317-O317 -> 0
A318: BPPC_3_9_9.txt | B318: 454 | C318: 454 | D318: 3 | E318: 821 | I318: =MAX(B318,CEILING(F318,1)) -> 454 | J318: 454 | K318: 0 | L318: 821 | M318: 1 | N318: =IF(B318=C318,1,0) -> 1 | O318: =IF(I318=C318,1,0)-N318 -> 0 | P318: =IF(J318<C318,1,0) -> 0 | Q318: =M318-N318-O318 -> 0
A319: BPPC_3_9_10.txt | B319: 449 | C319: 449 | D319: 3 | E319: 859 | I319: =MAX(B319,CEILING(F319,1)) -> 449 | J319: 449 | K319: 0 | L319: 859 | M319: 1 | N319: =IF(B319=C319,1,0) -> 1 | O319: =IF(I319=C319,1,0)-N319 -> 0 | P319: =IF(J319<C319,1,0) -> 0 | Q319: =M319-N319-O319 -> 0
A320: BPPC_4_0_1.txt | B320: 399 | C320: 400 | D320: 135 | E320: 1961 | F320: 398.42667 | G320: 29 | H320: 2422 | I320: =MAX(B320,CEILING(F320,1)) -> 399 | J320: 399 | K320: 108 | L320: 4439 | M320: 1 | N320: =IF(B320=C320,1,0) -> 0 | O320: =IF(I320=C320,1,0)-N320 -> 0 | P320: =IF(J320<C320,1,0) -> 1 | Q320: =M320-N320-O320 -> 1
A321: BPPC_4_0_2.txt | B321: 406 | C321: 407 | D321: 130 | E321: 2125 | F321: 405.25333000000001 | G321: 30 | H321: 2623 | I321: =MAX(B321,CEILING(F321,1)) -> 406 | J321: 406 | K321: 111 | L321: 4722 | M321: 1 | N321: =IF(B321=C321,1,0) -> 0 | O321: =IF(I321=C321,1,0)-N321 -> 0 | P321: =IF(J321<C321,1,0) -> 1 | Q321: =M321-N321-O321 -> 1
A322: BPPC_4_0_3.txt | B322: 411 | C322: 412 | D322: 132 | E322: 2108 | F322: 410.2 | G322: 35 | H322: 2664 | I322: =MAX(B322,CEILING(F322,1)) -> 411 | J322: 411 | K322: 124 | L322: 4678 | M322: 1 | N322: =IF(B322=C322,1,0) -> 0 | O322: =IF(I322=C322,1,0)-N322 -> 0 | P322: =IF(J322<C322,1,0) -> 1 | Q322: =M322-N322-O322 -> 1
A323: BPPC_4_0_4.txt | B323: 411 | C323: 413 | D323: 131 | E323: 1956 | F323: 410.86667 | G323: 40 | H323: 2548 | I323: =MAX(B323,CEILING(F323,1)) -> 411 | J323: 411 | K323: 125 | L323: 4678 | M323: 1 | N323: =IF(B323=C323,1,0) -> 0 | O323: =IF(I323=C323,1,0)-N323 -> 0 | P323: =IF(J323<C323,1,0) -> 1 | Q323: =M323-N323-O323 -> 1
A324: BPPC_4_0_5.txt | B324: 397 | C324: 399 | D324: 129 | E324: 1980 | F324: 396.74 | G324: 37 | H324: 2534 | I324: =MAX(B324,CEILING(F324,1)) -> 397 | J324: 397 | K324: 115 | L324: 4405 | M324: 1 | N324: =IF(B324=C324,1,0) -> 0 | O324: =IF(I324=C324,1,0)-N324 -> 0 | P324: =IF(J324<C324,1,0) -> 1 | Q324: =M324-N324-O324 -> 1
A325: BPPC_4_0_6.txt | B325: 399 | C325: 401 | D325: 128 | E325: 1780 | F325: 398.49333000000001 | G325: 38 | H325: 2467 | I325: =MAX(B325,CEILING(F325,1)) -> 399 | J325: 399 | K325: 118 | L325: 4428 | M325: 1 | N325: =IF(B325=C325,1,0) -> 0 | O325: =IF(I325=C325,1,0)-N325 -> 0 | P325: =IF(J325<C325,1,0) -> 1 | Q325: =M325-N325-O325 -> 1
A326: BPPC_4_0_7.txt | B326: 395 | C326: 396 | D326: 127 | E326: 1914 | F326: 394.20666999999997 | G326: 25 | H326: 2352 | I326: =MAX(B326,CEILING(F326,1)) -> 395 | J326: 395 | K326: 101 | L326: 4138 | M326: 1 | N326: =IF(B326=C326,1,0) -> 0 | O326: =IF(I326=C326,1,0)-N326 -> 0 | P326: =IF(J326<C326,1,0) -> 1 | Q326: =M326-N326-O326 -> 1
A327: BPPC_4_0_8.txt | B327: 404 | C327: 405 | D327: 128 | E327: 1914 | F327: 403.16 | G327: 32 | H327: 2487 | I327: =MAX(B327,CEILING(F327,1)) -> 404 | J327: 404 | K327: 115 | L327: 4454 | M327: 1 | N327: =IF(B327=C327,1,0) -> 0 | O327: =IF(I327=C327,1,0)-N327 -> 0 | P327: =IF(J327<C327,1,0) -> 1 | Q327: =M327-N327-O327 -> 1
A328: BPPC_4_0_9.txt | B328: 399 | C328: 401 | D328: 129 | E328: 1892 | F328: 398.43333000000001 | G328: 34 | H328: 2478 | I328: =MAX(B328,CEILING(F328,1)) -> 399 | J328: 399 | K328: 111 | L328: 4349 | M328: 1 | N328: =IF(B328=C328,1,0) -> 0 | O328: =IF(I328=C328,1,0)-N328 -> 0 | P328: =IF(J328<C328,1,0) -> 1 | Q328: =M328-N328-O328 -> 1
A329: BPPC_4_0_10.txt | B329: 397 | C329: 400 | D329: 131 | E329: 2105 | F329: 396.92667 | G329: 34 | H329: 2695 | I329: =MAX(B329,CEILING(F329,1)) -> 397 | J329: 397 | K329: 113 | L329: 4440 | M329: 1 | N329: =IF(B329=C329,1,0) -> 0 | O329: =IF(I329=C329,1,0)-N329 -> 0 | P329: =IF(J329<C329,1,0) -> 1 | Q329: =M329-N329-O329 -> 1
A330: BPPC_4_1_1.txt | B330: 399 | C330: 399 | D330: 158 | E330: 5554 | I330: =MAX(B330,CEILING(F330,1)) -> 399 | J330: 399 | K330: 0 | L330: 5554 | M330: 1 | N330: =IF(B330=C330,1,0) -> 1 | O330: =IF(I330=C330,1,0)-N330 -> 0 | P330: =IF(J330<C330,1,0) -> 0 | Q330: =M330-N330-O330 -> 0
A331: BPPC_4_1_2.txt | B331: 406 | C331: 406 | D331: 108 | E331: 5626 | I331: =MAX(B331,CEILING(F331,1)) -> 406 | J331: 406 | K331: 0 | L331: 5626 | M331: 1 | N331: =IF(B331=C331,1,0) -> 1 | O331: =IF(I331=C331,1,0)-N331 -> 0 | P331: =IF(J331<C331,1,0) -> 0 | Q331: =M331-N331-O331 -> 0
A332: BPPC_4_1_3.txt | B332: 411 | C332: 411 | D332: 121 | E332: 6840 | I332: =MAX(B332,CEILING(F332,1)) -> 411 | J332: 411 | K332: 0 | L332: 6840 | M332: 1 | N332: =IF(B332=C332,1,0) -> 1 | O332: =IF(I332=C332,1,0)-N332 -> 0 | P332: =IF(J332<C332,1,0) -> 0 | Q332: =M332-N332-O332 -> 0
A333: BPPC_4_1_4.txt | B333: 411 | C333: 412 | D333: 241 | E333: 5930 | F333: 410.86667 | G333: 19 | H333: 5989 | I333: =MAX(B333,CEILING(F333,1)) -> 411 | J333: 411 | K333: 432 | L333: 9593 | M333: 1 | N333: =IF(B333=C333,1,0) -> 0 | O333: =IF(I333=C333,1,0)-N333 -> 0 | P333: =IF(J333<C333,1,0) -> 1 | Q333: =M333-N333-O333 -> 1
A334: BPPC_4_1_5.txt | B334: 397 | C334: 398 | D334: 176 | E334: 5487 | F334: 396.74 | G334: 43 | H334: 5633 | I334: =MAX(B334,CEILING(F334,1)) -> 397 | J334: 397 | K334: 329 | L334: 8542 | M334: 1 | N334: =IF(B334=C334,1,0) -> 0 | O334: =IF(I334=C334,1,0)-N334 -> 0 | P334: =IF(J334<C334,1,0) -> 1 | Q334: =M334-N334-O334 -> 1
A335: BPPC_4_1_6.txt | B335: 399 | C335: 399 | D335: 115 | E335: 6022 | I335: =MAX(B335,CEILING(F335,1)) -> 399 | J335: 399 | K335: 0 | L335: 6022 | M335: 1 | N335: =IF(B335=C335,1,0) -> 1 | O335: =IF(I335=C335,1,0)-N335 -> 0 | P335: =IF(J335<C335,1,0) -> 0 | Q335: =M335-N335-O335 -> 0
A336: BPPC_4_1_7.txt | B336: 395 | C336: 395 | D336: 52 | E336: 6157 | I336: =MAX(B336,CEILING(F336,1)) -> 395 | J336: 395 | K336: 0 | L336: 6157 | M336: 1 | N336: =IF(B336=C336,1,0) -> 1 | O336: =IF(I336=C336,1,0)-N336 -> 0 | P336: =IF(J336<C336,1,0) -> 0 | Q336: =M336-N336-O336 -> 0
A337: BPPC_4_1_8.txt | B337: 404 | C337: 405 | D337: 156 | E337: 5497 | F337: 403.16 | G337: 42 | H337: 5628 | I337: =MAX(B337,CEILING(F337,1)) -> 404 | J337: 404 | K337: 379 | L337: 8951 | M337: 1 | N337: =IF(B337=C337,1,0) -> 0 | O337: =IF(I337=C337,1,0)-N337 -> 0 | P337: =IF(J337<C337,1,0) -> 1 | Q337: =M337-N337-O337 -> 1
A338: BPPC_4_1_9.txt | B338: 399 | C338: 399 | D338: 103 | E338: 6536 | I338: =MAX(B338,CEILING(F338,1)) -> 399 | J338: 399 | K338: 0 | L338: 6536 | M338: 1 | N338: =IF(B338=C338,1,0) -> 1 | O338: =IF(I338=C338,1,0)-N338 -> 0 | P338: =IF(J338<C338,1,0) -> 0 | Q338: =M338-N338-O338 -> 0
A339: BPPC_4_1_10.txt | B339: 397 | C339: 398 | D339: 199 | E339: 6338 | F339: 396.92667 | G339: 17 | H339: 6379 | I339: =MAX(B339,CEILING(F339,1)) -> 397 | J339: 397 | K339: 418 | L339: 9327 | M339: 1 | N339: =IF(B339=C339,1,0) -> 0 | O339: =IF(I339=C339,1,0)-N339 -> 0 | P339: =IF(J339<C339,1,0) -> 1 | Q339: =M339-N339-O339 -> 1
A340: BPPC_4_2_1.txt | B340: 399 | C340: 399 | D340: 136 | E340: 7141 | I340: =MAX(B340,CEILING(F340,1)) -> 399 | J340: 399 | K340: 0 | L340: 7141 | M340: 1 | N340: =IF(B340=C340,1,0) -> 1 | O340: =IF(I340=C340,1,0)-N340 -> 0 | P340: =IF(J340<C340,1,0) -> 0 | Q340: =M340-N340-O340 -> 0
A341: BPPC_4_2_2.txt | B341: 406 | C341: 406 | D341: 107 | E341: 7112 | I341: =MAX(B341,CEILING(F341,1)) -> 406 | J341: 406 | K341: 0 | L341: 7112 | M341: 1 | N341: =IF(B341=C341,1,0) -> 1 | O341: =IF(I341=C341,1,0)-N341 -> 0 | P341: =IF(J341<C341,1,0) -> 0 | Q341: =M341-N341-O341 -> 0
A342: BPPC_4_2_3.txt | B342: 411 | C342: 411 | D342: 95 | E342: 7372 | I342: =MAX(B342,CEILING(F342,1)) -> 411 | J342: 411 | K342: 0 | L342: 7372 | M342: 1 | N342: =IF(B342=C342,1,0) -> 1 | O342: =IF(I342=C342,1,0)-N342 -> 0 | P342: =IF(J342<C342,1,0) -> 0 | Q342: =M342-N342-O342 -> 0
A343: BPPC_4_2_4.txt | B343: 411 | C343: 412 | D343: 236 | E343: 7789 | F343: 410.86667 | G343: 73 | H343: 7853 | I343: =MAX(B343,CEILING(F343,1)) -> 411 | J343: 411 | K343: 1842 | L343: 11666 | M343: 1 | N343: =IF(B343=C343,1,0) -> 0 | O343: =IF(I343=C343,1,0)-N343 -> 0 | P343: =IF(J343<C343,1,0) -> 1 | Q343: =M343-N343-O343 -> 1
A344: BPPC_4_2_5.txt | B344: 397 | C344: 398 | D344: 163 | E344: 7425 | F344: 396.74 | G344: 43 | H344: 7459 | I344: =MAX(B344,CEILING(F344,1)) -> 397 | J344: 397 | K344: 1247 | L344: 10457 | M344: 1 | N344: =IF(B344=C344,1,0) -> 0 | O344: =IF(I344=C344,1,0)-N344 -> 0 | P344: =IF(J344<C344,1,0) -> 1 | Q344: =M344-N344-O344 -> 1
A345: BPPC_4_2_6.txt | B345: 399 | C345: 399 | D345: 190 | E345: 7390 | I345: =MAX(B345,CEILING(F345,1)) -> 399 | J345: 399 | K345: 0 | L345: 7390 | M345: 1 | N345: =IF(B345=C345,1,0) -> 1 | O345: =IF(I345=C345,1,0)-N345 -> 0 | P345: =IF(J345<C345,1,0) -> 0 | Q345: =M345-N345-O345 -> 0
A346: BPPC_4_2_7.txt | B346: 395 | C346: 395 | D346: 85 | E346: 7639 | I346: =MAX(B346,CEILING(F346,1)) -> 395 | J346: 395 | K346: 0 | L346: 7639 | M346: 1 | N346: =IF(B346=C346,1,0) -> 1 | O346: =IF(I346=C346,1,0)-N346 -> 0 | P346: =IF(J346<C346,1,0) -> 0 | Q346: =M346-N346-O346 -> 0
A347: BPPC_4_2_8.txt | B347: 404 | C347: 404 | D347: 113 | E347: 7494 | I347: =MAX(B347,CEILING(F347,1)) -> 404 | J347: 404 | K347: 0 | L347: 7494 | M347: 1 | N347: =IF(B347=C347,1,0) -> 1 | O347: =IF(I347=C347,1,0)-N347 -> 0 | P347: =IF(J347<C347,1,0) -> 0 | Q347: =M347-N347-O347 -> 0
A348: BPPC_4_2_9.txt | B348: 399 | C348: 399 | D348: 110 | E348: 7923 | I348: =MAX(B348,CEILING(F348,1)) -> 399 | J348: 399 | K348: 0 | L348: 7923 | M348: 1 | N348: =IF(B348=C348,1,0) -> 1 | O348: =IF(I348=C348,1,0)-N348 -> 0 | P348: =IF(J348<C348,1,0) -> 0 | Q348: =M348-N348-O348 -> 0
A349: BPPC_4_2_10.txt | B349: 397 | C349: 398 | D349: 198 | E349: 8107 | F349: 396.92667 | G349: 33 | H349: 8133 | I349: =MAX(B349,CEILING(F349,1)) -> 397 | J349: 397 | K349: 1268 | L349: 11004 | M349: 1 | N349: =IF(B349=C349,1,0) -> 0 | O349: =IF(I349=C349,1,0)-N349 -> 0 | P349: =IF(J349<C349,1,0) -> 1 | Q349: =M349-N349-O349 -> 1
A350: BPPC_4_3_1.txt | B350: 399 | C350: 399 | D350: 151 | E350: 8532 | I350: =MAX(B350,CEILING(F350,1)) -> 399 | J350: 399 | K350: 0 | L350: 8532 | M350: 1 | N350: =IF(B350=C350,1,0) -> 1 | O350: =IF(I350=C350,1,0)-N350 -> 0 | P350: =IF(J350<C350,1,0) -> 0 | Q350: =M350-N350-O350 -> 0
A351: BPPC_4_3_2.txt | B351: 406 | C351: 406 | D351: 97 | E351: 8680 | I351: =MAX(B351,CEILING(F351,1)) -> 406 | J351: 406 | K351: 0 | L351: 8680 | M351: 1 | N351: =IF(B351=C351,1,0) -> 1 | O351: =IF(I351=C351,1,0)-N351 -> 0 | P351: =IF(J351<C351,1,0) -> 0 | Q351: =M351-N351-O351 -> 0
A352: BPPC_4_3_3.txt | B352: 411 | C352: 412 | D352: 153 | E352: 8364 | F352: 410.2 | G352: 353 | H352: 8468 | I352: =MAX(B352,CEILING(F352,1)) -> 411 | J352: 411 | K352: 4779 | L352: 12500 | M352: 1 | N352: =IF(B352=C352,1,0) -> 0 | O352: =IF(I352=C352,1,0)-N352 -> 0 | P352: =IF(J352<C352,1,0) -> 1 | Q352: =M352-N352-O352 -> 1
A353: BPPC_4_3_4.txt | B353: 411 | C353: 413 | D353: 171 | E353: 8418 | F353: 410.86667 | G353: 243 | H353: 8505 | I353: =MAX(B353,CEILING(F353,1)) -> 411 | J353: 411 | K353: 5139 | L353: 13228 | M353: 1 | N353: =IF(B353=C353,1,0) -> 0 | O353: =IF(I353=C353,1,0)-N353 -> 0 | P353: =IF(J353<C353,1,0) -> 1 | Q353: =M353-N353-O353 -> 1
A354: BPPC_4_3_5.txt | B354: 397 | C354: 398 | D354: 185 | E354: 8556 | F354: 396.74 | G354: 321 | H354: 8610 | I354: =MAX(B354,CEILING(F354,1)) -> 397 | J354: 397 | K354: 6003 | L354: 12717 | M354: 1 | N354: =IF(B354=C354,1,0) -> 0 | O354: =IF(I354=C354,1,0)-N354 -> 0 | P354: =IF(J354<C354,1,0) -> 1 | Q354: =M354-N354-O354 -> 1
A355: BPPC_4_3_6.txt | B355: 399 | C355: 400 | D355: 173 | E355: 7932 | F355: 398.49333000000001 | G355: 204 | H355: 7991 | I355: =MAX(B355,CEILING(F355,1)) -> 399 | J355: 399 | K355: 5054 | L355: 11819 | M355: 1 | N355: =IF(B355=C355,1,0) -> 0 | O355: =IF(I355=C355,1,0)-N355 -> 0 | P355: =IF(J355<C355,1,0) -> 1 | Q355: =M355-N355-O355 -> 1
A356: BPPC_4_3_7.txt | B356: 395 | C356: 395 | D356: 150 | E356: 8715 | I356: =MAX(B356,CEILING(F356,1)) -> 395 | J356: 395 | K356: 0 | L356: 8715 | M356: 1 | N356: =IF(B356=C356,1,0) -> 1 | O356: =IF(I356=C356,1,0)-N356 -> 0 | P356: =IF(J356<C356,1,0) -> 0 | Q356: =M356-N356-O356 -> 0
A357: BPPC_4_3_8.txt | B357: 404 | C357: 404 | D357: 168 | E357: 8493 | I357: =MAX(B357,CEILING(F357,1)) -> 404 | J357: 404 | K357: 0 | L357: 8493 | M357: 1 | N357: =IF(B357=C357,1,0) -> 1 | O357: =IF(I357=C357,1,0)-N357 -> 0 | P357: =IF(J357<C357,1,0) -> 0 | Q357: =M357-N357-O357 -> 0
A358: BPPC_4_3_9.txt | B358: 399 | C358: 400 | D358: 185 | E358: 8793 | F358: 398.43333000000001 | G358: 299 | H358: 8854 | I358: =MAX(B358,CEILING(F358,1)) -> 399 | J358: 399 | K358: 5385 | L358: 13137 | M358: 1 | N358: =IF(B358=C358,1,0) -> 0 | O358: =IF(I358=C358,1,0)-N358 -> 0 | P358: =IF(J358<C358,1,0) -> 1 | Q358: =M358-N358-O358 -> 1
A359: BPPC_4_3_10.txt | B359: 397 | C359: 398 | D359: 221 | E359: 8513 | F359: 396.92667 | G359: 161 | H359: 8553 | I359: =MAX(B359,CEILING(F359,1)) -> 397 | J359: 397 | K359: 4287 | L359: 12175 | M359: 1 | N359: =IF(B359=C359,1,0) -> 0 | O359: =IF(I359=C359,1,0)-N359 -> 0 | P359: =IF(J359<C359,1,0) -> 1 | Q359: =M359-N359-O359 -> 1
A360: BPPC_4_4_1.txt | B360: 419 | C360: 424 | D360: 128 | E360: 7699 | F360: 419.33332999999999 | G360: 10 | H360: 7706 | I360: =MAX(B360,CEILING(F360,1)) -> 420 | J360: 420 | K360: 456 | L360: 7848 | M360: 1 | N360: =IF(B360=C360,1,0) -> 0 | O360: =IF(I360=C360,1,0)-N360 -> 0 | P360: =IF(J360<C360,1,0) -> 1 | Q360: =M360-N360-O360 -> 1
A361: BPPC_4_4_2.txt | B361: 406 | C361: 410 | D361: 158 | E361: 7837 | F361: 405.25333000000001 | G361: 5541 | H361: 8418 | I361: =MAX(B361,CEILING(F361,1)) -> 406 | J361: 406 | K361: 17466 | L361: 13341 | M361: 1 | N361: =IF(B361=C361,1,0) -> 0 | O361: =IF(I361=C361,1,0)-N361 -> 0 | P361: =IF(J361<C361,1,0) -> 1 | Q361: =M361-N361-O361 -> 1
A362: BPPC_4_4_3.txt | B362: 411 | C362: 419 | D362: 128 | E362: 7716 | F362: 412 | G362: 2595 | H362: 7876 | I362: =MAX(B362,CEILING(F362,1)) -> 412 | J362: 412 | K362: 12804 | L362: 11139 | M362: 1 | N362: =IF(B362=C362,1,0) -> 0 | O362: =IF(I362=C362,1,0)-N362 -> 0 | P362: =IF(J362<C362,1,0) -> 1 | Q362: =M362-N362-O362 -> 1
A363: BPPC_4_4_4.txt | B363: 414 | C363: 421 | D363: 127 | E363: 7936 | F363: 414.42856999999998 | G363: 30 | H363: 7957 | I363: =MAX(B363,CEILING(F363,1)) -> 415 | J363: 415 | K363: 4776 | L363: 9829 | M363: 1 | N363: =IF(B363=C363,1,0) -> 0 | O363: =IF(I363=C363,1,0)-N363 -> 0 | P363: =IF(J363<C363,1,0) -> 1 | Q363: =M363-N363-O363 -> 1
A364: BPPC_4_4_5.txt | B364: 407 | C364: 410 | D364: 128 | E364: 8162 | F364: 407.5 | G364: 3 | H364: 8162 | I364: =MAX(B364,CEILING(F364,1)) -> 408 | J364: 408 | K364: 1389 | L364: 8910 | M364: 1 | N364: =IF(B364=C364,1,0) -> 0 | O364: =IF(I364=C364,1,0)-N364 -> 0 | P364: =IF(J364<C364,1,0) -> 1 | Q364: =M364-N364-O364 -> 1
A365: BPPC_4_4_6.txt | B365: 399 | C365: 406 | D365: 134 | E365: 7776 | F365: 398.49333000000001 | G365: 6309 | H365: 8407 | I365: =MAX(B365,CEILING(F365,1)) -> 399 | J365: 399 | K365: 17810 | L365: 12937 | M365: 1 | N365: =IF(B365=C365,1,0) -> 0 | O365: =IF(I365=C365,1,0)-N365 -> 0 | P365: =IF(J365<C365,1,0) -> 1 | Q365: =M365-N365-O365 -> 1
A366: BPPC_4_4_7.txt | B366: 411 | C366: 415 | D366: 127 | E366: 7736 | F366: 413 | G366: 2 | H366: 7737 | I366: =MAX(B366,CEILING(F366,1)) -> 413 | J366: 413 | K366: 580 | L366: 8024 | M366: 1 | N366: =IF(B366=C366,1,0) -> 0 | O366: =IF(I366=C366,1,0)-N366 -> 0 | P366: =IF(J366<C366,1,0) -> 1 | Q366: =M366-N366-O366 -> 1
A367: BPPC_4_4_8.txt | B367: 404 | C367: 411 | D367: 139 | E367: 7826 | F367: 0 | G367: 36001 | H367: 9122 | I367: =MAX(B367,CEILING(F367,1)) -> 404 | J367: 411 | K367: 36001 | L367: 9122 | M367: 0 | N367: =IF(B367=C367,1,0) -> 0 | O367: =IF(I367=C367,1,0)-N367 -> 0 | P367: =IF(J367<C367,1,0) -> 0 | Q367: =M367-N367-O367 -> 0
A368: BPPC_4_4_9.txt | B368: 422 | C368: 423 | D368: 129 | E368: 7823 | F368: 421.66667000000001 | G368: 27 | H368: 7844 | I368: =MAX(B368,CEILING(F368,1)) -> 422 | J368: 422 | K368: 688 | L368: 8029 | M368: 1 | N368: =IF(B368=C368,1,0) -> 0 | O368: 1 | P368: 0 | Q368: 0
A369: BPPC_4_4_10.txt | B369: 397 | C369: 406 | D369: 128 | E369: 7656 | F369: 0 | G369: 36084 | H369: 9168 | I369: =MAX(B369,CEILING(F369,1)) -> 397 | J369: 406 | K369: 36084 | L369: 9168 | M369: 0 | N369: =IF(B369=C369,1,0) -> 0 | O369: =IF(I369=C369,1,0)-N369 -> 0 | P369: =IF(J369<C369,1,0) -> 0 | Q369: =M369-N369-O369 -> 0
A370: BPPC_4_5_1.txt | B370: 527 | C370: 527 | D370: 12 | E370: 6168 | I370: =MAX(B370,CEILING(F370,1)) -> 527 | J370: 527 | K370: 0 | L370: 6168 | M370: 1 | N370: =IF(B370=C370,1,0) -> 1 | O370: =IF(I370=C370,1,0)-N370 -> 0 | P370: =IF(J370<C370,1,0) -> 0 | Q370: =M370-N370-O370 -> 0
A371: BPPC_4_5_2.txt | B371: 485 | C371: 485 | D371: 12 | E371: 6563 | I371: =MAX(B371,CEILING(F371,1)) -> 485 | J371: 485 | K371: 0 | L371: 6563 | M371: 1 | N371: =IF(B371=C371,1,0) -> 1 | O371: =IF(I371=C371,1,0)-N371 -> 0 | P371: =IF(J371<C371,1,0) -> 0 | Q371: =M371-N371-O371 -> 0
A372: BPPC_4_5_3.txt | B372: 511 | C372: 511 | D372: 14 | E372: 6336 | I372: =MAX(B372,CEILING(F372,1)) -> 511 | J372: 511 | K372: 0 | L372: 6336 | M372: 1 | N372: =IF(B372=C372,1,0) -> 1 | O372: =IF(I372=C372,1,0)-N372 -> 0 | P372: =IF(J372<C372,1,0) -> 0 | Q372: =M372-N372-O372 -> 0
A373: BPPC_4_5_4.txt | B373: 512 | C373: 516 | D373: 137 | E373: 6254 | F373: 513.64286000000004 | G373: 41 | H373: 6262 | I373: =MAX(B373,CEILING(F373,1)) -> 514 | J373: 514 | K373: 510 | L373: 6285 | M373: 1 | N373: =IF(B373=C373,1,0) -> 0 | O373: =IF(I373=C373,1,0)-N373 -> 0 | P373: =IF(J373<C373,1,0) -> 1 | Q373: =M373-N373-O373 -> 1
A374: BPPC_4_5_5.txt | B374: 510 | C374: 510 | D374: 12 | E374: 6531 | I374: =MAX(B374,CEILING(F374,1)) -> 510 | J374: 510 | K374: 0 | L374: 6531 | M374: 1 | N374: =IF(B374=C374,1,0) -> 1 | O374: =IF(I374=C374,1,0)-N374 -> 0 | P374: =IF(J374<C374,1,0) -> 0 | Q374: =M374-N374-O374 -> 0
A375: BPPC_4_5_6.txt | B375: 485 | C375: 485 | D375: 11 | E375: 6462 | I375: =MAX(B375,CEILING(F375,1)) -> 485 | J375: 485 | K375: 0 | L375: 6462 | M375: 1 | N375: =IF(B375=C375,1,0) -> 1 | O375: =IF(I375=C375,1,0)-N375 -> 0 | P375: =IF(J375<C375,1,0) -> 0 | Q375: =M375-N375-O375 -> 0
A376: BPPC_4_5_7.txt | B376: 507 | C376: 508 | D376: 135 | E376: 6452 | F376: 507 | G376: 7 | H376: 6455 | I376: =MAX(B376,CEILING(F376,1)) -> 507 | J376: 507 | K376: 310 | L376: 6513 | M376: 1 | N376: =IF(B376=C376,1,0) -> 0 | O376: =IF(I376=C376,1,0)-N376 -> 0 | P376: =IF(J376<C376,1,0) -> 1 | Q376: =M376-N376-O376 -> 1
A377: BPPC_4_5_8.txt | B377: 502 | C377: 502 | D377: 12 | E377: 6423 | I377: =MAX(B377,CEILING(F377,1)) -> 502 | J377: 502 | K377: 0 | L377: 6423 | M377: 1 | N377: =IF(B377=C377,1,0) -> 1 | O377: =IF(I377=C377,1,0)-N377 -> 0 | P377: =IF(J377<C377,1,0) -> 0 | Q377: =M377-N377-O377 -> 0
A378: BPPC_4_5_9.txt | B378: 507 | C378: 510 | D378: 134 | E378: 6190 | F378: 507.85802000000001 | G378: 189 | H378: 6265 | I378: =MAX(B378,CEILING(F378,1)) -> 508 | J378: 508 | K378: 975 | L378: 6430 | M378: 1 | N378: =IF(B378=C378,1,0) -> 0 | O378: =IF(I378=C378,1,0)-N378 -> 0 | P378: =IF(J378<C378,1,0) -> 1 | Q378: =M378-N378-O378 -> 1
A379: BPPC_4_5_10.txt | B379: 498 | C379: 498 | D379: 12 | E379: 6500 | I379: =MAX(B379,CEILING(F379,1)) -> 498 | J379: 498 | K379: 0 | L379: 6500 | M379: 1 | N379: =IF(B379=C379,1,0) -> 1 | O379: =IF(I379=C379,1,0)-N379 -> 0 | P379: =IF(J379<C379,1,0) -> 0 | Q379: =M379-N379-O379 -> 0
A380: BPPC_4_6_1.txt | B380: 633 | C380: 633 | D380: 18 | E380: 5161 | I380: =MAX(B380,CEILING(F380,1)) -> 633 | J380: 633 | K380: 0 | L380: 5161 | M380: 1 | N380: =IF(B380=C380,1,0) -> 1 | O380: =IF(I380=C380,1,0)-N380 -> 0 | P380: =IF(J380<C380,1,0) -> 0 | Q380: =M380-N380-O380 -> 0
A381: BPPC_4_6_2.txt | B381: 578 | C381: 579 | D381: 142 | E381: 5368 | F381: 578 | G381: 2 | H381: 5368 | I381: =MAX(B381,CEILING(F381,1)) -> 578 | J381: 578 | K381: 2437 | L381: 5841 | M381: 1 | N381: =IF(B381=C381,1,0) -> 0 | O381: =IF(I381=C381,1,0)-N381 -> 0 | P381: =IF(J381<C381,1,0) -> 1 | Q381: =M381-N381-O381 -> 1
A382: BPPC_4_6_3.txt | B382: 605 | C382: 605 | D382: 76 | E382: 5258 | I382: =MAX(B382,CEILING(F382,1)) -> 605 | J382: 605 | K382: 0 | L382: 5258 | M382: 1 | N382: =IF(B382=C382,1,0) -> 1 | O382: =IF(I382=C382,1,0)-N382 -> 0 | P382: =IF(J382<C382,1,0) -> 0 | Q382: =M382-N382-O382 -> 0
A383: BPPC_4_6_4.txt | B383: 612 | C383: 613 | D383: 137 | E383: 5190 | F383: 611.78570999999999 | G383: 168 | H383: 5225 | I383: =MAX(B383,CEILING(F383,1)) -> 612 | J383: 612 | K383: 1169 | L383: 5305 | M383: 1 | N383: =IF(B383=C383,1,0) -> 0 | O383: =IF(I383=C383,1,0)-N383 -> 0 | P383: =IF(J383<C383,1,0) -> 1 | Q383: =M383-N383-O383 -> 1
A384: BPPC_4_6_5.txt | B384: 604 | C384: 604 | D384: 26 | E384: 5268 | I384: =MAX(B384,CEILING(F384,1)) -> 604 | J384: 604 | K384: 0 | L384: 5268 | M384: 1 | N384: =IF(B384=C384,1,0) -> 1 | O384: =IF(I384=C384,1,0)-N384 -> 0 | P384: =IF(J384<C384,1,0) -> 0 | Q384: =M384-N384-O384 -> 0
A385: BPPC_4_6_6.txt | B385: 580 | C385: 582 | D385: 162 | E385: 5485 | F385: 580.33333000000005 | G385: 37 | H385: 5500 | I385: =MAX(B385,CEILING(F385,1)) -> 581 | J385: 581 | K385: 1510 | L385: 5627 | M385: 1 | N385: =IF(B385=C385,1,0) -> 0 | O385: =IF(I385=C385,1,0)-N385 -> 0 | P385: =IF(J385<C385,1,0) -> 1 | Q385: =M385-N385-O385 -> 1
A386: BPPC_4_6_7.txt | B386: 614 | C386: 614 | D386: 16 | E386: 5128 | I386: =MAX(B386,CEILING(F386,1)) -> 614 | J386: 614 | K386: 0 | L386: 5128 | M386: 1 | N386: =IF(B386=C386,1,0) -> 1 | O386: =IF(I386=C386,1,0)-N386 -> 0 | P386: =IF(J386<C386,1,0) -> 0 | Q386: =M386-N386-O386 -> 0
A387: BPPC_4_6_8.txt | B387: 616 | C387: 617 | D387: 140 | E387: 5278 | F387: 616.33333000000005 | G387: 46 | H387: 5299 | I387: =MAX(B387,CEILING(F387,1)) -> 617 | J387: 617 | K387: 46 | L387: 5299 | M387: 1 | N387: =IF(B387=C387,1,0) -> 0 | O387: =IF(I387=C387,1,0)-N387 -> 1 | P387: =IF(J387<C387,1,0) -> 0 | Q387: =M387-N387-O387 -> 0
A388: BPPC_4_6_9.txt | B388: 626 | C388: 626 | D388: 16 | E388: 5131 | I388: =MAX(B388,CEILING(F388,1)) -> 626 | J388: 626 | K388: 0 | L388: 5131 | M388: 1 | N388: =IF(B388=C388,1,0) -> 1 | O388: =IF(I388=C388,1,0)-N388 -> 0 | P388: =IF(J388<C388,1,0) -> 0 | Q388: =M388-N388-O388 -> 0
A389: BPPC_4_6_10.txt | B389: 601 | C389: 601 | D389: 19 | E389: 5301 | I389: =MAX(B389,CEILING(F389,1)) -> 601 | J389: 601 | K389: 0 | L389: 5301 | M389: 1 | N389: =IF(B389=C389,1,0) -> 1 | O389: =IF(I389=C389,1,0)-N389 -> 0 | P389: =IF(J389<C389,1,0) -> 0 | Q389: =M389-N389-O389 -> 0
A390: BPPC_4_7_1.txt | B390: 728 | C390: 728 | D390: 24 | E390: 4023 | I390: =MAX(B390,CEILING(F390,1)) -> 728 | J390: 728 | K390: 0 | L390: 4023 | M390: 1 | N390: =IF(B390=C390,1,0) -> 1 | O390: =IF(I390=C390,1,0)-N390 -> 0 | P390: =IF(J390<C390,1,0) -> 0 | Q390: =M390-N390-O390 -> 0
A391: BPPC_4_7_2.txt | B391: 680 | C391: 680 | D391: 24 | E391: 4363 | I391: =MAX(B391,CEILING(F391,1)) -> 680 | J391: 680 | K391: 0 | L391: 4363 | M391: 1 | N391: =IF(B391=C391,1,0) -> 1 | O391: =IF(I391=C391,1,0)-N391 -> 0 | P391: =IF(J391<C391,1,0) -> 0 | Q391: =M391-N391-O391 -> 0
A392: BPPC_4_7_3.txt | B392: 713 | C392: 713 | D392: 27 | E392: 4066 | I392: =MAX(B392,CEILING(F392,1)) -> 713 | J392: 713 | K392: 0 | L392: 4066 | M392: 1 | N392: =IF(B392=C392,1,0) -> 1 | O392: =IF(I392=C392,1,0)-N392 -> 0 | P392: =IF(J392<C392,1,0) -> 0 | Q392: =M392-N392-O392 -> 0
A393: BPPC_4_7_4.txt | B393: 703 | C393: 704 | D393: 147 | E393: 4161 | F393: 703 | G393: 5 | H393: 4162 | I393: =MAX(B393,CEILING(F393,1)) -> 703 | J393: 703 | K393: 304 | L393: 4206 | M393: 1 | N393: =IF(B393=C393,1,0) -> 0 | O393: =IF(I393=C393,1,0)-N393 -> 0 | P393: =IF(J393<C393,1,0) -> 1 | Q393: =M393-N393-O393 -> 1
A394: BPPC_4_7_5.txt | B394: 695 | C394: 697 | D394: 167 | E394: 4190 | F394: 695.45 | G394: 85 | H394: 4211 | I394: =MAX(B394,CEILING(F394,1)) -> 696 | J394: 696 | K394: 493 | L394: 4241 | M394: 1 | N394: =IF(B394=C394,1,0) -> 0 | O394: =IF(I394=C394,1,0)-N394 -> 0 | P394: =IF(J394<C394,1,0) -> 1 | Q394: =M394-N394-O394 -> 1
A395: BPPC_4_7_6.txt | B395: 694 | C395: 694 | D395: 19 | E395: 4106 | I395: =MAX(B395,CEILING(F395,1)) -> 694 | J395: 694 | K395: 0 | L395: 4106 | M395: 1 | N395: =IF(B395=C395,1,0) -> 1 | O395: =IF(I395=C395,1,0)-N395 -> 0 | P395: =IF(J395<C395,1,0) -> 0 | Q395: =M395-N395-O395 -> 0
A396: BPPC_4_7_7.txt | B396: 704 | C396: 704 | D396: 32 | E396: 4053 | I396: =MAX(B396,CEILING(F396,1)) -> 704 | J396: 704 | K396: 0 | L396: 4053 | M396: 1 | N396: =IF(B396=C396,1,0) -> 1 | O396: =IF(I396=C396,1,0)-N396 -> 0 | P396: =IF(J396<C396,1,0) -> 0 | Q396: =M396-N396-O396 -> 0
A397: BPPC_4_7_8.txt | B397: 704 | C397: 712 | D397: 150 | E397: 4154 | F397: 712 | G397: 4 | H397: 4154 | I397: =MAX(B397,CEILING(F397,1)) -> 712 | J397: 712 | K397: 4 | L397: 4154 | M397: 1 | N397: =IF(B397=C397,1,0) -> 0 | O397: =IF(I397=C397,1,0)-N397 -> 1 | P397: =IF(J397<C397,1,0) -> 0 | Q397: =M397-N397-O397 -> 0
A398: BPPC_4_7_9.txt | B398: 732 | C398: 732 | D398: 23 | E398: 3949 | I398: =MAX(B398,CEILING(F398,1)) -> 732 | J398: 732 | K398: 0 | L398: 3949 | M398: 1 | N398: =IF(B398=C398,1,0) -> 1 | O398: =IF(I398=C398,1,0)-N398 -> 0 | P398: =IF(J398<C398,1,0) -> 0 | Q398: =M398-N398-O398 -> 0
A399: BPPC_4_7_10.txt | B399: 711 | C399: 711 | D399: 22 | E399: 4167 | I399: =MAX(B399,CEILING(F399,1)) -> 711 | J399: 711 | K399: 0 | L399: 4167 | M399: 1 | N399: =IF(B399=C399,1,0) -> 1 | O399: =IF(I399=C399,1,0)-N399 -> 0 | P399: =IF(J399<C399,1,0) -> 0 | Q399: =M399-N399-O399 -> 0
A400: BPPC_4_8_1.txt | B400: 818 | C400: 819 | D400: 145 | E400: 2751 | F400: 818.5 | G400: 17 | H400: 2755 | I400: =MAX(B400,CEILING(F400,1)) -> 819 | J400: 819 | K400: 17 | L400: 2755 | M400: 1 | N400: =IF(B400=C400,1,0) -> 0 | O400: =IF(I400=C400,1,0)-N400 -> 1 | P400: =IF(J400<C400,1,0) -> 0 | Q400: =M400-N400-O400 -> 0
A401: BPPC_4_8_2.txt | B401: 790 | C401: 790 | D401: 31 | E401: 3171 | I401: =MAX(B401,CEILING(F401,1)) -> 790 | J401: 790 | K401: 0 | L401: 3171 | M401: 1 | N401: =IF(B401=C401,1,0) -> 1 | O401: =IF(I401=C401,1,0)-N401 -> 0 | P401: =IF(J401<C401,1,0) -> 0 | Q401: =M401-N401-O401 -> 0
A402: BPPC_4_8_3.txt | B402: 808 | C402: 811 | D402: 148 | E402: 2884 | F402: 809.42857000000004 | G402: 52 | H402: 2894 | I402: =MAX(B402,CEILING(F402,1)) -> 810 | J402: 810 | K402: 532 | L402: 2950 | M402: 1 | N402: =IF(B402=C402,1,0) -> 0 | O402: =IF(I402=C402,1,0)-N402 -> 0 | P402: =IF(J402<C402,1,0) -> 1 | Q402: =M402-N402-O402 -> 1
A403: BPPC_4_8_4.txt | B403: 804 | C403: 804 | D403: 34 | E403: 2937 | I403: =MAX(B403,CEILING(F403,1)) -> 804 | J403: 804 | K403: 0 | L403: 2937 | M403: 1 | N403: =IF(B403=C403,1,0) -> 1 | O403: =IF(I403=C403,1,0)-N403 -> 0 | P403: =IF(J403<C403,1,0) -> 0 | Q403: =M403-N403-O403 -> 0
A404: BPPC_4_8_5.txt | B404: 795 | C404: 797 | D404: 158 | E404: 3029 | F404: 795.4375 | G404: 2880 | H404: 3165 | I404: =MAX(B404,CEILING(F404,1)) -> 796 | J404: 796 | K404: 6173 | L404: 3298 | M404: 1 | N404: =IF(B404=C404,1,0) -> 0 | O404: =IF(I404=C404,1,0)-N404 -> 0 | P404: =IF(J404<C404,1,0) -> 1 | Q404: =M404-N404-O404 -> 1
A405: BPPC_4_8_6.txt | B405: 808 | C405: 809 | D405: 144 | E405: 2978 | F405: 808.33333000000005 | G405: 15 | H405: 2982 | I405: =MAX(B405,CEILING(F405,1)) -> 809 | J405: 809 | K405: 15 | L405: 2982 | M405: 1 | N405: =IF(B405=C405,1,0) -> 0 | O405: =IF(I405=C405,1,0)-N405 -> 1 | P405: =IF(J405<C405,1,0) -> 0 | Q405: =M405-N405-O405 -> 0
A406: BPPC_4_8_7.txt | B406: 804 | C406: 804 | D406: 36 | E406: 2990 | I406: =MAX(B406,CEILING(F406,1)) -> 804 | J406: 804 | K406: 0 | L406: 2990 | M406: 1 | N406: =IF(B406=C406,1,0) -> 1 | O406: =IF(I406=C406,1,0)-N406 -> 0 | P406: =IF(J406<C406,1,0) -> 0 | Q406: =M406-N406-O406 -> 0
A407: BPPC_4_8_8.txt | B407: 810 | C407: 810 | D407: 30 | E407: 2862 | I407: =MAX(B407,CEILING(F407,1)) -> 810 | J407: 810 | K407: 0 | L407: 2862 | M407: 1 | N407: =IF(B407=C407,1,0) -> 1 | O407: =IF(I407=C407,1,0)-N407 -> 0 | P407: =IF(J407<C407,1,0) -> 0 | Q407: =M407-N407-O407 -> 0
A408: BPPC_4_8_9.txt | B408: 819 | C408: 819 | D408: 135 | E408: 2841 | I408: =MAX(B408,CEILING(F408,1)) -> 819 | J408: 819 | K408: 0 | L408: 2841 | M408: 1 | N408: =IF(B408=C408,1,0) -> 1 | O408: =IF(I408=C408,1,0)-N408 -> 0 | P408: =IF(J408<C408,1,0) -> 0 | Q408: =M408-N408-O408 -> 0
A409: BPPC_4_8_10.txt | B409: 809 | C409: 810 | D409: 152 | E409: 2874 | F409: 809.33333000000005 | G409: 9 | H409: 2876 | I409: =MAX(B409,CEILING(F409,1)) -> 810 | J409: 810 | K409: 9 | L409: 2876 | M409: 1 | N409: =IF(B409=C409,1,0) -> 0 | O409: =IF(I409=C409,1,0)-N409 -> 1 | P409: =IF(J409<C409,1,0) -> 0 | Q409: =M409-N409-O409 -> 0
A410: BPPC_4_9_1.txt | B410: 916 | C410: 916 | D410: 23 | E410: 1739 | I410: =MAX(B410,CEILING(F410,1)) -> 916 | J410: 916 | K410: 0 | L410: 1739 | M410: 1 | N410: =IF(B410=C410,1,0) -> 1 | O410: =IF(I410=C410,1,0)-N410 -> 0 | P410: =IF(J410<C410,1,0) -> 0 | Q410: =M410-N410-O410 -> 0
A411: BPPC_4_9_2.txt | B411: 896 | C411: 898 | D411: 149 | E411: 1920 | F411: 897 | G411: 90 | H411: 1937 | I411: =MAX(B411,CEILING(F411,1)) -> 897 | J411: 897 | K411: 90 | L411: 1937 | M411: 1 | N411: =IF(B411=C411,1,0) -> 0 | O411: =IF(I411=C411,1,0)-N411 -> 0 | P411: =IF(J411<C411,1,0) -> 1 | Q411: =M411-N411-O411 -> 1
A412: BPPC_4_9_3.txt | B412: 901 | C412: 902 | D412: 146 | E412: 1826 | F412: 901.33333000000005 | G412: 33 | H412: 1834 | I412: =MAX(B412,CEILING(F412,1)) -> 902 | J412: 902 | K412: 33 | L412: 1834 | M412: 1 | N412: =IF(B412=C412,1,0) -> 0 | O412: =IF(I412=C412,1,0)-N412 -> 1 | P412: =IF(J412<C412,1,0) -> 0 | Q412: =M412-N412-O412 -> 0
A413: BPPC_4_9_4.txt | B413: 895 | C413: 895 | D413: 30 | E413: 1897 | I413: =MAX(B413,CEILING(F413,1)) -> 895 | J413: 895 | K413: 0 | L413: 1897 | M413: 1 | N413: =IF(B413=C413,1,0) -> 1 | O413: =IF(I413=C413,1,0)-N413 -> 0 | P413: =IF(J413<C413,1,0) -> 0 | Q413: =M413-N413-O413 -> 0
A414: BPPC_4_9_5.txt | B414: 909 | C414: 909 | D414: 23 | E414: 1755 | I414: =MAX(B414,CEILING(F414,1)) -> 909 | J414: 909 | K414: 0 | L414: 1755 | M414: 1 | N414: =IF(B414=C414,1,0) -> 1 | O414: =IF(I414=C414,1,0)-N414 -> 0 | P414: =IF(J414<C414,1,0) -> 0 | Q414: =M414-N414-O414 -> 0
A415: BPPC_4_9_6.txt | B415: 907 | C415: 907 | D415: 23 | E415: 1761 | I415: =MAX(B415,CEILING(F415,1)) -> 907 | J415: 907 | K415: 0 | L415: 1761 | M415: 1 | N415: =IF(B415=C415,1,0) -> 1 | O415: =IF(I415=C415,1,0)-N415 -> 0 | P415: =IF(J415<C415,1,0) -> 0 | Q415: =M415-N415-O415 -> 0
A416: BPPC_4_9_7.txt | B416: 896 | C416: 897 | D416: 145 | E416: 1883 | F416: 896.66666999999995 | G416: 17 | H416: 1887 | I416: =MAX(B416,CEILING(F416,1)) -> 897 | J416: 897 | K416: 17 | L416: 1887 | M416: 1 | N416: =IF(B416=C416,1,0) -> 0 | O416: =IF(I416=C416,1,0)-N416 -> 1 | P416: =IF(J416<C416,1,0) -> 0 | Q416: =M416-N416-O416 -> 0
A417: BPPC_4_9_8.txt | B417: 903 | C417: 903 | D417: 31 | E417: 1804 | I417: =MAX(B417,CEILING(F417,1)) -> 903 | J417: 903 | K417: 0 | L417: 1804 | M417: 1 | N417: =IF(B417=C417,1,0) -> 1 | O417: =IF(I417=C417,1,0)-N417 -> 0 | P417: =IF(J417<C417,1,0) -> 0 | Q417: =M417-N417-O417 -> 0
A418: BPPC_4_9_9.txt | B418: 919 | C418: 920 | D418: 153 | E418: 1702 | F418: 920 | G418: 4 | H418: 1702 | I418: =MAX(B418,CEILING(F418,1)) -> 920 | J418: 920 | K418: 4 | L418: 1702 | M418: 1 | N418: =IF(B418=C418,1,0) -> 0 | O418: =IF(I418=C418,1,0)-N418 -> 1 | P418: =IF(J418<C418,1,0) -> 0 | Q418: =M418-N418-O418 -> 0
A419: BPPC_4_9_10.txt | B419: 911 | C419: 911 | D419: 25 | E419: 1725 | I419: =MAX(B419,CEILING(F419,1)) -> 911 | J419: 911 | K419: 0 | L419: 1725 | M419: 1 | N419: =IF(B419=C419,1,0) -> 1 | O419: =IF(I419=C419,1,0)-N419 -> 0 | P419: =IF(J419<C419,1,0) -> 0 | Q419: =M419-N419-O419 -> 0
A420: BPPC_5_0_1.txt | B420: 20 | C420: 20 | D420: 0 | E420: 51 | I420: =MAX(B420,CEILING(F420,1)) -> 20 | J420: 20 | K420: 0 | L420: 51 | M420: 1 | N420: =IF(B420=C420,1,0) -> 1 | O420: =IF(I420=C420,1,0)-N420 -> 0 | P420: =IF(J420<C420,1,0) -> 0 | Q420: =M420-N420-O420 -> 0
A421: BPPC_5_0_2.txt | B421: 20 | C421: 20 | D421: 0 | E421: 49 | I421: =MAX(B421,CEILING(F421,1)) -> 20 | J421: 20 | K421: 0 | L421: 49 | M421: 1 | N421: =IF(B421=C421,1,0) -> 1 | O421: =IF(I421=C421,1,0)-N421 -> 0 | P421: =IF(J421<C421,1,0) -> 0 | Q421: =M421-N421-O421 -> 0
A422: BPPC_5_0_3.txt | B422: 20 | C422: 20 | D422: 0 | E422: 49 | I422: =MAX(B422,CEILING(F422,1)) -> 20 | J422: 20 | K422: 0 | L422: 49 | M422: 1 | N422: =IF(B422=C422,1,0) -> 1 | O422: =IF(I422=C422,1,0)-N422 -> 0 | P422: =IF(J422<C422,1,0) -> 0 | Q422: =M422-N422-O422 -> 0
A423: BPPC_5_0_4.txt | B423: 20 | C423: 20 | D423: 0 | E423: 49 | I423: =MAX(B423,CEILING(F423,1)) -> 20 | J423: 20 | K423: 0 | L423: 49 | M423: 1 | N423: =IF(B423=C423,1,0) -> 1 | O423: =IF(I423=C423,1,0)-N423 -> 0 | P423: =IF(J423<C423,1,0) -> 0 | Q423: =M423-N423-O423 -> 0
A424: BPPC_5_0_5.txt | B424: 20 | C424: 20 | D424: 0 | E424: 46 | I424: =MAX(B424,CEILING(F424,1)) -> 20 | J424: 20 | K424: 0 | L424: 46 | M424: 1 | N424: =IF(B424=C424,1,0) -> 1 | O424: =IF(I424=C424,1,0)-N424 -> 0 | P424: =IF(J424<C424,1,0) -> 0 | Q424: =M424-N424-O424 -> 0
A425: BPPC_5_0_6.txt | B425: 20 | C425: 20 | D425: 0 | E425: 47 | I425: =MAX(B425,CEILING(F425,1)) -> 20 | J425: 20 | K425: 0 | L425: 47 | M425: 1 | N425: =IF(B425=C425,1,0) -> 1 | O425: =IF(I425=C425,1,0)-N425 -> 0 | P425: =IF(J425<C425,1,0) -> 0 | Q425: =M425-N425-O425 -> 0
A426: BPPC_5_0_7.txt | B426: 20 | C426: 20 | D426: 0 | E426: 51 | I426: =MAX(B426,CEILING(F426,1)) -> 20 | J426: 20 | K426: 0 | L426: 51 | M426: 1 | N426: =IF(B426=C426,1,0) -> 1 | O426: =IF(I426=C426,1,0)-N426 -> 0 | P426: =IF(J426<C426,1,0) -> 0 | Q426: =M426-N426-O426 -> 0
A427: BPPC_5_0_8.txt | B427: 20 | C427: 20 | D427: 0 | E427: 45 | I427: =MAX(B427,CEILING(F427,1)) -> 20 | J427: 20 | K427: 0 | L427: 45 | M427: 1 | N427: =IF(B427=C427,1,0) -> 1 | O427: =IF(I427=C427,1,0)-N427 -> 0 | P427: =IF(J427<C427,1,0) -> 0 | Q427: =M427-N427-O427 -> 0
A428: BPPC_5_0_9.txt | B428: 20 | C428: 20 | D428: 0 | E428: 51 | I428: =MAX(B428,CEILING(F428,1)) -> 20 | J428: 20 | K428: 0 | L428: 51 | M428: 1 | N428: =IF(B428=C428,1,0) -> 1 | O428: =IF(I428=C428,1,0)-N428 -> 0 | P428: =IF(J428<C428,1,0) -> 0 | Q428: =M428-N428-O428 -> 0
A429: BPPC_5_0_10.txt | B429: 20 | C429: 20 | D429: 0 | E429: 50 | I429: =MAX(B429,CEILING(F429,1)) -> 20 | J429: 20 | K429: 0 | L429: 50 | M429: 1 | N429: =IF(B429=C429,1,0) -> 1 | O429: =IF(I429=C429,1,0)-N429 -> 0 | P429: =IF(J429<C429,1,0) -> 0 | Q429: =M429-N429-O429 -> 0
A430: BPPC_5_1_1.txt | B430: 20 | C430: 21 | D430: 121 | E430: 135 | F430: 20 | G430: 2 | H430: 260 | I430: =MAX(B430,CEILING(F430,1)) -> 20 | J430: 20 | K430: 2 | L430: 260 | M430: 1 | N430: =IF(B430=C430,1,0) -> 0 | O430: 1 | P430: 0 | Q430: 0
A431: BPPC_5_1_2.txt | B431: 20 | C431: 21 | D431: 121 | E431: 112 | F431: 20 | G431: 1 | H431: 281 | I431: =MAX(B431,CEILING(F431,1)) -> 20 | J431: 20 | K431: 9 | L431: 345 | M431: 1 | N431: =IF(B431=C431,1,0) -> 0 | O431: =IF(I431=C431,1,0)-N431 -> 0 | P431: =IF(J431<C431,1,0) -> 1 | Q431: =M431-N431-O431 -> 1
A432: BPPC_5_1_3.txt | B432: 20 | C432: 21 | D432: 121 | E432: 140 | F432: 20 | G432: 3 | H432: 292 | I432: =MAX(B432,CEILING(F432,1)) -> 20 | J432: 20 | K432: 5 | L432: 303 | M432: 1 | N432: =IF(B432=C432,1,0) -> 0 | O432: =IF(I432=C432,1,0)-N432 -> 0 | P432: =IF(J432<C432,1,0) -> 1 | Q432: =M432-N432-O432 -> 1
A433: BPPC_5_1_4.txt | B433: 20 | C433: 21 | D433: 121 | E433: 92 | F433: 20 | G433: 5 | H433: 235 | I433: =MAX(B433,CEILING(F433,1)) -> 20 | J433: 20 | K433: 5 | L433: 235 | M433: 1 | N433: =IF(B433=C433,1,0) -> 0 | O433: =IF(I433=C433,1,0)-N433 -> 0 | P433: =IF(J433<C433,1,0) -> 1 | Q433: =M433-N433-O433 -> 1
A434: BPPC_5_1_5.txt | B434: 20 | C434: 21 | D434: 121 | E434: 102 | F434: 20 | G434: 6 | H434: 287 | I434: =MAX(B434,CEILING(F434,1)) -> 20 | J434: 20 | K434: 6 | L434: 287 | M434: 1 | N434: =IF(B434=C434,1,0) -> 0 | O434: 1 | P434: 0 | Q434: =M434-N434-O434 -> 0
A435: BPPC_5_1_6.txt | B435: 20 | C435: 21 | D435: 121 | E435: 171 | F435: 20 | G435: 3 | H435: 305 | I435: =MAX(B435,CEILING(F435,1)) -> 20 | J435: 20 | K435: 3 | L435: 305 | M435: 1 | N435: =IF(B435=C435,1,0) -> 0 | O435: 1 | P435: 0 | Q435: =M435-N435-O435 -> 0
A436: BPPC_5_1_7.txt | B436: 20 | C436: 21 | D436: 121 | E436: 99 | F436: 20 | G436: 8 | H436: 270 | I436: =MAX(B436,CEILING(F436,1)) -> 20 | J436: 20 | K436: 22 | L436: 351 | M436: 1 | N436: =IF(B436=C436,1,0) -> 0 | O436: =IF(I436=C436,1,0)-N436 -> 0 | P436: =IF(J436<C436,1,0) -> 1 | Q436: =M436-N436-O436 -> 1
A437: BPPC_5_1_8.txt | B437: 20 | C437: 21 | D437: 121 | E437: 93 | F437: 20 | G437: 6 | H437: 251 | I437: =MAX(B437,CEILING(F437,1)) -> 20 | J437: 20 | K437: 6 | L437: 251 | M437: 1 | N437: =IF(B437=C437,1,0) -> 0 | O437: =IF(I437=C437,1,0)-N437 -> 0 | P437: =IF(J437<C437,1,0) -> 1 | Q437: =M437-N437-O437 -> 1
A438: BPPC_5_1_9.txt | B438: 20 | C438: 21 | D438: 121 | E438: 143 | F438: 20.001580000000001 | G438: 3 | H438: 289 | I438: =MAX(B438,CEILING(F438,1)) -> 21 | J438: 21 | K438: 3 | L438: 289 | M438: 1 | N438: =IF(B438=C438,1,0) -> 0 | O438: =IF(I438=C438,1,0)-N438 -> 1 | P438: =IF(J438<C438,1,0) -> 0 | Q438: =M438-N438-O438 -> 0
A439: BPPC_5_1_10.txt | B439: 20 | C439: 21 | D439: 121 | E439: 117 | F439: 20.000820000000001 | G439: 3 | H439: 286 | I439: =MAX(B439,CEILING(F439,1)) -> 21 | J439: 21 | K439: 3 | L439: 286 | M439: 1 | N439: =IF(B439=C439,1,0) -> 0 | O439: =IF(I439=C439,1,0)-N439 -> 1 | P439: =IF(J439<C439,1,0) -> 0 | Q439: =M439-N439-O439 -> 0
A440: BPPC_5_2_1.txt | B440: 20 | C440: 21 | D440: 121 | E440: 209 | F440: 20.005590000000002 | G440: 3 | H440: 322 | I440: =MAX(B440,CEILING(F440,1)) -> 21 | J440: 21 | K440: 3 | L440: 322 | M440: 1 | N440: =IF(B440=C440,1,0) -> 0 | O440: =IF(I440=C440,1,0)-N440 -> 1 | P440: =IF(J440<C440,1,0) -> 0 | Q440: =M440-N440-O440 -> 0
A441: BPPC_5_2_2.txt | B441: 20 | C441: 21 | D441: 121 | E441: 249 | F441: 20.01099 | G441: 2 | H441: 355 | I441: =MAX(B441,CEILING(F441,1)) -> 21 | J441: 21 | K441: 2 | L441: 355 | M441: 1 | N441: =IF(B441=C441,1,0) -> 0 | O441: =IF(I441=C441,1,0)-N441 -> 1 | P441: =IF(J441<C441,1,0) -> 0 | Q441: =M441-N441-O441 -> 0
A442: BPPC_5_2_3.txt | B442: 20 | C442: 21 | D442: 121 | E442: 262 | F442: 20.035710000000002 | G442: 0 | H442: 328 | I442: =MAX(B442,CEILING(F442,1)) -> 21 | J442: 21 | K442: 0 | L442: 328 | M442: 1 | N442: =IF(B442=C442,1,0) -> 0 | O442: =IF(I442=C442,1,0)-N442 -> 1 | P442: =IF(J442<C442,1,0) -> 0 | Q442: =M442-N442-O442 -> 0
A443: BPPC_5_2_4.txt | B443: 20 | C443: 21 | D443: 121 | E443: 153 | F443: 20.002030000000001 | G443: 4 | H443: 291 | I443: =MAX(B443,CEILING(F443,1)) -> 21 | J443: 21 | K443: 4 | L443: 291 | M443: 1 | N443: =IF(B443=C443,1,0) -> 0 | O443: =IF(I443=C443,1,0)-N443 -> 1 | P443: =IF(J443<C443,1,0) -> 0 | Q443: =M443-N443-O443 -> 0
A444: BPPC_5_2_5.txt | B444: 20 | C444: 21 | D444: 121 | E444: 207 | F444: 20 | G444: 3 | H444: 340 | I444: =MAX(B444,CEILING(F444,1)) -> 20 | J444: 20 | K444: 3 | L444: 340 | M444: 1 | N444: =IF(B444=C444,1,0) -> 0 | O444: 1 | P444: 0 | Q444: =M444-N444-O444 -> 0
A445: BPPC_5_2_6.txt | B445: 20 | C445: 21 | D445: 121 | E445: 314 | F445: 20.25 | G445: 0 | H445: 318 | I445: =MAX(B445,CEILING(F445,1)) -> 21 | J445: 21 | K445: 0 | L445: 318 | M445: 1 | N445: =IF(B445=C445,1,0) -> 0 | O445: =IF(I445=C445,1,0)-N445 -> 1 | P445: =IF(J445<C445,1,0) -> 0 | Q445: =M445-N445-O445 -> 0
A446: BPPC_5_2_7.txt | B446: 20 | C446: 21 | D446: 121 | E446: 185 | F446: 20 | G446: 4 | H446: 317 | I446: =MAX(B446,CEILING(F446,1)) -> 20 | J446: 21 | K446: 26 | L446: 407 | M446: 1 | N446: =IF(B446=C446,1,0) -> 0 | O446: =IF(I446=C446,1,0)-N446 -> 0 | P446: =IF(J446<C446,1,0) -> 0 | Q446: =M446-N446-O446 -> 1
A447: BPPC_5_2_8.txt | B447: 20 | C447: 21 | D447: 121 | E447: 208 | F447: 20.004069999999999 | G447: 1 | H447: 309 | I447: =MAX(B447,CEILING(F447,1)) -> 21 | J447: 21 | K447: 1 | L447: 309 | M447: 1 | N447: =IF(B447=C447,1,0) -> 0 | O447: =IF(I447=C447,1,0)-N447 -> 1 | P447: =IF(J447<C447,1,0) -> 0 | Q447: =M447-N447-O447 -> 0
A448: BPPC_5_2_9.txt | B448: 20 | C448: 21 | D448: 121 | E448: 215 | F448: 20.003879999999999 | G448: 3 | H448: 325 | I448: =MAX(B448,CEILING(F448,1)) -> 21 | J448: 21 | K448: 3 | L448: 325 | M448: 1 | N448: =IF(B448=C448,1,0) -> 0 | O448: =IF(I448=C448,1,0)-N448 -> 1 | P448: =IF(J448<C448,1,0) -> 0 | Q448: =M448-N448-O448 -> 0
A449: BPPC_5_2_10.txt | B449: 20 | C449: 21 | D449: 121 | E449: 193 | F449: 20.014990000000001 | G449: 3 | H449: 320 | I449: =MAX(B449,CEILING(F449,1)) -> 21 | J449: 21 | K449: 3 | L449: 320 | M449: 1 | N449: =IF(B449=C449,1,0) -> 0 | O449: =IF(I449=C449,1,0)-N449 -> 1 | P449: =IF(J449<C449,1,0) -> 0 | Q449: =M449-N449-O449 -> 0
A450: BPPC_5_3_1.txt | B450: 20 | C450: 21 | D450: 121 | E450: 269 | F450: 20.125 | G450: 0 | H450: 286 | I450: =MAX(B450,CEILING(F450,1)) -> 21 | J450: 21 | K450: 0 | L450: 286 | M450: 1 | N450: =IF(B450=C450,1,0) -> 0 | O450: =IF(I450=C450,1,0)-N450 -> 1 | P450: =IF(J450<C450,1,0) -> 0 | Q450: =M450-N450-O450 -> 0
A451: BPPC_5_3_2.txt | B451: 22 | C451: 23 | D451: 121 | E451: 304 | F451: 22.33333 | G451: 0 | H451: 309 | I451: =MAX(B451,CEILING(F451,1)) -> 23 | J451: 23 | K451: 0 | L451: 309 | M451: 1 | N451: =IF(B451=C451,1,0) -> 0 | O451: =IF(I451=C451,1,0)-N451 -> 1 | P451: =IF(J451<C451,1,0) -> 0 | Q451: =M451-N451-O451 -> 0
A452: BPPC_5_3_3.txt | B452: 20 | C452: 21 | D452: 121 | E452: 314 | F452: 20.054849999999998 | G452: 2 | H452: 399 | I452: =MAX(B452,CEILING(F452,1)) -> 21 | J452: 21 | K452: 2 | L452: 399 | M452: 1 | N452: =IF(B452=C452,1,0) -> 0 | O452: =IF(I452=C452,1,0)-N452 -> 1 | P452: =IF(J452<C452,1,0) -> 0 | Q452: =M452-N452-O452 -> 0
A453: BPPC_5_3_4.txt | B453: 20 | C453: 21 | D453: 121 | E453: 287 | F453: 20.33333 | G453: 0 | H453: 291 | I453: =MAX(B453,CEILING(F453,1)) -> 21 | J453: 21 | K453: 0 | L453: 291 | M453: 1 | N453: =IF(B453=C453,1,0) -> 0 | O453: =IF(I453=C453,1,0)-N453 -> 1 | P453: =IF(J453<C453,1,0) -> 0 | Q453: =M453-N453-O453 -> 0
A454: BPPC_5_3_5.txt | B454: 20 | C454: 21 | D454: 121 | E454: 257 | F454: 20.01389 | G454: 2 | H454: 376 | I454: =MAX(B454,CEILING(F454,1)) -> 21 | J454: 21 | K454: 2 | L454: 376 | M454: 1 | N454: =IF(B454=C454,1,0) -> 0 | O454: =IF(I454=C454,1,0)-N454 -> 1 | P454: =IF(J454<C454,1,0) -> 0 | Q454: =M454-N454-O454 -> 0
A455: BPPC_5_3_6.txt | B455: 25 | C455: 25 | D455: 0 | E455: 305 | I455: =MAX(B455,CEILING(F455,1)) -> 25 | J455: 25 | K455: 0 | L455: 305 | M455: 1 | N455: =IF(B455=C455,1,0) -> 1 | O455: =IF(I455=C455,1,0)-N455 -> 0 | P455: =IF(J455<C455,1,0) -> 0 | Q455: =M455-N455-O455 -> 0
A456: BPPC_5_3_7.txt | B456: 20 | C456: 21 | D456: 121 | E456: 296 | F456: 20.00554 | G456: 5 | H456: 432 | I456: =MAX(B456,CEILING(F456,1)) -> 21 | J456: 21 | K456: 5 | L456: 432 | M456: 1 | N456: =IF(B456=C456,1,0) -> 0 | O456: =IF(I456=C456,1,0)-N456 -> 1 | P456: =IF(J456<C456,1,0) -> 0 | Q456: =M456-N456-O456 -> 0
A457: BPPC_5_3_8.txt | B457: 21 | C457: 21 | D457: 0 | E457: 342 | I457: =MAX(B457,CEILING(F457,1)) -> 21 | J457: 21 | K457: 0 | L457: 342 | M457: 1 | N457: =IF(B457=C457,1,0) -> 1 | O457: =IF(I457=C457,1,0)-N457 -> 0 | P457: =IF(J457<C457,1,0) -> 0 | Q457: =M457-N457-O457 -> 0
A458: BPPC_5_3_9.txt | B458: 22 | C458: 22 | D458: 0 | E458: 327 | I458: =MAX(B458,CEILING(F458,1)) -> 22 | J458: 22 | K458: 0 | L458: 327 | M458: 1 | N458: =IF(B458=C458,1,0) -> 1 | O458: =IF(I458=C458,1,0)-N458 -> 0 | P458: =IF(J458<C458,1,0) -> 0 | Q458: =M458-N458-O458 -> 0
A459: BPPC_5_3_10.txt | B459: 20 | C459: 21 | D459: 121 | E459: 318 | F459: 20.25 | G459: 0 | H459: 327 | I459: =MAX(B459,CEILING(F459,1)) -> 21 | J459: 21 | K459: 0 | L459: 327 | M459: 1 | N459: =IF(B459=C459,1,0) -> 0 | O459: =IF(I459=C459,1,0)-N459 -> 1 | P459: =IF(J459<C459,1,0) -> 0 | Q459: =M459-N459-O459 -> 0
A460: BPPC_5_4_1.txt | B460: 20 | C460: 21 | D460: 121 | E460: 298 | F460: 20.5 | G460: 0 | H460: 305 | I460: =MAX(B460,CEILING(F460,1)) -> 21 | J460: 21 | K460: 0 | L460: 305 | M460: 1 | N460: =IF(B460=C460,1,0) -> 0 | O460: =IF(I460=C460,1,0)-N460 -> 1 | P460: =IF(J460<C460,1,0) -> 0 | Q460: =M460-N460-O460 -> 0
A461: BPPC_5_4_2.txt | B461: 30 | C461: 30 | D461: 0 | E461: 319 | I461: =MAX(B461,CEILING(F461,1)) -> 30 | J461: 30 | K461: 0 | L461: 319 | M461: 1 | N461: =IF(B461=C461,1,0) -> 1 | O461: =IF(I461=C461,1,0)-N461 -> 0 | P461: =IF(J461<C461,1,0) -> 0 | Q461: =M461-N461-O461 -> 0
A462: BPPC_5_4_3.txt | B462: 23 | C462: 23 | D462: 0 | E462: 353 | I462: =MAX(B462,CEILING(F462,1)) -> 23 | J462: 23 | K462: 0 | L462: 353 | M462: 1 | N462: =IF(B462=C462,1,0) -> 1 | O462: =IF(I462=C462,1,0)-N462 -> 0 | P462: =IF(J462<C462,1,0) -> 0 | Q462: =M462-N462-O462 -> 0
A463: BPPC_5_4_4.txt | B463: 23 | C463: 23 | D463: 0 | E463: 338 | I463: =MAX(B463,CEILING(F463,1)) -> 23 | J463: 23 | K463: 0 | L463: 338 | M463: 1 | N463: =IF(B463=C463,1,0) -> 1 | O463: =IF(I463=C463,1,0)-N463 -> 0 | P463: =IF(J463<C463,1,0) -> 0 | Q463: =M463-N463-O463 -> 0
A464: BPPC_5_4_5.txt | B464: 21 | C464: 21 | D464: 0 | E464: 343 | I464: =MAX(B464,CEILING(F464,1)) -> 21 | J464: 21 | K464: 0 | L464: 343 | M464: 1 | N464: =IF(B464=C464,1,0) -> 1 | O464: =IF(I464=C464,1,0)-N464 -> 0 | P464: =IF(J464<C464,1,0) -> 0 | Q464: =M464-N464-O464 -> 0
A465: BPPC_5_4_6.txt | B465: 32 | C465: 32 | D465: 0 | E465: 299 | I465: =MAX(B465,CEILING(F465,1)) -> 32 | J465: 32 | K465: 0 | L465: 299 | M465: 1 | N465: =IF(B465=C465,1,0) -> 1 | O465: =IF(I465=C465,1,0)-N465 -> 0 | P465: =IF(J465<C465,1,0) -> 0 | Q465: =M465-N465-O465 -> 0
A466: BPPC_5_4_7.txt | B466: 22 | C466: 22 | D466: 0 | E466: 284 | I466: =MAX(B466,CEILING(F466,1)) -> 22 | J466: 22 | K466: 0 | L466: 284 | M466: 1 | N466: =IF(B466=C466,1,0) -> 1 | O466: =IF(I466=C466,1,0)-N466 -> 0 | P466: =IF(J466<C466,1,0) -> 0 | Q466: =M466-N466-O466 -> 0
A467: BPPC_5_4_8.txt | B467: 27 | C467: 27 | D467: 0 | E467: 285 | I467: =MAX(B467,CEILING(F467,1)) -> 27 | J467: 27 | K467: 0 | L467: 285 | M467: 1 | N467: =IF(B467=C467,1,0) -> 1 | O467: =IF(I467=C467,1,0)-N467 -> 0 | P467: =IF(J467<C467,1,0) -> 0 | Q467: =M467-N467-O467 -> 0
A468: BPPC_5_4_9.txt | B468: 24 | C468: 24 | D468: 0 | E468: 305 | I468: =MAX(B468,CEILING(F468,1)) -> 24 | J468: 24 | K468: 0 | L468: 305 | M468: 1 | N468: =IF(B468=C468,1,0) -> 1 | O468: =IF(I468=C468,1,0)-N468 -> 0 | P468: =IF(J468<C468,1,0) -> 0 | Q468: =M468-N468-O468 -> 0
A469: BPPC_5_4_10.txt | B469: 25 | C469: 25 | D469: 0 | E469: 327 | I469: =MAX(B469,CEILING(F469,1)) -> 25 | J469: 25 | K469: 0 | L469: 327 | M469: 1 | N469: =IF(B469=C469,1,0) -> 1 | O469: =IF(I469=C469,1,0)-N469 -> 0 | P469: =IF(J469<C469,1,0) -> 0 | Q469: =M469-N469-O469 -> 0
A470: BPPC_5_5_1.txt | B470: 26 | C470: 26 | D470: 0 | E470: 268 | I470: =MAX(B470,CEILING(F470,1)) -> 26 | J470: 26 | K470: 0 | L470: 268 | M470: 1 | N470: =IF(B470=C470,1,0) -> 1 | O470: =IF(I470=C470,1,0)-N470 -> 0 | P470: =IF(J470<C470,1,0) -> 0 | Q470: =M470-N470-O470 -> 0
A471: BPPC_5_5_2.txt | B471: 36 | C471: 36 | D471: 0 | E471: 246 | I471: =MAX(B471,CEILING(F471,1)) -> 36 | J471: 36 | K471: 0 | L471: 246 | M471: 1 | N471: =IF(B471=C471,1,0) -> 1 | O471: =IF(I471=C471,1,0)-N471 -> 0 | P471: =IF(J471<C471,1,0) -> 0 | Q471: =M471-N471-O471 -> 0
A472: BPPC_5_5_3.txt | B472: 27 | C472: 27 | D472: 0 | E472: 252 | I472: =MAX(B472,CEILING(F472,1)) -> 27 | J472: 27 | K472: 0 | L472: 252 | M472: 1 | N472: =IF(B472=C472,1,0) -> 1 | O472: =IF(I472=C472,1,0)-N472 -> 0 | P472: =IF(J472<C472,1,0) -> 0 | Q472: =M472-N472-O472 -> 0
A473: BPPC_5_5_4.txt | B473: 27 | C473: 27 | D473: 0 | E473: 302 | I473: =MAX(B473,CEILING(F473,1)) -> 27 | J473: 27 | K473: 0 | L473: 302 | M473: 1 | N473: =IF(B473=C473,1,0) -> 1 | O473: =IF(I473=C473,1,0)-N473 -> 0 | P473: =IF(J473<C473,1,0) -> 0 | Q473: =M473-N473-O473 -> 0
A474: BPPC_5_5_5.txt | B474: 29 | C474: 29 | D474: 0 | E474: 284 | I474: =MAX(B474,CEILING(F474,1)) -> 29 | J474: 29 | K474: 0 | L474: 284 | M474: 1 | N474: =IF(B474=C474,1,0) -> 1 | O474: =IF(I474=C474,1,0)-N474 -> 0 | P474: =IF(J474<C474,1,0) -> 0 | Q474: =M474-N474-O474 -> 0
A475: BPPC_5_5_6.txt | B475: 40 | C475: 40 | D475: 0 | E475: 220 | I475: =MAX(B475,CEILING(F475,1)) -> 40 | J475: 40 | K475: 0 | L475: 220 | M475: 1 | N475: =IF(B475=C475,1,0) -> 1 | O475: =IF(I475=C475,1,0)-N475 -> 0 | P475: =IF(J475<C475,1,0) -> 0 | Q475: =M475-N475-O475 -> 0
A476: BPPC_5_5_7.txt | B476: 26 | C476: 27 | D476: 121 | E476: 274 | F476: 26.33333 | G476: 0 | H476: 276 | I476: =MAX(B476,CEILING(F476,1)) -> 27 | J476: 27 | K476: 0 | L476: 276 | M476: 1 | N476: =IF(B476=C476,1,0) -> 0 | O476: =IF(I476=C476,1,0)-N476 -> 1 | P476: =IF(J476<C476,1,0) -> 0 | Q476: =M476-N476-O476 -> 0
A477: BPPC_5_5_8.txt | B477: 35 | C477: 35 | D477: 0 | E477: 234 | I477: =MAX(B477,CEILING(F477,1)) -> 35 | J477: 35 | K477: 0 | L477: 234 | M477: 1 | N477: =IF(B477=C477,1,0) -> 1 | O477: =IF(I477=C477,1,0)-N477 -> 0 | P477: =IF(J477<C477,1,0) -> 0 | Q477: =M477-N477-O477 -> 0
A478: BPPC_5_5_9.txt | B478: 28 | C478: 28 | D478: 0 | E478: 252 | I478: =MAX(B478,CEILING(F478,1)) -> 28 | J478: 28 | K478: 0 | L478: 252 | M478: 1 | N478: =IF(B478=C478,1,0) -> 1 | O478: =IF(I478=C478,1,0)-N478 -> 0 | P478: =IF(J478<C478,1,0) -> 0 | Q478: =M478-N478-O478 -> 0
A479: BPPC_5_5_10.txt | B479: 32 | C479: 32 | D479: 0 | E479: 253 | I479: =MAX(B479,CEILING(F479,1)) -> 32 | J479: 32 | K479: 0 | L479: 253 | M479: 1 | N479: =IF(B479=C479,1,0) -> 1 | O479: =IF(I479=C479,1,0)-N479 -> 0 | P479: =IF(J479<C479,1,0) -> 0 | Q479: =M479-N479-O479 -> 0
A480: BPPC_5_6_1.txt | B480: 33 | C480: 33 | D480: 0 | E480: 280 | I480: =MAX(B480,CEILING(F480,1)) -> 33 | J480: 33 | K480: 0 | L480: 280 | M480: 1 | N480: =IF(B480=C480,1,0) -> 1 | O480: =IF(I480=C480,1,0)-N480 -> 0 | P480: =IF(J480<C480,1,0) -> 0 | Q480: =M480-N480-O480 -> 0
A481: BPPC_5_6_2.txt | B481: 39 | C481: 39 | D481: 0 | E481: 209 | I481: =MAX(B481,CEILING(F481,1)) -> 39 | J481: 39 | K481: 0 | L481: 209 | M481: 1 | N481: =IF(B481=C481,1,0) -> 1 | O481: =IF(I481=C481,1,0)-N481 -> 0 | P481: =IF(J481<C481,1,0) -> 0 | Q481: =M481-N481-O481 -> 0
A482: BPPC_5_6_3.txt | B482: 32 | C482: 32 | D482: 0 | E482: 252 | I482: =MAX(B482,CEILING(F482,1)) -> 32 | J482: 32 | K482: 0 | L482: 252 | M482: 1 | N482: =IF(B482=C482,1,0) -> 1 | O482: =IF(I482=C482,1,0)-N482 -> 0 | P482: =IF(J482<C482,1,0) -> 0 | Q482: =M482-N482-O482 -> 0
A483: BPPC_5_6_4.txt | B483: 34 | C483: 34 | D483: 0 | E483: 237 | I483: =MAX(B483,CEILING(F483,1)) -> 34 | J483: 34 | K483: 0 | L483: 237 | M483: 1 | N483: =IF(B483=C483,1,0) -> 1 | O483: =IF(I483=C483,1,0)-N483 -> 0 | P483: =IF(J483<C483,1,0) -> 0 | Q483: =M483-N483-O483 -> 0
A484: BPPC_5_6_5.txt | B484: 35 | C484: 35 | D484: 0 | E484: 245 | I484: =MAX(B484,CEILING(F484,1)) -> 35 | J484: 35 | K484: 0 | L484: 245 | M484: 1 | N484: =IF(B484=C484,1,0) -> 1 | O484: =IF(I484=C484,1,0)-N484 -> 0 | P484: =IF(J484<C484,1,0) -> 0 | Q484: =M484-N484-O484 -> 0
A485: BPPC_5_6_6.txt | B485: 43 | C485: 43 | D485: 0 | E485: 161 | I485: =MAX(B485,CEILING(F485,1)) -> 43 | J485: 43 | K485: 0 | L485: 161 | M485: 1 | N485: =IF(B485=C485,1,0) -> 1 | O485: =IF(I485=C485,1,0)-N485 -> 0 | P485: =IF(J485<C485,1,0) -> 0 | Q485: =M485-N485-O485 -> 0
A486: BPPC_5_6_7.txt | B486: 34 | C486: 34 | D486: 0 | E486: 236 | I486: =MAX(B486,CEILING(F486,1)) -> 34 | J486: 34 | K486: 0 | L486: 236 | M486: 1 | N486: =IF(B486=C486,1,0) -> 1 | O486: =IF(I486=C486,1,0)-N486 -> 0 | P486: =IF(J486<C486,1,0) -> 0 | Q486: =M486-N486-O486 -> 0
A487: BPPC_5_6_8.txt | B487: 40 | C487: 40 | D487: 0 | E487: 179 | I487: =MAX(B487,CEILING(F487,1)) -> 40 | J487: 40 | K487: 0 | L487: 179 | M487: 1 | N487: =IF(B487=C487,1,0) -> 1 | O487: =IF(I487=C487,1,0)-N487 -> 0 | P487: =IF(J487<C487,1,0) -> 0 | Q487: =M487-N487-O487 -> 0
A488: BPPC_5_6_9.txt | B488: 34 | C488: 34 | D488: 0 | E488: 264 | I488: =MAX(B488,CEILING(F488,1)) -> 34 | J488: 34 | K488: 0 | L488: 264 | M488: 1 | N488: =IF(B488=C488,1,0) -> 1 | O488: =IF(I488=C488,1,0)-N488 -> 0 | P488: =IF(J488<C488,1,0) -> 0 | Q488: =M488-N488-O488 -> 0
A489: BPPC_5_6_10.txt | B489: 39 | C489: 39 | D489: 0 | E489: 217 | I489: =MAX(B489,CEILING(F489,1)) -> 39 | J489: 39 | K489: 0 | L489: 217 | M489: 1 | N489: =IF(B489=C489,1,0) -> 1 | O489: =IF(I489=C489,1,0)-N489 -> 0 | P489: =IF(J489<C489,1,0) -> 0 | Q489: =M489-N489-O489 -> 0
A490: BPPC_5_7_1.txt | B490: 41 | C490: 41 | D490: 0 | E490: 181 | I490: =MAX(B490,CEILING(F490,1)) -> 41 | J490: 41 | K490: 0 | L490: 181 | M490: 1 | N490: =IF(B490=C490,1,0) -> 1 | O490: =IF(I490=C490,1,0)-N490 -> 0 | P490: =IF(J490<C490,1,0) -> 0 | Q490: =M490-N490-O490 -> 0
A491: BPPC_5_7_2.txt | B491: 43 | C491: 44 | D491: 121 | E491: 147 | F491: 43.333329999999997 | G491: 0 | H491: 147 | I491: =MAX(B491,CEILING(F491,1)) -> 44 | J491: 44 | K491: 0 | L491: 147 | M491: 1 | N491: =IF(B491=C491,1,0) -> 0 | O491: =IF(I491=C491,1,0)-N491 -> 1 | P491: =IF(J491<C491,1,0) -> 0 | Q491: =M491-N491-O491 -> 0
A492: BPPC_5_7_3.txt | B492: 41 | C492: 41 | D492: 0 | E492: 207 | I492: =MAX(B492,CEILING(F492,1)) -> 41 | J492: 41 | K492: 0 | L492: 207 | M492: 1 | N492: =IF(B492=C492,1,0) -> 1 | O492: =IF(I492=C492,1,0)-N492 -> 0 | P492: =IF(J492<C492,1,0) -> 0 | Q492: =M492-N492-O492 -> 0
A493: BPPC_5_7_4.txt | B493: 40 | C493: 40 | D493: 0 | E493: 181 | I493: =MAX(B493,CEILING(F493,1)) -> 40 | J493: 40 | K493: 0 | L493: 181 | M493: 1 | N493: =IF(B493=C493,1,0) -> 1 | O493: =IF(I493=C493,1,0)-N493 -> 0 | P493: =IF(J493<C493,1,0) -> 0 | Q493: =M493-N493-O493 -> 0
A494: BPPC_5_7_5.txt | B494: 40 | C494: 40 | D494: 0 | E494: 175 | I494: =MAX(B494,CEILING(F494,1)) -> 40 | J494: 40 | K494: 0 | L494: 175 | M494: 1 | N494: =IF(B494=C494,1,0) -> 1 | O494: =IF(I494=C494,1,0)-N494 -> 0 | P494: =IF(J494<C494,1,0) -> 0 | Q494: =M494-N494-O494 -> 0
A495: BPPC_5_7_6.txt | B495: 47 | C495: 47 | D495: 0 | E495: 128 | I495: =MAX(B495,CEILING(F495,1)) -> 47 | J495: 47 | K495: 0 | L495: 128 | M495: 1 | N495: =IF(B495=C495,1,0) -> 1 | O495: =IF(I495=C495,1,0)-N495 -> 0 | P495: =IF(J495<C495,1,0) -> 0 | Q495: =M495-N495-O495 -> 0
A496: BPPC_5_7_7.txt | B496: 43 | C496: 43 | D496: 0 | E496: 176 | I496: =MAX(B496,CEILING(F496,1)) -> 43 | J496: 43 | K496: 0 | L496: 176 | M496: 1 | N496: =IF(B496=C496,1,0) -> 1 | O496: =IF(I496=C496,1,0)-N496 -> 0 | P496: =IF(J496<C496,1,0) -> 0 | Q496: =M496-N496-O496 -> 0
A497: BPPC_5_7_8.txt | B497: 45 | C497: 45 | D497: 0 | E497: 134 | I497: =MAX(B497,CEILING(F497,1)) -> 45 | J497: 45 | K497: 0 | L497: 134 | M497: 1 | N497: =IF(B497=C497,1,0) -> 1 | O497: =IF(I497=C497,1,0)-N497 -> 0 | P497: =IF(J497<C497,1,0) -> 0 | Q497: =M497-N497-O497 -> 0
A498: BPPC_5_7_9.txt | B498: 40 | C498: 41 | D498: 121 | E498: 156 | F498: 40.25 | G498: 0 | H498: 163 | I498: =MAX(B498,CEILING(F498,1)) -> 41 | J498: 41 | K498: 0 | L498: 163 | M498: 1 | N498: =IF(B498=C498,1,0) -> 0 | O498: =IF(I498=C498,1,0)-N498 -> 1 | P498: =IF(J498<C498,1,0) -> 0 | Q498: =M498-N498-O498 -> 0
A499: BPPC_5_7_10.txt | B499: 44 | C499: 44 | D499: 0 | E499: 142 | I499: =MAX(B499,CEILING(F499,1)) -> 44 | J499: 44 | K499: 0 | L499: 142 | M499: 1 | N499: =IF(B499=C499,1,0) -> 1 | O499: =IF(I499=C499,1,0)-N499 -> 0 | P499: =IF(J499<C499,1,0) -> 0 | Q499: =M499-N499-O499 -> 0
A500: BPPC_5_8_1.txt | B500: 45 | C500: 45 | D500: 0 | E500: 159 | I500: =MAX(B500,CEILING(F500,1)) -> 45 | J500: 45 | K500: 0 | L500: 159 | M500: 1 | N500: =IF(B500=C500,1,0) -> 1 | O500: =IF(I500=C500,1,0)-N500 -> 0 | P500: =IF(J500<C500,1,0) -> 0 | Q500: =M500-N500-O500 -> 0
A501: BPPC_5_8_2.txt | B501: 51 | C501: 51 | D501: 0 | E501: 104 | I501: =MAX(B501,CEILING(F501,1)) -> 51 | J501: 51 | K501: 0 | L501: 104 | M501: 1 | N501: =IF(B501=C501,1,0) -> 1 | O501: =IF(I501=C501,1,0)-N501 -> 0 | P501: =IF(J501<C501,1,0) -> 0 | Q501: =M501-N501-O501 -> 0
A502: BPPC_5_8_3.txt | B502: 48 | C502: 48 | D502: 0 | E502: 122 | I502: =MAX(B502,CEILING(F502,1)) -> 48 | J502: 48 | K502: 0 | L502: 122 | M502: 1 | N502: =IF(B502=C502,1,0) -> 1 | O502: =IF(I502=C502,1,0)-N502 -> 0 | P502: =IF(J502<C502,1,0) -> 0 | Q502: =M502-N502-O502 -> 0
A503: BPPC_5_8_4.txt | B503: 46 | C503: 46 | D503: 0 | E503: 118 | I503: =MAX(B503,CEILING(F503,1)) -> 46 | J503: 46 | K503: 0 | L503: 118 | M503: 1 | N503: =IF(B503=C503,1,0) -> 1 | O503: =IF(I503=C503,1,0)-N503 -> 0 | P503: =IF(J503<C503,1,0) -> 0 | Q503: =M503-N503-O503 -> 0
A504: BPPC_5_8_5.txt | B504: 46 | C504: 46 | D504: 0 | E504: 131 | I504: =MAX(B504,CEILING(F504,1)) -> 46 | J504: 46 | K504: 0 | L504: 131 | M504: 1 | N504: =IF(B504=C504,1,0) -> 1 | O504: =IF(I504=C504,1,0)-N504 -> 0 | P504: =IF(J504<C504,1,0) -> 0 | Q504: =M504-N504-O504 -> 0
A505: BPPC_5_8_6.txt | B505: 52 | C505: 52 | D505: 0 | E505: 92 | I505: =MAX(B505,CEILING(F505,1)) -> 52 | J505: 52 | K505: 0 | L505: 92 | M505: 1 | N505: =IF(B505=C505,1,0) -> 1 | O505: =IF(I505=C505,1,0)-N505 -> 0 | P505: =IF(J505<C505,1,0) -> 0 | Q505: =M505-N505-O505 -> 0
A506: BPPC_5_8_7.txt | B506: 49 | C506: 49 | D506: 0 | E506: 116 | I506: =MAX(B506,CEILING(F506,1)) -> 49 | J506: 49 | K506: 0 | L506: 116 | M506: 1 | N506: =IF(B506=C506,1,0) -> 1 | O506: =IF(I506=C506,1,0)-N506 -> 0 | P506: =IF(J506<C506,1,0) -> 0 | Q506: =M506-N506-O506 -> 0
A507: BPPC_5_8_8.txt | B507: 53 | C507: 53 | D507: 0 | E507: 90 | I507: =MAX(B507,CEILING(F507,1)) -> 53 | J507: 53 | K507: 0 | L507: 90 | M507: 1 | N507: =IF(B507=C507,1,0) -> 1 | O507: =IF(I507=C507,1,0)-N507 -> 0 | P507: =IF(J507<C507,1,0) -> 0 | Q507: =M507-N507-O507 -> 0
A508: BPPC_5_8_9.txt | B508: 49 | C508: 49 | D508: 0 | E508: 114 | I508: =MAX(B508,CEILING(F508,1)) -> 49 | J508: 49 | K508: 0 | L508: 114 | M508: 1 | N508: =IF(B508=C508,1,0) -> 1 | O508: =IF(I508=C508,1,0)-N508 -> 0 | P508: =IF(J508<C508,1,0) -> 0 | Q508: =M508-N508-O508 -> 0
A509: BPPC_5_8_10.txt | B509: 51 | C509: 51 | D509: 0 | E509: 103 | I509: =MAX(B509,CEILING(F509,1)) -> 51 | J509: 51 | K509: 0 | L509: 103 | M509: 1 | N509: =IF(B509=C509,1,0) -> 1 | O509: =IF(I509=C509,1,0)-N509 -> 0 | P509: =IF(J509<C509,1,0) -> 0 | Q509: =M509-N509-O509 -> 0
A510: BPPC_5_9_1.txt | B510: 50 | C510: 50 | D510: 0 | E510: 86 | I510: =MAX(B510,CEILING(F510,1)) -> 50 | J510: 50 | K510: 0 | L510: 86 | M510: 1 | N510: =IF(B510=C510,1,0) -> 1 | O510: =IF(I510=C510,1,0)-N510 -> 0 | P510: =IF(J510<C510,1,0) -> 0 | Q510: =M510-N510-O510 -> 0
A511: BPPC_5_9_2.txt | B511: 56 | C511: 56 | D511: 0 | E511: 67 | I511: =MAX(B511,CEILING(F511,1)) -> 56 | J511: 56 | K511: 0 | L511: 67 | M511: 1 | N511: =IF(B511=C511,1,0) -> 1 | O511: =IF(I511=C511,1,0)-N511 -> 0 | P511: =IF(J511<C511,1,0) -> 0 | Q511: =M511-N511-O511 -> 0
A512: BPPC_5_9_3.txt | B512: 54 | C512: 54 | D512: 0 | E512: 70 | I512: =MAX(B512,CEILING(F512,1)) -> 54 | J512: 54 | K512: 0 | L512: 70 | M512: 1 | N512: =IF(B512=C512,1,0) -> 1 | O512: =IF(I512=C512,1,0)-N512 -> 0 | P512: =IF(J512<C512,1,0) -> 0 | Q512: =M512-N512-O512 -> 0
A513: BPPC_5_9_4.txt | B513: 54 | C513: 54 | D513: 0 | E513: 71 | I513: =MAX(B513,CEILING(F513,1)) -> 54 | J513: 54 | K513: 0 | L513: 71 | M513: 1 | N513: =IF(B513=C513,1,0) -> 1 | O513: =IF(I513=C513,1,0)-N513 -> 0 | P513: =IF(J513<C513,1,0) -> 0 | Q513: =M513-N513-O513 -> 0
A514: BPPC_5_9_5.txt | B514: 52 | C514: 52 | D514: 0 | E514: 75 | I514: =MAX(B514,CEILING(F514,1)) -> 52 | J514: 52 | K514: 0 | L514: 75 | M514: 1 | N514: =IF(B514=C514,1,0) -> 1 | O514: =IF(I514=C514,1,0)-N514 -> 0 | P514: =IF(J514<C514,1,0) -> 0 | Q514: =M514-N514-O514 -> 0
A515: BPPC_5_9_6.txt | B515: 56 | C515: 56 | D515: 0 | E515: 64 | I515: =MAX(B515,CEILING(F515,1)) -> 56 | J515: 56 | K515: 0 | L515: 64 | M515: 1 | N515: =IF(B515=C515,1,0) -> 1 | O515: =IF(I515=C515,1,0)-N515 -> 0 | P515: =IF(J515<C515,1,0) -> 0 | Q515: =M515-N515-O515 -> 0
A516: BPPC_5_9_7.txt | B516: 54 | C516: 54 | D516: 0 | E516: 69 | I516: =MAX(B516,CEILING(F516,1)) -> 54 | J516: 54 | K516: 0 | L516: 69 | M516: 1 | N516: =IF(B516=C516,1,0) -> 1 | O516: =IF(I516=C516,1,0)-N516 -> 0 | P516: =IF(J516<C516,1,0) -> 0 | Q516: =M516-N516-O516 -> 0
A517: BPPC_5_9_8.txt | B517: 57 | C517: 57 | D517: 0 | E517: 62 | I517: =MAX(B517,CEILING(F517,1)) -> 57 | J517: 57 | K517: 0 | L517: 62 | M517: 1 | N517: =IF(B517=C517,1,0) -> 1 | O517: =IF(I517=C517,1,0)-N517 -> 0 | P517: =IF(J517<C517,1,0) -> 0 | Q517: =M517-N517-O517 -> 0
A518: BPPC_5_9_9.txt | B518: 55 | C518: 55 | D518: 0 | E518: 72 | I518: =MAX(B518,CEILING(F518,1)) -> 55 | J518: 55 | K518: 0 | L518: 72 | M518: 1 | N518: =IF(B518=C518,1,0) -> 1 | O518: =IF(I518=C518,1,0)-N518 -> 0 | P518: =IF(J518<C518,1,0) -> 0 | Q518: =M518-N518-O518 -> 0
A519: BPPC_5_9_10.txt | B519: 56 | C519: 56 | D519: 0 | E519: 72 | I519: =MAX(B519,CEILING(F519,1)) -> 56 | J519: 56 | K519: 0 | L519: 72 | M519: 1 | N519: =IF(B519=C519,1,0) -> 1 | O519: =IF(I519=C519,1,0)-N519 -> 0 | P519: =IF(J519<C519,1,0) -> 0 | Q519: =M519-N519-O519 -> 0
A520: BPPC_6_0_1.txt | B520: 40 | C520: 40 | D520: 0 | E520: 100 | I520: =MAX(B520,CEILING(F520,1)) -> 40 | J520: 40 | K520: 0 | L520: 100 | M520: 1 | N520: =IF(B520=C520,1,0) -> 1 | O520: =IF(I520=C520,1,0)-N520 -> 0 | P520: =IF(J520<C520,1,0) -> 0 | Q520: =M520-N520-O520 -> 0
A521: BPPC_6_0_2.txt | B521: 40 | C521: 40 | D521: 0 | E521: 94 | I521: =MAX(B521,CEILING(F521,1)) -> 40 | J521: 40 | K521: 0 | L521: 94 | M521: 1 | N521: =IF(B521=C521,1,0) -> 1 | O521: =IF(I521=C521,1,0)-N521 -> 0 | P521: =IF(J521<C521,1,0) -> 0 | Q521: =M521-N521-O521 -> 0
A522: BPPC_6_0_3.txt | B522: 40 | C522: 40 | D522: 0 | E522: 95 | I522: =MAX(B522,CEILING(F522,1)) -> 40 | J522: 40 | K522: 0 | L522: 95 | M522: 1 | N522: =IF(B522=C522,1,0) -> 1 | O522: =IF(I522=C522,1,0)-N522 -> 0 | P522: =IF(J522<C522,1,0) -> 0 | Q522: =M522-N522-O522 -> 0
A523: BPPC_6_0_4.txt | B523: 40 | C523: 40 | D523: 0 | E523: 95 | I523: =MAX(B523,CEILING(F523,1)) -> 40 | J523: 40 | K523: 0 | L523: 95 | M523: 1 | N523: =IF(B523=C523,1,0) -> 1 | O523: =IF(I523=C523,1,0)-N523 -> 0 | P523: =IF(J523<C523,1,0) -> 0 | Q523: =M523-N523-O523 -> 0
A524: BPPC_6_0_5.txt | B524: 40 | C524: 40 | D524: 0 | E524: 96 | I524: =MAX(B524,CEILING(F524,1)) -> 40 | J524: 40 | K524: 0 | L524: 96 | M524: 1 | N524: =IF(B524=C524,1,0) -> 1 | O524: =IF(I524=C524,1,0)-N524 -> 0 | P524: =IF(J524<C524,1,0) -> 0 | Q524: =M524-N524-O524 -> 0
A525: BPPC_6_0_6.txt | B525: 40 | C525: 40 | D525: 0 | E525: 96 | I525: =MAX(B525,CEILING(F525,1)) -> 40 | J525: 40 | K525: 0 | L525: 96 | M525: 1 | N525: =IF(B525=C525,1,0) -> 1 | O525: =IF(I525=C525,1,0)-N525 -> 0 | P525: =IF(J525<C525,1,0) -> 0 | Q525: =M525-N525-O525 -> 0
A526: BPPC_6_0_7.txt | B526: 40 | C526: 40 | D526: 0 | E526: 96 | I526: =MAX(B526,CEILING(F526,1)) -> 40 | J526: 40 | K526: 0 | L526: 96 | M526: 1 | N526: =IF(B526=C526,1,0) -> 1 | O526: =IF(I526=C526,1,0)-N526 -> 0 | P526: =IF(J526<C526,1,0) -> 0 | Q526: =M526-N526-O526 -> 0
A527: BPPC_6_0_8.txt | B527: 40 | C527: 40 | D527: 0 | E527: 100 | I527: =MAX(B527,CEILING(F527,1)) -> 40 | J527: 40 | K527: 0 | L527: 100 | M527: 1 | N527: =IF(B527=C527,1,0) -> 1 | O527: =IF(I527=C527,1,0)-N527 -> 0 | P527: =IF(J527<C527,1,0) -> 0 | Q527: =M527-N527-O527 -> 0
A528: BPPC_6_0_9.txt | B528: 40 | C528: 40 | D528: 0 | E528: 96 | I528: =MAX(B528,CEILING(F528,1)) -> 40 | J528: 40 | K528: 0 | L528: 96 | M528: 1 | N528: =IF(B528=C528,1,0) -> 1 | O528: =IF(I528=C528,1,0)-N528 -> 0 | P528: =IF(J528<C528,1,0) -> 0 | Q528: =M528-N528-O528 -> 0
A529: BPPC_6_0_10.txt | B529: 40 | C529: 40 | D529: 0 | E529: 103 | I529: =MAX(B529,CEILING(F529,1)) -> 40 | J529: 40 | K529: 0 | L529: 103 | M529: 1 | N529: =IF(B529=C529,1,0) -> 1 | O529: =IF(I529=C529,1,0)-N529 -> 0 | P529: =IF(J529<C529,1,0) -> 0 | Q529: =M529-N529-O529 -> 0
A530: BPPC_6_1_1.txt | B530: 40 | C530: 41 | D530: 122 | E530: 385 | F530: 40 | G530: 15 | H530: 564 | I530: =MAX(B530,CEILING(F530,1)) -> 40 | J530: 40 | K530: 94 | L530: 855 | M530: 1 | N530: =IF(B530=C530,1,0) -> 0 | O530: =IF(I530=C530,1,0)-N530 -> 0 | P530: =IF(J530<C530,1,0) -> 1 | Q530: =M530-N530-O530 -> 1
A531: BPPC_6_1_2.txt | B531: 40 | C531: 41 | D531: 122 | E531: 328 | F531: 40 | G531: 18 | H531: 566 | I531: =MAX(B531,CEILING(F531,1)) -> 40 | J531: 40 | K531: 89 | L531: 759 | M531: 1 | N531: =IF(B531=C531,1,0) -> 0 | O531: =IF(I531=C531,1,0)-N531 -> 0 | P531: =IF(J531<C531,1,0) -> 1 | Q531: =M531-N531-O531 -> 1
A532: BPPC_6_1_3.txt | B532: 40 | C532: 41 | D532: 122 | E532: 272 | F532: 40 | G532: 9 | H532: 494 | I532: =MAX(B532,CEILING(F532,1)) -> 40 | J532: 40 | K532: 113 | L532: 674 | M532: 1 | N532: =IF(B532=C532,1,0) -> 0 | O532: =IF(I532=C532,1,0)-N532 -> 0 | P532: =IF(J532<C532,1,0) -> 1 | Q532: =M532-N532-O532 -> 1
A533: BPPC_6_1_4.txt | B533: 40 | C533: 41 | D533: 121 | E533: 335 | F533: 40 | G533: 7 | H533: 566 | I533: =MAX(B533,CEILING(F533,1)) -> 40 | J533: 40 | K533: 33 | L533: 823 | M533: 1 | N533: =IF(B533=C533,1,0) -> 0 | O533: =IF(I533=C533,1,0)-N533 -> 0 | P533: =IF(J533<C533,1,0) -> 1 | Q533: =M533-N533-O533 -> 1
A534: BPPC_6_1_5.txt | B534: 40 | C534: 41 | D534: 121 | E534: 361 | F534: 40 | G534: 15 | H534: 568 | I534: =MAX(B534,CEILING(F534,1)) -> 40 | J534: 40 | K534: 92 | L534: 781 | M534: 1 | N534: =IF(B534=C534,1,0) -> 0 | O534: =IF(I534=C534,1,0)-N534 -> 0 | P534: =IF(J534<C534,1,0) -> 1 | Q534: =M534-N534-O534 -> 1
A535: BPPC_6_1_6.txt | B535: 40 | C535: 41 | D535: 121 | E535: 331 | F535: 40 | G535: 7 | H535: 552 | I535: =MAX(B535,CEILING(F535,1)) -> 40 | J535: 40 | K535: 43 | L535: 739 | M535: 1 | N535: =IF(B535=C535,1,0) -> 0 | O535: =IF(I535=C535,1,0)-N535 -> 0 | P535: =IF(J535<C535,1,0) -> 1 | Q535: =M535-N535-O535 -> 1
A536: BPPC_6_1_7.txt | B536: 40 | C536: 41 | D536: 121 | E536: 289 | F536: 40 | G536: 37 | H536: 505 | I536: =MAX(B536,CEILING(F536,1)) -> 40 | J536: 40 | K536: 109 | L536: 667 | M536: 1 | N536: =IF(B536=C536,1,0) -> 0 | O536: =IF(I536=C536,1,0)-N536 -> 0 | P536: =IF(J536<C536,1,0) -> 1 | Q536: =M536-N536-O536 -> 1
A537: BPPC_6_1_8.txt | B537: 40 | C537: 41 | D537: 121 | E537: 292 | F537: 40 | G537: 17 | H537: 511 | I537: =MAX(B537,CEILING(F537,1)) -> 40 | J537: 40 | K537: 122 | L537: 724 | M537: 1 | N537: =IF(B537=C537,1,0) -> 0 | O537: =IF(I537=C537,1,0)-N537 -> 0 | P537: =IF(J537<C537,1,0) -> 1 | Q537: =M537-N537-O537 -> 1
A538: BPPC_6_1_9.txt | B538: 40 | C538: 41 | D538: 121 | E538: 234 | F538: 40 | G538: 38 | H538: 503 | I538: =MAX(B538,CEILING(F538,1)) -> 40 | J538: 40 | K538: 107 | L538: 699 | M538: 1 | N538: =IF(B538=C538,1,0) -> 0 | O538: =IF(I538=C538,1,0)-N538 -> 0 | P538: =IF(J538<C538,1,0) -> 1 | Q538: =M538-N538-O538 -> 1
A539: BPPC_6_1_10.txt | B539: 40 | C539: 41 | D539: 122 | E539: 308 | F539: 40 | G539: 3 | H539: 480 | I539: =MAX(B539,CEILING(F539,1)) -> 40 | J539: 40 | K539: 24 | L539: 704 | M539: 1 | N539: =IF(B539=C539,1,0) -> 0 | O539: =IF(I539=C539,1,0)-N539 -> 0 | P539: =IF(J539<C539,1,0) -> 1 | Q539: =M539-N539-O539 -> 1
A540: BPPC_6_2_1.txt | B540: 40 | C540: 41 | D540: 121 | E540: 670 | F540: 40 | G540: 10 | H540: 818 | I540: =MAX(B540,CEILING(F540,1)) -> 40 | J540: 40 | K540: 59 | L540: 1008 | M540: 1 | N540: =IF(B540=C540,1,0) -> 0 | O540: =IF(I540=C540,1,0)-N540 -> 0 | P540: =IF(J540<C540,1,0) -> 1 | Q540: =M540-N540-O540 -> 1
A541: BPPC_6_2_2.txt | B541: 40 | C541: 41 | D541: 121 | E541: 493 | F541: 40 | G541: 10 | H541: 686 | I541: =MAX(B541,CEILING(F541,1)) -> 40 | J541: 40 | K541: 67 | L541: 929 | M541: 1 | N541: =IF(B541=C541,1,0) -> 0 | O541: =IF(I541=C541,1,0)-N541 -> 0 | P541: =IF(J541<C541,1,0) -> 1 | Q541: =M541-N541-O541 -> 1
A542: BPPC_6_2_3.txt | B542: 40 | C542: 41 | D542: 121 | E542: 496 | F542: 40 | G542: 5 | H542: 667 | I542: =MAX(B542,CEILING(F542,1)) -> 40 | J542: 40 | K542: 35 | L542: 858 | M542: 1 | N542: =IF(B542=C542,1,0) -> 0 | O542: =IF(I542=C542,1,0)-N542 -> 0 | P542: =IF(J542<C542,1,0) -> 1 | Q542: =M542-N542-O542 -> 1
A543: BPPC_6_2_4.txt | B543: 40 | C543: 41 | D543: 121 | E543: 505 | F543: 40 | G543: 9 | H543: 749 | I543: =MAX(B543,CEILING(F543,1)) -> 40 | J543: 40 | K543: 65 | L543: 1017 | M543: 1 | N543: =IF(B543=C543,1,0) -> 0 | O543: =IF(I543=C543,1,0)-N543 -> 0 | P543: =IF(J543<C543,1,0) -> 1 | Q543: =M543-N543-O543 -> 1
A544: BPPC_6_2_5.txt | B544: 40 | C544: 41 | D544: 121 | E544: 542 | F544: 40 | G544: 8 | H544: 708 | I544: =MAX(B544,CEILING(F544,1)) -> 40 | J544: 40 | K544: 40 | L544: 891 | M544: 1 | N544: =IF(B544=C544,1,0) -> 0 | O544: =IF(I544=C544,1,0)-N544 -> 0 | P544: =IF(J544<C544,1,0) -> 1 | Q544: =M544-N544-O544 -> 1
A545: BPPC_6_2_6.txt | B545: 40 | C545: 41 | D545: 121 | E545: 463 | F545: 40 | G545: 9 | H545: 663 | I545: =MAX(B545,CEILING(F545,1)) -> 40 | J545: 40 | K545: 28 | L545: 831 | M545: 1 | N545: =IF(B545=C545,1,0) -> 0 | O545: =IF(I545=C545,1,0)-N545 -> 0 | P545: =IF(J545<C545,1,0) -> 1 | Q545: =M545-N545-O545 -> 1
A546: BPPC_6_2_7.txt | B546: 40 | C546: 41 | D546: 121 | E546: 628 | F546: 40 | G546: 5 | H546: 802 | I546: =MAX(B546,CEILING(F546,1)) -> 40 | J546: 40 | K546: 20 | L546: 1026 | M546: 1 | N546: =IF(B546=C546,1,0) -> 0 | O546: =IF(I546=C546,1,0)-N546 -> 0 | P546: =IF(J546<C546,1,0) -> 1 | Q546: =M546-N546-O546 -> 1
A547: BPPC_6_2_8.txt | B547: 40 | C547: 41 | D547: 121 | E547: 547 | F547: 40 | G547: 8 | H547: 715 | I547: =MAX(B547,CEILING(F547,1)) -> 40 | J547: 41 | K547: 36001 | L547: 105371 | M547: 0 | N547: =IF(B547=C547,1,0) -> 0 | O547: =IF(I547=C547,1,0)-N547 -> 0 | P547: =IF(J547<C547,1,0) -> 0 | Q547: =M547-N547-O547 -> 0
A548: BPPC_6_2_9.txt | B548: 40 | C548: 41 | D548: 121 | E548: 470 | F548: 40 | G548: 8 | H548: 674 | I548: =MAX(B548,CEILING(F548,1)) -> 40 | J548: 40 | K548: 36 | L548: 926 | M548: 1 | N548: =IF(B548=C548,1,0) -> 0 | O548: =IF(I548=C548,1,0)-N548 -> 0 | P548: =IF(J548<C548,1,0) -> 1 | Q548: =M548-N548-O548 -> 1
A549: BPPC_6_2_10.txt | B549: 40 | C549: 41 | D549: 121 | E549: 493 | F549: 40 | G549: 6 | H549: 699 | I549: =MAX(B549,CEILING(F549,1)) -> 40 | J549: 41 | K549: 36001 | L549: 111910 | M549: 0 | N549: =IF(B549=C549,1,0) -> 0 | O549: =IF(I549=C549,1,0)-N549 -> 0 | P549: =IF(J549<C549,1,0) -> 0 | Q549: =M549-N549-O549 -> 0
A550: BPPC_6_3_1.txt | B550: 43 | C550: 43 | D550: 0 | E550: 832 | I550: =MAX(B550,CEILING(F550,1)) -> 43 | J550: 43 | K550: 0 | L550: 832 | M550: 1 | N550: =IF(B550=C550,1,0) -> 1 | O550: =IF(I550=C550,1,0)-N550 -> 0 | P550: =IF(J550<C550,1,0) -> 0 | Q550: =M550-N550-O550 -> 0
A551: BPPC_6_3_2.txt | B551: 40 | C551: 41 | D551: 121 | E551: 849 | F551: 40.006230000000002 | G551: 52 | H551: 1070 | I551: =MAX(B551,CEILING(F551,1)) -> 41 | J551: 41 | K551: 52 | L551: 1070 | M551: 1 | N551: =IF(B551=C551,1,0) -> 0 | O551: =IF(I551=C551,1,0)-N551 -> 1 | P551: =IF(J551<C551,1,0) -> 0 | Q551: =M551-N551-O551 -> 0
A552: BPPC_6_3_3.txt | B552: 40 | C552: 41 | D552: 121 | E552: 729 | F552: 40.0107 | G552: 63 | H552: 972 | I552: =MAX(B552,CEILING(F552,1)) -> 41 | J552: 41 | K552: 63 | L552: 972 | M552: 1 | N552: =IF(B552=C552,1,0) -> 0 | O552: =IF(I552=C552,1,0)-N552 -> 1 | P552: =IF(J552<C552,1,0) -> 0 | Q552: =M552-N552-O552 -> 0
A553: BPPC_6_3_4.txt | B553: 40 | C553: 41 | D553: 121 | E553: 844 | F553: 40.285710000000002 | G553: 2 | H553: 857 | I553: =MAX(B553,CEILING(F553,1)) -> 41 | J553: 41 | K553: 2 | L553: 857 | M553: 1 | N553: =IF(B553=C553,1,0) -> 0 | O553: =IF(I553=C553,1,0)-N553 -> 1 | P553: =IF(J553<C553,1,0) -> 0 | Q553: =M553-N553-O553 -> 0
A554: BPPC_6_3_5.txt | B554: 40 | C554: 41 | D554: 121 | E554: 743 | F554: 40 | G554: 24 | H554: 927 | I554: =MAX(B554,CEILING(F554,1)) -> 40 | J554: 41 | K554: 36001 | L554: 61077 | M554: 0 | N554: =IF(B554=C554,1,0) -> 0 | O554: =IF(I554=C554,1,0)-N554 -> 0 | P554: =IF(J554<C554,1,0) -> 0 | Q554: =M554-N554-O554 -> 0
A555: BPPC_6_3_6.txt | B555: 40 | C555: 41 | D555: 121 | E555: 842 | F555: 40 | G555: 21 | H555: 1043 | I555: =MAX(B555,CEILING(F555,1)) -> 40 | J555: 41 | K555: 36001 | L555: 69635 | M555: 0 | N555: =IF(B555=C555,1,0) -> 0 | O555: =IF(I555=C555,1,0)-N555 -> 0 | P555: =IF(J555<C555,1,0) -> 0 | Q555: =M555-N555-O555 -> 0
A556: BPPC_6_3_7.txt | B556: 41 | C556: 41 | D556: 0 | E556: 839 | I556: =MAX(B556,CEILING(F556,1)) -> 41 | J556: 41 | K556: 0 | L556: 839 | M556: 1 | N556: =IF(B556=C556,1,0) -> 1 | O556: =IF(I556=C556,1,0)-N556 -> 0 | P556: =IF(J556<C556,1,0) -> 0 | Q556: =M556-N556-O556 -> 0
A557: BPPC_6_3_8.txt | B557: 40 | C557: 41 | D557: 121 | E557: 889 | F557: 40.008749999999999 | G557: 37 | H557: 1126 | I557: =MAX(B557,CEILING(F557,1)) -> 41 | J557: 41 | K557: 37 | L557: 1126 | M557: 1 | N557: =IF(B557=C557,1,0) -> 0 | O557: =IF(I557=C557,1,0)-N557 -> 1 | P557: =IF(J557<C557,1,0) -> 0 | Q557: =M557-N557-O557 -> 0
A558: BPPC_6_3_9.txt | B558: 40 | C558: 41 | D558: 121 | E558: 765 | F558: 40 | G558: 20 | H558: 980 | I558: =MAX(B558,CEILING(F558,1)) -> 40 | J558: 41 | K558: 36001 | L558: 74791 | M558: 0 | N558: =IF(B558=C558,1,0) -> 0 | O558: =IF(I558=C558,1,0)-N558 -> 0 | P558: =IF(J558<C558,1,0) -> 0 | Q558: =M558-N558-O558 -> 0
A559: BPPC_6_3_10.txt | B559: 40 | C559: 41 | D559: 121 | E559: 824 | F559: 40 | G559: 14 | H559: 998 | I559: =MAX(B559,CEILING(F559,1)) -> 40 | J559: 40 | K559: 698 | L559: 1478 | M559: 1 | N559: =IF(B559=C559,1,0) -> 0 | O559: =IF(I559=C559,1,0)-N559 -> 0 | P559: =IF(J559<C559,1,0) -> 1 | Q559: =M559-N559-O559 -> 1
A560: BPPC_6_4_1.txt | B560: 53 | C560: 53 | D560: 0 | E560: 836 | I560: =MAX(B560,CEILING(F560,1)) -> 53 | J560: 53 | K560: 0 | L560: 836 | M560: 1 | N560: =IF(B560=C560,1,0) -> 1 | O560: =IF(I560=C560,1,0)-N560 -> 0 | P560: =IF(J560<C560,1,0) -> 0 | Q560: =M560-N560-O560 -> 0
A561: BPPC_6_4_2.txt | B561: 50 | C561: 51 | D561: 121 | E561: 863 | F561: 50.25 | G561: 0 | H561: 866 | I561: =MAX(B561,CEILING(F561,1)) -> 51 | J561: 51 | K561: 0 | L561: 866 | M561: 1 | N561: =IF(B561=C561,1,0) -> 0 | O561: =IF(I561=C561,1,0)-N561 -> 1 | P561: =IF(J561<C561,1,0) -> 0 | Q561: =M561-N561-O561 -> 0
A562: BPPC_6_4_3.txt | B562: 48 | C562: 48 | D562: 0 | E562: 801 | I562: =MAX(B562,CEILING(F562,1)) -> 48 | J562: 48 | K562: 0 | L562: 801 | M562: 1 | N562: =IF(B562=C562,1,0) -> 1 | O562: =IF(I562=C562,1,0)-N562 -> 0 | P562: =IF(J562<C562,1,0) -> 0 | Q562: =M562-N562-O562 -> 0
A563: BPPC_6_4_4.txt | B563: 51 | C563: 51 | D563: 0 | E563: 797 | I563: =MAX(B563,CEILING(F563,1)) -> 51 | J563: 51 | K563: 0 | L563: 797 | M563: 1 | N563: =IF(B563=C563,1,0) -> 1 | O563: =IF(I563=C563,1,0)-N563 -> 0 | P563: =IF(J563<C563,1,0) -> 0 | Q563: =M563-N563-O563 -> 0
A564: BPPC_6_4_5.txt | B564: 45 | C564: 45 | D564: 0 | E564: 854 | I564: =MAX(B564,CEILING(F564,1)) -> 45 | J564: 45 | K564: 0 | L564: 854 | M564: 1 | N564: =IF(B564=C564,1,0) -> 1 | O564: =IF(I564=C564,1,0)-N564 -> 0 | P564: =IF(J564<C564,1,0) -> 0 | Q564: =M564-N564-O564 -> 0
A565: BPPC_6_4_6.txt | B565: 44 | C565: 45 | D565: 121 | E565: 876 | F565: 44 | G565: 0 | H565: 876 | I565: =MAX(B565,CEILING(F565,1)) -> 44 | J565: 44 | K565: 0 | L565: 883 | M565: 1 | N565: =IF(B565=C565,1,0) -> 0 | O565: =IF(I565=C565,1,0)-N565 -> 0 | P565: =IF(J565<C565,1,0) -> 1 | Q565: =M565-N565-O565 -> 1
A566: BPPC_6_4_7.txt | B566: 50 | C566: 50 | D566: 0 | E566: 820 | I566: =MAX(B566,CEILING(F566,1)) -> 50 | J566: 50 | K566: 0 | L566: 820 | M566: 1 | N566: =IF(B566=C566,1,0) -> 1 | O566: =IF(I566=C566,1,0)-N566 -> 0 | P566: =IF(J566<C566,1,0) -> 0 | Q566: =M566-N566-O566 -> 0
A567: BPPC_6_4_8.txt | B567: 48 | C567: 48 | D567: 0 | E567: 854 | I567: =MAX(B567,CEILING(F567,1)) -> 48 | J567: 48 | K567: 0 | L567: 854 | M567: 1 | N567: =IF(B567=C567,1,0) -> 1 | O567: =IF(I567=C567,1,0)-N567 -> 0 | P567: =IF(J567<C567,1,0) -> 0 | Q567: =M567-N567-O567 -> 0
A568: BPPC_6_4_9.txt | B568: 50 | C568: 50 | D568: 0 | E568: 847 | I568: =MAX(B568,CEILING(F568,1)) -> 50 | J568: 50 | K568: 0 | L568: 847 | M568: 1 | N568: =IF(B568=C568,1,0) -> 1 | O568: =IF(I568=C568,1,0)-N568 -> 0 | P568: =IF(J568<C568,1,0) -> 0 | Q568: =M568-N568-O568 -> 0
A569: BPPC_6_4_10.txt | B569: 43 | C569: 43 | D569: 0 | E569: 866 | I569: =MAX(B569,CEILING(F569,1)) -> 43 | J569: 43 | K569: 0 | L569: 866 | M569: 1 | N569: =IF(B569=C569,1,0) -> 1 | O569: =IF(I569=C569,1,0)-N569 -> 0 | P569: =IF(J569<C569,1,0) -> 0 | Q569: =M569-N569-O569 -> 0
A570: BPPC_6_5_1.txt | B570: 64 | C570: 64 | D570: 0 | E570: 673 | I570: =MAX(B570,CEILING(F570,1)) -> 64 | J570: 64 | K570: 0 | L570: 673 | M570: 1 | N570: =IF(B570=C570,1,0) -> 1 | O570: =IF(I570=C570,1,0)-N570 -> 0 | P570: =IF(J570<C570,1,0) -> 0 | Q570: =M570-N570-O570 -> 0
A571: BPPC_6_5_2.txt | B571: 65 | C571: 65 | D571: 0 | E571: 673 | I571: =MAX(B571,CEILING(F571,1)) -> 65 | J571: 65 | K571: 0 | L571: 673 | M571: 1 | N571: =IF(B571=C571,1,0) -> 1 | O571: =IF(I571=C571,1,0)-N571 -> 0 | P571: =IF(J571<C571,1,0) -> 0 | Q571: =M571-N571-O571 -> 0
A572: BPPC_6_5_3.txt | B572: 64 | C572: 64 | D572: 1 | E572: 611 | I572: =MAX(B572,CEILING(F572,1)) -> 64 | J572: 64 | K572: 0 | L572: 611 | M572: 1 | N572: =IF(B572=C572,1,0) -> 1 | O572: =IF(I572=C572,1,0)-N572 -> 0 | P572: =IF(J572<C572,1,0) -> 0 | Q572: =M572-N572-O572 -> 0
A573: BPPC_6_5_4.txt | B573: 59 | C573: 59 | D573: 0 | E573: 658 | I573: =MAX(B573,CEILING(F573,1)) -> 59 | J573: 59 | K573: 0 | L573: 658 | M573: 1 | N573: =IF(B573=C573,1,0) -> 1 | O573: =IF(I573=C573,1,0)-N573 -> 0 | P573: =IF(J573<C573,1,0) -> 0 | Q573: =M573-N573-O573 -> 0
A574: BPPC_6_5_5.txt | B574: 59 | C574: 59 | D574: 0 | E574: 672 | I574: =MAX(B574,CEILING(F574,1)) -> 59 | J574: 59 | K574: 0 | L574: 672 | M574: 1 | N574: =IF(B574=C574,1,0) -> 1 | O574: =IF(I574=C574,1,0)-N574 -> 0 | P574: =IF(J574<C574,1,0) -> 0 | Q574: =M574-N574-O574 -> 0
A575: BPPC_6_5_6.txt | B575: 58 | C575: 58 | D575: 0 | E575: 681 | I575: =MAX(B575,CEILING(F575,1)) -> 58 | J575: 58 | K575: 0 | L575: 681 | M575: 1 | N575: =IF(B575=C575,1,0) -> 1 | O575: =IF(I575=C575,1,0)-N575 -> 0 | P575: =IF(J575<C575,1,0) -> 0 | Q575: =M575-N575-O575 -> 0
A576: BPPC_6_5_7.txt | B576: 64 | C576: 64 | D576: 0 | E576: 668 | I576: =MAX(B576,CEILING(F576,1)) -> 64 | J576: 64 | K576: 0 | L576: 668 | M576: 1 | N576: =IF(B576=C576,1,0) -> 1 | O576: =IF(I576=C576,1,0)-N576 -> 0 | P576: =IF(J576<C576,1,0) -> 0 | Q576: =M576-N576-O576 -> 0
A577: BPPC_6_5_8.txt | B577: 58 | C577: 58 | D577: 0 | E577: 679 | I577: =MAX(B577,CEILING(F577,1)) -> 58 | J577: 58 | K577: 0 | L577: 679 | M577: 1 | N577: =IF(B577=C577,1,0) -> 1 | O577: =IF(I577=C577,1,0)-N577 -> 0 | P577: =IF(J577<C577,1,0) -> 0 | Q577: =M577-N577-O577 -> 0
A578: BPPC_6_5_9.txt | B578: 63 | C578: 63 | D578: 0 | E578: 661 | I578: =MAX(B578,CEILING(F578,1)) -> 63 | J578: 63 | K578: 0 | L578: 661 | M578: 1 | N578: =IF(B578=C578,1,0) -> 1 | O578: =IF(I578=C578,1,0)-N578 -> 0 | P578: =IF(J578<C578,1,0) -> 0 | Q578: =M578-N578-O578 -> 0
A579: BPPC_6_5_10.txt | B579: 55 | C579: 55 | D579: 0 | E579: 674 | I579: =MAX(B579,CEILING(F579,1)) -> 55 | J579: 55 | K579: 0 | L579: 674 | M579: 1 | N579: =IF(B579=C579,1,0) -> 1 | O579: =IF(I579=C579,1,0)-N579 -> 0 | P579: =IF(J579<C579,1,0) -> 0 | Q579: =M579-N579-O579 -> 0
A580: BPPC_6_6_1.txt | B580: 74 | C580: 74 | D580: 0 | E580: 545 | I580: =MAX(B580,CEILING(F580,1)) -> 74 | J580: 74 | K580: 0 | L580: 545 | M580: 1 | N580: =IF(B580=C580,1,0) -> 1 | O580: =IF(I580=C580,1,0)-N580 -> 0 | P580: =IF(J580<C580,1,0) -> 0 | Q580: =M580-N580-O580 -> 0
A581: BPPC_6_6_2.txt | B581: 73 | C581: 73 | D581: 0 | E581: 507 | I581: =MAX(B581,CEILING(F581,1)) -> 73 | J581: 73 | K581: 0 | L581: 507 | M581: 1 | N581: =IF(B581=C581,1,0) -> 1 | O581: =IF(I581=C581,1,0)-N581 -> 0 | P581: =IF(J581<C581,1,0) -> 0 | Q581: =M581-N581-O581 -> 0
A582: BPPC_6_6_3.txt | B582: 80 | C582: 80 | D582: 0 | E582: 462 | I582: =MAX(B582,CEILING(F582,1)) -> 80 | J582: 80 | K582: 0 | L582: 462 | M582: 1 | N582: =IF(B582=C582,1,0) -> 1 | O582: =IF(I582=C582,1,0)-N582 -> 0 | P582: =IF(J582<C582,1,0) -> 0 | Q582: =M582-N582-O582 -> 0
A583: BPPC_6_6_4.txt | B583: 73 | C583: 73 | D583: 0 | E583: 547 | I583: =MAX(B583,CEILING(F583,1)) -> 73 | J583: 73 | K583: 0 | L583: 547 | M583: 1 | N583: =IF(B583=C583,1,0) -> 1 | O583: =IF(I583=C583,1,0)-N583 -> 0 | P583: =IF(J583<C583,1,0) -> 0 | Q583: =M583-N583-O583 -> 0
A584: BPPC_6_6_5.txt | B584: 73 | C584: 73 | D584: 0 | E584: 569 | I584: =MAX(B584,CEILING(F584,1)) -> 73 | J584: 73 | K584: 0 | L584: 569 | M584: 1 | N584: =IF(B584=C584,1,0) -> 1 | O584: =IF(I584=C584,1,0)-N584 -> 0 | P584: =IF(J584<C584,1,0) -> 0 | Q584: =M584-N584-O584 -> 0
A585: BPPC_6_6_6.txt | B585: 73 | C585: 73 | D585: 0 | E585: 600 | I585: =MAX(B585,CEILING(F585,1)) -> 73 | J585: 73 | K585: 0 | L585: 600 | M585: 1 | N585: =IF(B585=C585,1,0) -> 1 | O585: =IF(I585=C585,1,0)-N585 -> 0 | P585: =IF(J585<C585,1,0) -> 0 | Q585: =M585-N585-O585 -> 0
A586: BPPC_6_6_7.txt | B586: 73 | C586: 74 | D586: 121 | E586: 497 | F586: 73.2 | G586: 0 | H586: 504 | I586: =MAX(B586,CEILING(F586,1)) -> 74 | J586: 74 | K586: 0 | L586: 504 | M586: 1 | N586: =IF(B586=C586,1,0) -> 0 | O586: =IF(I586=C586,1,0)-N586 -> 1 | P586: =IF(J586<C586,1,0) -> 0 | Q586: =M586-N586-O586 -> 0
A587: BPPC_6_6_8.txt | B587: 76 | C587: 76 | D587: 0 | E587: 589 | I587: =MAX(B587,CEILING(F587,1)) -> 76 | J587: 76 | K587: 0 | L587: 589 | M587: 1 | N587: =IF(B587=C587,1,0) -> 1 | O587: =IF(I587=C587,1,0)-N587 -> 0 | P587: =IF(J587<C587,1,0) -> 0 | Q587: =M587-N587-O587 -> 0
A588: BPPC_6_6_9.txt | B588: 77 | C588: 77 | D588: 0 | E588: 539 | I588: =MAX(B588,CEILING(F588,1)) -> 77 | J588: 77 | K588: 0 | L588: 539 | M588: 1 | N588: =IF(B588=C588,1,0) -> 1 | O588: =IF(I588=C588,1,0)-N588 -> 0 | P588: =IF(J588<C588,1,0) -> 0 | Q588: =M588-N588-O588 -> 0
A589: BPPC_6_6_10.txt | B589: 71 | C589: 71 | D589: 0 | E589: 561 | I589: =MAX(B589,CEILING(F589,1)) -> 71 | J589: 71 | K589: 0 | L589: 561 | M589: 1 | N589: =IF(B589=C589,1,0) -> 1 | O589: =IF(I589=C589,1,0)-N589 -> 0 | P589: =IF(J589<C589,1,0) -> 0 | Q589: =M589-N589-O589 -> 0
A590: BPPC_6_7_1.txt | B590: 83 | C590: 83 | D590: 0 | E590: 427 | I590: =MAX(B590,CEILING(F590,1)) -> 83 | J590: 83 | K590: 0 | L590: 427 | M590: 1 | N590: =IF(B590=C590,1,0) -> 1 | O590: =IF(I590=C590,1,0)-N590 -> 0 | P590: =IF(J590<C590,1,0) -> 0 | Q590: =M590-N590-O590 -> 0
A591: BPPC_6_7_2.txt | B591: 82 | C591: 82 | D591: 0 | E591: 384 | I591: =MAX(B591,CEILING(F591,1)) -> 82 | J591: 82 | K591: 0 | L591: 384 | M591: 1 | N591: =IF(B591=C591,1,0) -> 1 | O591: =IF(I591=C591,1,0)-N591 -> 0 | P591: =IF(J591<C591,1,0) -> 0 | Q591: =M591-N591-O591 -> 0
A592: BPPC_6_7_3.txt | B592: 90 | C592: 90 | D592: 0 | E592: 337 | I592: =MAX(B592,CEILING(F592,1)) -> 90 | J592: 90 | K592: 0 | L592: 337 | M592: 1 | N592: =IF(B592=C592,1,0) -> 1 | O592: =IF(I592=C592,1,0)-N592 -> 0 | P592: =IF(J592<C592,1,0) -> 0 | Q592: =M592-N592-O592 -> 0
A593: BPPC_6_7_4.txt | B593: 83 | C593: 83 | D593: 0 | E593: 470 | I593: =MAX(B593,CEILING(F593,1)) -> 83 | J593: 83 | K593: 0 | L593: 470 | M593: 1 | N593: =IF(B593=C593,1,0) -> 1 | O593: =IF(I593=C593,1,0)-N593 -> 0 | P593: =IF(J593<C593,1,0) -> 0 | Q593: =M593-N593-O593 -> 0
A594: BPPC_6_7_5.txt | B594: 84 | C594: 84 | D594: 1 | E594: 454 | I594: =MAX(B594,CEILING(F594,1)) -> 84 | J594: 84 | K594: 0 | L594: 454 | M594: 1 | N594: =IF(B594=C594,1,0) -> 1 | O594: =IF(I594=C594,1,0)-N594 -> 0 | P594: =IF(J594<C594,1,0) -> 0 | Q594: =M594-N594-O594 -> 0
A595: BPPC_6_7_6.txt | B595: 85 | C595: 85 | D595: 0 | E595: 440 | I595: =MAX(B595,CEILING(F595,1)) -> 85 | J595: 85 | K595: 0 | L595: 440 | M595: 1 | N595: =IF(B595=C595,1,0) -> 1 | O595: =IF(I595=C595,1,0)-N595 -> 0 | P595: =IF(J595<C595,1,0) -> 0 | Q595: =M595-N595-O595 -> 0
A596: BPPC_6_7_7.txt | B596: 90 | C596: 90 | D596: 0 | E596: 359 | I596: =MAX(B596,CEILING(F596,1)) -> 90 | J596: 90 | K596: 0 | L596: 359 | M596: 1 | N596: =IF(B596=C596,1,0) -> 1 | O596: =IF(I596=C596,1,0)-N596 -> 0 | P596: =IF(J596<C596,1,0) -> 0 | Q596: =M596-N596-O596 -> 0
A597: BPPC_6_7_8.txt | B597: 83 | C597: 83 | D597: 0 | E597: 470 | I597: =MAX(B597,CEILING(F597,1)) -> 83 | J597: 83 | K597: 0 | L597: 470 | M597: 1 | N597: =IF(B597=C597,1,0) -> 1 | O597: =IF(I597=C597,1,0)-N597 -> 0 | P597: =IF(J597<C597,1,0) -> 0 | Q597: =M597-N597-O597 -> 0
A598: BPPC_6_7_9.txt | B598: 87 | C598: 87 | D598: 0 | E598: 411 | I598: =MAX(B598,CEILING(F598,1)) -> 87 | J598: 87 | K598: 0 | L598: 411 | M598: 1 | N598: =IF(B598=C598,1,0) -> 1 | O598: =IF(I598=C598,1,0)-N598 -> 0 | P598: =IF(J598<C598,1,0) -> 0 | Q598: =M598-N598-O598 -> 0
A599: BPPC_6_7_10.txt | B599: 82 | C599: 82 | D599: 0 | E599: 451 | I599: =MAX(B599,CEILING(F599,1)) -> 82 | J599: 82 | K599: 0 | L599: 451 | M599: 1 | N599: =IF(B599=C599,1,0) -> 1 | O599: =IF(I599=C599,1,0)-N599 -> 0 | P599: =IF(J599<C599,1,0) -> 0 | Q599: =M599-N599-O599 -> 0
A600: BPPC_6_8_1.txt | B600: 96 | C600: 96 | D600: 0 | E600: 347 | I600: =MAX(B600,CEILING(F600,1)) -> 96 | J600: 96 | K600: 0 | L600: 347 | M600: 1 | N600: =IF(B600=C600,1,0) -> 1 | O600: =IF(I600=C600,1,0)-N600 -> 0 | P600: =IF(J600<C600,1,0) -> 0 | Q600: =M600-N600-O600 -> 0
A601: BPPC_6_8_2.txt | B601: 95 | C601: 95 | D601: 0 | E601: 352 | I601: =MAX(B601,CEILING(F601,1)) -> 95 | J601: 95 | K601: 0 | L601: 352 | M601: 1 | N601: =IF(B601=C601,1,0) -> 1 | O601: =IF(I601=C601,1,0)-N601 -> 0 | P601: =IF(J601<C601,1,0) -> 0 | Q601: =M601-N601-O601 -> 0
A602: BPPC_6_8_3.txt | B602: 102 | C602: 102 | D602: 0 | E602: 231 | I602: =MAX(B602,CEILING(F602,1)) -> 102 | J602: 102 | K602: 0 | L602: 231 | M602: 1 | N602: =IF(B602=C602,1,0) -> 1 | O602: =IF(I602=C602,1,0)-N602 -> 0 | P602: =IF(J602<C602,1,0) -> 0 | Q602: =M602-N602-O602 -> 0
A603: BPPC_6_8_4.txt | B603: 94 | C603: 94 | D603: 0 | E603: 333 | I603: =MAX(B603,CEILING(F603,1)) -> 94 | J603: 94 | K603: 0 | L603: 333 | M603: 1 | N603: =IF(B603=C603,1,0) -> 1 | O603: =IF(I603=C603,1,0)-N603 -> 0 | P603: =IF(J603<C603,1,0) -> 0 | Q603: =M603-N603-O603 -> 0
A604: BPPC_6_8_5.txt | B604: 97 | C604: 97 | D604: 0 | E604: 295 | I604: =MAX(B604,CEILING(F604,1)) -> 97 | J604: 97 | K604: 0 | L604: 295 | M604: 1 | N604: =IF(B604=C604,1,0) -> 1 | O604: =IF(I604=C604,1,0)-N604 -> 0 | P604: =IF(J604<C604,1,0) -> 0 | Q604: =M604-N604-O604 -> 0
A605: BPPC_6_8_6.txt | B605: 94 | C605: 95 | D605: 121 | E605: 282 | F605: 94.166669999999996 | G605: 1 | H605: 300 | I605: =MAX(B605,CEILING(F605,1)) -> 95 | J605: 95 | K605: 1 | L605: 300 | M605: 1 | N605: =IF(B605=C605,1,0) -> 0 | O605: =IF(I605=C605,1,0)-N605 -> 1 | P605: =IF(J605<C605,1,0) -> 0 | Q605: =M605-N605-O605 -> 0
A606: BPPC_6_8_7.txt | B606: 102 | C606: 102 | D606: 0 | E606: 237 | I606: =MAX(B606,CEILING(F606,1)) -> 102 | J606: 102 | K606: 0 | L606: 237 | M606: 1 | N606: =IF(B606=C606,1,0) -> 1 | O606: =IF(I606=C606,1,0)-N606 -> 0 | P606: =IF(J606<C606,1,0) -> 0 | Q606: =M606-N606-O606 -> 0
A607: BPPC_6_8_8.txt | B607: 92 | C607: 93 | D607: 121 | E607: 295 | F607: 92.333330000000004 | G607: 0 | H607: 303 | I607: =MAX(B607,CEILING(F607,1)) -> 93 | J607: 93 | K607: 0 | L607: 303 | M607: 1 | N607: =IF(B607=C607,1,0) -> 0 | O607: =IF(I607=C607,1,0)-N607 -> 1 | P607: =IF(J607<C607,1,0) -> 0 | Q607: =M607-N607-O607 -> 0
A608: BPPC_6_8_9.txt | B608: 97 | C608: 97 | D608: 0 | E608: 287 | I608: =MAX(B608,CEILING(F608,1)) -> 97 | J608: 97 | K608: 0 | L608: 287 | M608: 1 | N608: =IF(B608=C608,1,0) -> 1 | O608: =IF(I608=C608,1,0)-N608 -> 0 | P608: =IF(J608<C608,1,0) -> 0 | Q608: =M608-N608-O608 -> 0
A609: BPPC_6_8_10.txt | B609: 95 | C609: 95 | D609: 0 | E609: 325 | I609: =MAX(B609,CEILING(F609,1)) -> 95 | J609: 95 | K609: 0 | L609: 325 | M609: 1 | N609: =IF(B609=C609,1,0) -> 1 | O609: =IF(I609=C609,1,0)-N609 -> 0 | P609: =IF(J609<C609,1,0) -> 0 | Q609: =M609-N609-O609 -> 0
A610: BPPC_6_9_1.txt | B610: 105 | C610: 105 | D610: 0 | E610: 157 | I610: =MAX(B610,CEILING(F610,1)) -> 105 | J610: 105 | K610: 0 | L610: 157 | M610: 1 | N610: =IF(B610=C610,1,0) -> 1 | O610: =IF(I610=C610,1,0)-N610 -> 0 | P610: =IF(J610<C610,1,0) -> 0 | Q610: =M610-N610-O610 -> 0
A611: BPPC_6_9_2.txt | B611: 109 | C611: 109 | D611: 0 | E611: 190 | I611: =MAX(B611,CEILING(F611,1)) -> 109 | J611: 109 | K611: 0 | L611: 190 | M611: 1 | N611: =IF(B611=C611,1,0) -> 1 | O611: =IF(I611=C611,1,0)-N611 -> 0 | P611: =IF(J611<C611,1,0) -> 0 | Q611: =M611-N611-O611 -> 0
A612: BPPC_6_9_3.txt | B612: 110 | C612: 110 | D612: 1 | E612: 153 | I612: =MAX(B612,CEILING(F612,1)) -> 110 | J612: 110 | K612: 0 | L612: 153 | M612: 1 | N612: =IF(B612=C612,1,0) -> 1 | O612: =IF(I612=C612,1,0)-N612 -> 0 | P612: =IF(J612<C612,1,0) -> 0 | Q612: =M612-N612-O612 -> 0
A613: BPPC_6_9_4.txt | B613: 110 | C613: 110 | D613: 0 | E613: 170 | I613: =MAX(B613,CEILING(F613,1)) -> 110 | J613: 110 | K613: 0 | L613: 170 | M613: 1 | N613: =IF(B613=C613,1,0) -> 1 | O613: =IF(I613=C613,1,0)-N613 -> 0 | P613: =IF(J613<C613,1,0) -> 0 | Q613: =M613-N613-O613 -> 0
A614: BPPC_6_9_5.txt | B614: 109 | C614: 109 | D614: 0 | E614: 174 | I614: =MAX(B614,CEILING(F614,1)) -> 109 | J614: 109 | K614: 0 | L614: 174 | M614: 1 | N614: =IF(B614=C614,1,0) -> 1 | O614: =IF(I614=C614,1,0)-N614 -> 0 | P614: =IF(J614<C614,1,0) -> 0 | Q614: =M614-N614-O614 -> 0
A615: BPPC_6_9_6.txt | B615: 111 | C615: 111 | D615: 0 | E615: 156 | I615: =MAX(B615,CEILING(F615,1)) -> 111 | J615: 111 | K615: 0 | L615: 156 | M615: 1 | N615: =IF(B615=C615,1,0) -> 1 | O615: =IF(I615=C615,1,0)-N615 -> 0 | P615: =IF(J615<C615,1,0) -> 0 | Q615: =M615-N615-O615 -> 0
A616: BPPC_6_9_7.txt | B616: 111 | C616: 111 | D616: 0 | E616: 142 | I616: =MAX(B616,CEILING(F616,1)) -> 111 | J616: 111 | K616: 0 | L616: 142 | M616: 1 | N616: =IF(B616=C616,1,0) -> 1 | O616: =IF(I616=C616,1,0)-N616 -> 0 | P616: =IF(J616<C616,1,0) -> 0 | Q616: =M616-N616-O616 -> 0
A617: BPPC_6_9_8.txt | B617: 109 | C617: 109 | D617: 0 | E617: 194 | I617: =MAX(B617,CEILING(F617,1)) -> 109 | J617: 109 | K617: 0 | L617: 194 | M617: 1 | N617: =IF(B617=C617,1,0) -> 1 | O617: =IF(I617=C617,1,0)-N617 -> 0 | P617: =IF(J617<C617,1,0) -> 0 | Q617: =M617-N617-O617 -> 0
A618: BPPC_6_9_9.txt | B618: 108 | C618: 108 | D618: 0 | E618: 174 | I618: =MAX(B618,CEILING(F618,1)) -> 108 | J618: 108 | K618: 0 | L618: 174 | M618: 1 | N618: =IF(B618=C618,1,0) -> 1 | O618: =IF(I618=C618,1,0)-N618 -> 0 | P618: =IF(J618<C618,1,0) -> 0 | Q618: =M618-N618-O618 -> 0
A619: BPPC_6_9_10.txt | B619: 108 | C619: 108 | D619: 0 | E619: 177 | I619: =MAX(B619,CEILING(F619,1)) -> 108 | J619: 108 | K619: 0 | L619: 177 | M619: 1 | N619: =IF(B619=C619,1,0) -> 1 | O619: =IF(I619=C619,1,0)-N619 -> 0 | P619: =IF(J619<C619,1,0) -> 0 | Q619: =M619-N619-O619 -> 0
A620: BPPC_7_0_1.txt | B620: 83 | C620: 83 | D620: 0 | E620: 199 | I620: =MAX(B620,CEILING(F620,1)) -> 83 | J620: 83 | K620: 0 | L620: 199 | M620: 1 | N620: =IF(B620=C620,1,0) -> 1 | O620: =IF(I620=C620,1,0)-N620 -> 0 | P620: =IF(J620<C620,1,0) -> 0 | Q620: =M620-N620-O620 -> 0
A621: BPPC_7_0_2.txt | B621: 83 | C621: 83 | D621: 0 | E621: 194 | I621: =MAX(B621,CEILING(F621,1)) -> 83 | J621: 83 | K621: 0 | L621: 194 | M621: 1 | N621: =IF(B621=C621,1,0) -> 1 | O621: =IF(I621=C621,1,0)-N621 -> 0 | P621: =IF(J621<C621,1,0) -> 0 | Q621: =M621-N621-O621 -> 0
A622: BPPC_7_0_3.txt | B622: 83 | C622: 83 | D622: 0 | E622: 209 | I622: =MAX(B622,CEILING(F622,1)) -> 83 | J622: 83 | K622: 0 | L622: 209 | M622: 1 | N622: =IF(B622=C622,1,0) -> 1 | O622: =IF(I622=C622,1,0)-N622 -> 0 | P622: =IF(J622<C622,1,0) -> 0 | Q622: =M622-N622-O622 -> 0
A623: BPPC_7_0_4.txt | B623: 83 | C623: 83 | D623: 0 | E623: 192 | I623: =MAX(B623,CEILING(F623,1)) -> 83 | J623: 83 | K623: 0 | L623: 192 | M623: 1 | N623: =IF(B623=C623,1,0) -> 1 | O623: =IF(I623=C623,1,0)-N623 -> 0 | P623: =IF(J623<C623,1,0) -> 0 | Q623: =M623-N623-O623 -> 0
A624: BPPC_7_0_5.txt | B624: 83 | C624: 83 | D624: 0 | E624: 188 | I624: =MAX(B624,CEILING(F624,1)) -> 83 | J624: 83 | K624: 0 | L624: 188 | M624: 1 | N624: =IF(B624=C624,1,0) -> 1 | O624: =IF(I624=C624,1,0)-N624 -> 0 | P624: =IF(J624<C624,1,0) -> 0 | Q624: =M624-N624-O624 -> 0
A625: BPPC_7_0_6.txt | B625: 83 | C625: 83 | D625: 0 | E625: 203 | I625: =MAX(B625,CEILING(F625,1)) -> 83 | J625: 83 | K625: 0 | L625: 203 | M625: 1 | N625: =IF(B625=C625,1,0) -> 1 | O625: =IF(I625=C625,1,0)-N625 -> 0 | P625: =IF(J625<C625,1,0) -> 0 | Q625: =M625-N625-O625 -> 0
A626: BPPC_7_0_7.txt | B626: 83 | C626: 83 | D626: 0 | E626: 198 | I626: =MAX(B626,CEILING(F626,1)) -> 83 | J626: 83 | K626: 0 | L626: 198 | M626: 1 | N626: =IF(B626=C626,1,0) -> 1 | O626: =IF(I626=C626,1,0)-N626 -> 0 | P626: =IF(J626<C626,1,0) -> 0 | Q626: =M626-N626-O626 -> 0
A627: BPPC_7_0_8.txt | B627: 83 | C627: 83 | D627: 0 | E627: 195 | I627: =MAX(B627,CEILING(F627,1)) -> 83 | J627: 83 | K627: 0 | L627: 195 | M627: 1 | N627: =IF(B627=C627,1,0) -> 1 | O627: =IF(I627=C627,1,0)-N627 -> 0 | P627: =IF(J627<C627,1,0) -> 0 | Q627: =M627-N627-O627 -> 0
A628: BPPC_7_0_9.txt | B628: 83 | C628: 83 | D628: 0 | E628: 193 | I628: =MAX(B628,CEILING(F628,1)) -> 83 | J628: 83 | K628: 0 | L628: 193 | M628: 1 | N628: =IF(B628=C628,1,0) -> 1 | O628: =IF(I628=C628,1,0)-N628 -> 0 | P628: =IF(J628<C628,1,0) -> 0 | Q628: =M628-N628-O628 -> 0
A629: BPPC_7_0_10.txt | B629: 83 | C629: 83 | D629: 0 | E629: 201 | I629: =MAX(B629,CEILING(F629,1)) -> 83 | J629: 83 | K629: 0 | L629: 201 | M629: 1 | N629: =IF(B629=C629,1,0) -> 1 | O629: =IF(I629=C629,1,0)-N629 -> 0 | P629: =IF(J629<C629,1,0) -> 0 | Q629: =M629-N629-O629 -> 0
A630: BPPC_7_1_1.txt | B630: 83 | C630: 84 | D630: 126 | E630: 902 | F630: 83 | G630: 32 | H630: 1149 | I630: =MAX(B630,CEILING(F630,1)) -> 83 | J630: 83 | K630: 143 | L630: 1720 | M630: 1 | N630: =IF(B630=C630,1,0) -> 0 | O630: =IF(I630=C630,1,0)-N630 -> 0 | P630: =IF(J630<C630,1,0) -> 1 | Q630: =M630-N630-O630 -> 1
A631: BPPC_7_1_2.txt | B631: 83 | C631: 84 | D631: 130 | E631: 1091 | F631: 83 | G631: 21 | H631: 1330 | I631: =MAX(B631,CEILING(F631,1)) -> 83 | J631: 83 | K631: 194 | L631: 1999 | M631: 1 | N631: =IF(B631=C631,1,0) -> 0 | O631: =IF(I631=C631,1,0)-N631 -> 0 | P631: =IF(J631<C631,1,0) -> 1 | Q631: =M631-N631-O631 -> 1
A632: BPPC_7_1_3.txt | B632: 83 | C632: 84 | D632: 125 | E632: 793 | F632: 83 | G632: 442 | H632: 1144 | I632: =MAX(B632,CEILING(F632,1)) -> 83 | J632: 84 | K632: 36001 | L632: 160540 | M632: 0 | N632: =IF(B632=C632,1,0) -> 0 | O632: =IF(I632=C632,1,0)-N632 -> 0 | P632: =IF(J632<C632,1,0) -> 0 | Q632: =M632-N632-O632 -> 0
A633: BPPC_7_1_4.txt | B633: 83 | C633: 84 | D633: 126 | E633: 974 | F633: 83 | G633: 28 | H633: 1230 | I633: =MAX(B633,CEILING(F633,1)) -> 83 | J633: 83 | K633: 259 | L633: 2018 | M633: 1 | N633: =IF(B633=C633,1,0) -> 0 | O633: =IF(I633=C633,1,0)-N633 -> 0 | P633: =IF(J633<C633,1,0) -> 1 | Q633: =M633-N633-O633 -> 1
A634: BPPC_7_1_5.txt | B634: 83 | C634: 84 | D634: 129 | E634: 779 | F634: 83 | G634: 12 | H634: 1084 | I634: =MAX(B634,CEILING(F634,1)) -> 83 | J634: 83 | K634: 299 | L634: 1769 | M634: 1 | N634: =IF(B634=C634,1,0) -> 0 | O634: =IF(I634=C634,1,0)-N634 -> 0 | P634: =IF(J634<C634,1,0) -> 1 | Q634: =M634-N634-O634 -> 1
A635: BPPC_7_1_6.txt | B635: 83 | C635: 84 | D635: 126 | E635: 963 | F635: 83 | G635: 24 | H635: 1208 | I635: =MAX(B635,CEILING(F635,1)) -> 83 | J635: 83 | K635: 404 | L635: 1819 | M635: 1 | N635: =IF(B635=C635,1,0) -> 0 | O635: =IF(I635=C635,1,0)-N635 -> 0 | P635: =IF(J635<C635,1,0) -> 1 | Q635: =M635-N635-O635 -> 1
A636: BPPC_7_1_7.txt | B636: 83 | C636: 84 | D636: 126 | E636: 816 | F636: 83 | G636: 93 | H636: 1102 | I636: =MAX(B636,CEILING(F636,1)) -> 83 | J636: 83 | K636: 527 | L636: 1811 | M636: 1 | N636: =IF(B636=C636,1,0) -> 0 | O636: =IF(I636=C636,1,0)-N636 -> 0 | P636: =IF(J636<C636,1,0) -> 1 | Q636: =M636-N636-O636 -> 1
A637: BPPC_7_1_8.txt | B637: 83 | C637: 84 | D637: 129 | E637: 858 | F637: 83 | G637: 16 | H637: 1218 | I637: =MAX(B637,CEILING(F637,1)) -> 83 | J637: 83 | K637: 138 | L637: 1887 | M637: 1 | N637: =IF(B637=C637,1,0) -> 0 | O637: =IF(I637=C637,1,0)-N637 -> 0 | P637: =IF(J637<C637,1,0) -> 1 | Q637: =M637-N637-O637 -> 1
A638: BPPC_7_1_9.txt | B638: 83 | C638: 84 | D638: 126 | E638: 884 | F638: 83 | G638: 20 | H638: 1177 | I638: =MAX(B638,CEILING(F638,1)) -> 83 | J638: 83 | K638: 207 | L638: 1741 | M638: 1 | N638: =IF(B638=C638,1,0) -> 0 | O638: =IF(I638=C638,1,0)-N638 -> 0 | P638: =IF(J638<C638,1,0) -> 1 | Q638: =M638-N638-O638 -> 1
A639: BPPC_7_1_10.txt | B639: 83 | C639: 84 | D639: 126 | E639: 999 | F639: 83 | G639: 16 | H639: 1236 | I639: =MAX(B639,CEILING(F639,1)) -> 83 | J639: 83 | K639: 119 | L639: 1812 | M639: 1 | N639: =IF(B639=C639,1,0) -> 0 | O639: =IF(I639=C639,1,0)-N639 -> 0 | P639: =IF(J639<C639,1,0) -> 1 | Q639: =M639-N639-O639 -> 1
A640: BPPC_7_2_1.txt | B640: 83 | C640: 84 | D640: 123 | E640: 1745 | F640: 83 | G640: 50 | H640: 1912 | I640: =MAX(B640,CEILING(F640,1)) -> 83 | J640: 83 | K640: 567 | L640: 2684 | M640: 1 | N640: =IF(B640=C640,1,0) -> 0 | O640: =IF(I640=C640,1,0)-N640 -> 0 | P640: =IF(J640<C640,1,0) -> 1 | Q640: =M640-N640-O640 -> 1
A641: BPPC_7_2_2.txt | B641: 83 | C641: 84 | D641: 126 | E641: 1592 | F641: 83 | G641: 32 | H641: 1719 | I641: =MAX(B641,CEILING(F641,1)) -> 83 | J641: 83 | K641: 533 | L641: 2299 | M641: 1 | N641: =IF(B641=C641,1,0) -> 0 | O641: =IF(I641=C641,1,0)-N641 -> 0 | P641: =IF(J641<C641,1,0) -> 1 | Q641: =M641-N641-O641 -> 1
A642: BPPC_7_2_3.txt | B642: 83 | C642: 84 | D642: 131 | E642: 1399 | F642: 83 | G642: 24 | H642: 1614 | I642: =MAX(B642,CEILING(F642,1)) -> 83 | J642: 83 | K642: 255 | L642: 2385 | M642: 1 | N642: =IF(B642=C642,1,0) -> 0 | O642: =IF(I642=C642,1,0)-N642 -> 0 | P642: =IF(J642<C642,1,0) -> 1 | Q642: =M642-N642-O642 -> 1
A643: BPPC_7_2_4.txt | B643: 83 | C643: 84 | D643: 126 | E643: 1602 | F643: 83 | G643: 25 | H643: 1776 | I643: =MAX(B643,CEILING(F643,1)) -> 83 | J643: 83 | K643: 201 | L643: 2178 | M643: 1 | N643: =IF(B643=C643,1,0) -> 0 | O643: =IF(I643=C643,1,0)-N643 -> 0 | P643: =IF(J643<C643,1,0) -> 1 | Q643: =M643-N643-O643 -> 1
A644: BPPC_7_2_5.txt | B644: 83 | C644: 84 | D644: 125 | E644: 1503 | F644: 83 | G644: 10 | H644: 1657 | I644: =MAX(B644,CEILING(F644,1)) -> 83 | J644: 83 | K644: 299 | L644: 2412 | M644: 1 | N644: =IF(B644=C644,1,0) -> 0 | O644: =IF(I644=C644,1,0)-N644 -> 0 | P644: =IF(J644<C644,1,0) -> 1 | Q644: =M644-N644-O644 -> 1
A645: BPPC_7_2_6.txt | B645: 83 | C645: 84 | D645: 126 | E645: 1435 | F645: 83 | G645: 39 | H645: 1630 | I645: =MAX(B645,CEILING(F645,1)) -> 83 | J645: 83 | K645: 418 | L645: 2341 | M645: 1 | N645: =IF(B645=C645,1,0) -> 0 | O645: =IF(I645=C645,1,0)-N645 -> 0 | P645: =IF(J645<C645,1,0) -> 1 | Q645: =M645-N645-O645 -> 1
A646: BPPC_7_2_7.txt | B646: 83 | C646: 84 | D646: 128 | E646: 1356 | F646: 83 | G646: 18 | H646: 1558 | I646: =MAX(B646,CEILING(F646,1)) -> 83 | J646: 84 | K646: 36001 | L646: 292490 | M646: 0 | N646: =IF(B646=C646,1,0) -> 0 | O646: =IF(I646=C646,1,0)-N646 -> 0 | P646: =IF(J646<C646,1,0) -> 0 | Q646: =M646-N646-O646 -> 0
A647: BPPC_7_2_8.txt | B647: 83 | C647: 84 | D647: 127 | E647: 1525 | F647: 83 | G647: 13 | H647: 1683 | I647: =MAX(B647,CEILING(F647,1)) -> 83 | J647: 83 | K647: 118 | L647: 2392 | M647: 1 | N647: =IF(B647=C647,1,0) -> 0 | O647: =IF(I647=C647,1,0)-N647 -> 0 | P647: =IF(J647<C647,1,0) -> 1 | Q647: =M647-N647-O647 -> 1
A648: BPPC_7_2_9.txt | B648: 83 | C648: 84 | D648: 128 | E648: 1519 | F648: 83 | G648: 26 | H648: 1708 | I648: =MAX(B648,CEILING(F648,1)) -> 83 | J648: 83 | K648: 220 | L648: 2367 | M648: 1 | N648: =IF(B648=C648,1,0) -> 0 | O648: =IF(I648=C648,1,0)-N648 -> 0 | P648: =IF(J648<C648,1,0) -> 1 | Q648: =M648-N648-O648 -> 1
A649: BPPC_7_2_10.txt | B649: 83 | C649: 84 | D649: 127 | E649: 1691 | F649: 83 | G649: 28 | H649: 1882 | I649: =MAX(B649,CEILING(F649,1)) -> 83 | J649: 83 | K649: 277 | L649: 2648 | M649: 1 | N649: =IF(B649=C649,1,0) -> 0 | O649: =IF(I649=C649,1,0)-N649 -> 0 | P649: =IF(J649<C649,1,0) -> 1 | Q649: =M649-N649-O649 -> 1
A650: BPPC_7_3_1.txt | B650: 84 | C650: 86 | D650: 123 | E650: 2226 | F650: 84 | G650: 0 | H650: 2230 | I650: =MAX(B650,CEILING(F650,1)) -> 84 | J650: 84 | K650: 10 | L650: 2509 | M650: 1 | N650: =IF(B650=C650,1,0) -> 0 | O650: =IF(I650=C650,1,0)-N650 -> 0 | P650: =IF(J650<C650,1,0) -> 1 | Q650: =M650-N650-O650 -> 1
A651: BPPC_7_3_2.txt | B651: 83 | C651: 84 | D651: 126 | E651: 1971 | F651: 83 | G651: 105 | H651: 2212 | I651: =MAX(B651,CEILING(F651,1)) -> 83 | J651: 84 | K651: 36012 | L651: 3590 | M651: 0 | N651: =IF(B651=C651,1,0) -> 0 | O651: =IF(I651=C651,1,0)-N651 -> 0 | P651: =IF(J651<C651,1,0) -> 0 | Q651: =M651-N651-O651 -> 0
A652: BPPC_7_3_3.txt | B652: 83 | C652: 84 | D652: 125 | E652: 1957 | F652: 83 | G652: 105 | H652: 2212 | I652: =MAX(B652,CEILING(F652,1)) -> 83 | J652: 83 | K652: 529 | L652: 2784 | M652: 1 | N652: =IF(B652=C652,1,0) -> 0 | O652: =IF(I652=C652,1,0)-N652 -> 0 | P652: =IF(J652<C652,1,0) -> 1 | Q652: =M652-N652-O652 -> 1
A653: BPPC_7_3_4.txt | B653: 83 | C653: 84 | D653: 124 | E653: 2092 | F653: 83 | G653: 107 | H653: 2420 | I653: =MAX(B653,CEILING(F653,1)) -> 83 | J653: 84 | K653: 36001 | L653: 125212 | M653: 0 | N653: =IF(B653=C653,1,0) -> 0 | O653: =IF(I653=C653,1,0)-N653 -> 0 | P653: =IF(J653<C653,1,0) -> 0 | Q653: =M653-N653-O653 -> 0
A654: BPPC_7_3_5.txt | B654: 83 | C654: 84 | D654: 124 | E654: 1908 | F654: 83 | G654: 86 | H654: 2162 | I654: =MAX(B654,CEILING(F654,1)) -> 83 | J654: 83 | K654: 1207 | L654: 2817 | M654: 1 | N654: =IF(B654=C654,1,0) -> 0 | O654: =IF(I654=C654,1,0)-N654 -> 0 | P654: =IF(J654<C654,1,0) -> 1 | Q654: =M654-N654-O654 -> 1
A655: BPPC_7_3_6.txt | B655: 83 | C655: 84 | D655: 124 | E655: 1928 | F655: 83 | G655: 39 | H655: 2137 | I655: =MAX(B655,CEILING(F655,1)) -> 83 | J655: 83 | K655: 486 | L655: 3002 | M655: 1 | N655: =IF(B655=C655,1,0) -> 0 | O655: =IF(I655=C655,1,0)-N655 -> 0 | P655: =IF(J655<C655,1,0) -> 1 | Q655: =M655-N655-O655 -> 1
A656: BPPC_7_3_7.txt | B656: 83 | C656: 84 | D656: 124 | E656: 1707 | F656: 83 | G656: 110 | H656: 1948 | I656: =MAX(B656,CEILING(F656,1)) -> 83 | J656: 83 | K656: 424 | L656: 2537 | M656: 1 | N656: =IF(B656=C656,1,0) -> 0 | O656: =IF(I656=C656,1,0)-N656 -> 0 | P656: =IF(J656<C656,1,0) -> 1 | Q656: =M656-N656-O656 -> 1
A657: BPPC_7_3_8.txt | B657: 83 | C657: 84 | D657: 126 | E657: 1852 | F657: 83 | G657: 115 | H657: 2045 | I657: =MAX(B657,CEILING(F657,1)) -> 83 | J657: 83 | K657: 423 | L657: 2658 | M657: 1 | N657: =IF(B657=C657,1,0) -> 0 | O657: =IF(I657=C657,1,0)-N657 -> 0 | P657: =IF(J657<C657,1,0) -> 1 | Q657: =M657-N657-O657 -> 1
A658: BPPC_7_3_9.txt | B658: 83 | C658: 84 | D658: 126 | E658: 1989 | F658: 83 | G658: 87 | H658: 2221 | I658: =MAX(B658,CEILING(F658,1)) -> 83 | J658: 83 | K658: 719 | L658: 2871 | M658: 1 | N658: =IF(B658=C658,1,0) -> 0 | O658: =IF(I658=C658,1,0)-N658 -> 0 | P658: =IF(J658<C658,1,0) -> 1 | Q658: =M658-N658-O658 -> 1
A659: BPPC_7_3_10.txt | B659: 84 | C659: 84 | D659: 49 | E659: 2098 | I659: =MAX(B659,CEILING(F659,1)) -> 84 | J659: 84 | K659: 0 | L659: 2098 | M659: 1 | N659: =IF(B659=C659,1,0) -> 1 | O659: =IF(I659=C659,1,0)-N659 -> 0 | P659: =IF(J659<C659,1,0) -> 0 | Q659: =M659-N659-O659 -> 0
A660: BPPC_7_4_1.txt | B660: 112 | C660: 112 | D660: 1 | E660: 1963 | I660: =MAX(B660,CEILING(F660,1)) -> 112 | J660: 112 | K660: 0 | L660: 1963 | M660: 1 | N660: =IF(B660=C660,1,0) -> 1 | O660: =IF(I660=C660,1,0)-N660 -> 0 | P660: =IF(J660<C660,1,0) -> 0 | Q660: =M660-N660-O660 -> 0
A661: BPPC_7_4_2.txt | B661: 99 | C661: 99 | D661: 0 | E661: 1994 | I661: =MAX(B661,CEILING(F661,1)) -> 99 | J661: 99 | K661: 0 | L661: 1994 | M661: 1 | N661: =IF(B661=C661,1,0) -> 1 | O661: =IF(I661=C661,1,0)-N661 -> 0 | P661: =IF(J661<C661,1,0) -> 0 | Q661: =M661-N661-O661 -> 0
A662: BPPC_7_4_3.txt | B662: 101 | C662: 101 | D662: 0 | E662: 2033 | I662: =MAX(B662,CEILING(F662,1)) -> 101 | J662: 101 | K662: 0 | L662: 2033 | M662: 1 | N662: =IF(B662=C662,1,0) -> 1 | O662: =IF(I662=C662,1,0)-N662 -> 0 | P662: =IF(J662<C662,1,0) -> 0 | Q662: =M662-N662-O662 -> 0
A663: BPPC_7_4_4.txt | B663: 98 | C663: 99 | D663: 121 | E663: 1973 | F663: 99 | G663: 0 | H663: 1973 | I663: =MAX(B663,CEILING(F663,1)) -> 99 | J663: 99 | K663: 0 | L663: 1973 | M663: 1 | N663: =IF(B663=C663,1,0) -> 0 | O663: =IF(I663=C663,1,0)-N663 -> 1 | P663: =IF(J663<C663,1,0) -> 0 | Q663: =M663-N663-O663 -> 0
A664: BPPC_7_4_5.txt | B664: 94 | C664: 95 | D664: 121 | E664: 1954 | F664: 94 | G664: 0 | H664: 1954 | I664: =MAX(B664,CEILING(F664,1)) -> 94 | J664: 94 | K664: 5 | L664: 1992 | M664: 1 | N664: =IF(B664=C664,1,0) -> 0 | O664: =IF(I664=C664,1,0)-N664 -> 0 | P664: =IF(J664<C664,1,0) -> 1 | Q664: =M664-N664-O664 -> 1
A665: BPPC_7_4_6.txt | B665: 98 | C665: 98 | D665: 0 | E665: 1960 | I665: =MAX(B665,CEILING(F665,1)) -> 98 | J665: 98 | K665: 0 | L665: 1960 | M665: 1 | N665: =IF(B665=C665,1,0) -> 1 | O665: =IF(I665=C665,1,0)-N665 -> 0 | P665: =IF(J665<C665,1,0) -> 0 | Q665: =M665-N665-O665 -> 0
A666: BPPC_7_4_7.txt | B666: 87 | C666: 88 | D666: 122 | E666: 1909 | F666: 87 | G666: 0 | H666: 1909 | I666: =MAX(B666,CEILING(F666,1)) -> 87 | J666: 87 | K666: 10 | L666: 2117 | M666: 1 | N666: =IF(B666=C666,1,0) -> 0 | O666: =IF(I666=C666,1,0)-N666 -> 0 | P666: =IF(J666<C666,1,0) -> 1 | Q666: =M666-N666-O666 -> 1
A667: BPPC_7_4_8.txt | B667: 89 | C667: 90 | D667: 121 | E667: 1914 | F667: 89 | G667: 0 | H667: 1915 | I667: =MAX(B667,CEILING(F667,1)) -> 89 | J667: 89 | K667: 6 | L667: 1983 | M667: 1 | N667: =IF(B667=C667,1,0) -> 0 | O667: =IF(I667=C667,1,0)-N667 -> 0 | P667: =IF(J667<C667,1,0) -> 1 | Q667: =M667-N667-O667 -> 1
A668: BPPC_7_4_9.txt | B668: 99 | C668: 99 | D668: 0 | E668: 1922 | I668: =MAX(B668,CEILING(F668,1)) -> 99 | J668: 99 | K668: 0 | L668: 1922 | M668: 1 | N668: =IF(B668=C668,1,0) -> 1 | O668: =IF(I668=C668,1,0)-N668 -> 0 | P668: =IF(J668<C668,1,0) -> 0 | Q668: =M668-N668-O668 -> 0
A669: BPPC_7_4_10.txt | B669: 106 | C669: 106 | D669: 0 | E669: 1934 | I669: =MAX(B669,CEILING(F669,1)) -> 106 | J669: 106 | K669: 0 | L669: 1934 | M669: 1 | N669: =IF(B669=C669,1,0) -> 1 | O669: =IF(I669=C669,1,0)-N669 -> 0 | P669: =IF(J669<C669,1,0) -> 0 | Q669: =M669-N669-O669 -> 0
A670: BPPC_7_5_1.txt | B670: 138 | C670: 138 | D670: 1 | E670: 1483 | I670: =MAX(B670,CEILING(F670,1)) -> 138 | J670: 138 | K670: 0 | L670: 1483 | M670: 1 | N670: =IF(B670=C670,1,0) -> 1 | O670: =IF(I670=C670,1,0)-N670 -> 0 | P670: =IF(J670<C670,1,0) -> 0 | Q670: =M670-N670-O670 -> 0
A671: BPPC_7_5_2.txt | B671: 128 | C671: 128 | D671: 0 | E671: 1687 | I671: =MAX(B671,CEILING(F671,1)) -> 128 | J671: 128 | K671: 0 | L671: 1687 | M671: 1 | N671: =IF(B671=C671,1,0) -> 1 | O671: =IF(I671=C671,1,0)-N671 -> 0 | P671: =IF(J671<C671,1,0) -> 0 | Q671: =M671-N671-O671 -> 0
A672: BPPC_7_5_3.txt | B672: 128 | C672: 128 | D672: 0 | E672: 1565 | I672: =MAX(B672,CEILING(F672,1)) -> 128 | J672: 128 | K672: 0 | L672: 1565 | M672: 1 | N672: =IF(B672=C672,1,0) -> 1 | O672: =IF(I672=C672,1,0)-N672 -> 0 | P672: =IF(J672<C672,1,0) -> 0 | Q672: =M672-N672-O672 -> 0
A673: BPPC_7_5_4.txt | B673: 121 | C673: 121 | D673: 1 | E673: 1567 | I673: =MAX(B673,CEILING(F673,1)) -> 121 | J673: 121 | K673: 0 | L673: 1567 | M673: 1 | N673: =IF(B673=C673,1,0) -> 1 | O673: =IF(I673=C673,1,0)-N673 -> 0 | P673: =IF(J673<C673,1,0) -> 0 | Q673: =M673-N673-O673 -> 0
A674: BPPC_7_5_5.txt | B674: 121 | C674: 121 | D674: 0 | E674: 1541 | I674: =MAX(B674,CEILING(F674,1)) -> 121 | J674: 121 | K674: 0 | L674: 1541 | M674: 1 | N674: =IF(B674=C674,1,0) -> 1 | O674: =IF(I674=C674,1,0)-N674 -> 0 | P674: =IF(J674<C674,1,0) -> 0 | Q674: =M674-N674-O674 -> 0
A675: BPPC_7_5_6.txt | B675: 126 | C675: 126 | D675: 0 | E675: 1574 | I675: =MAX(B675,CEILING(F675,1)) -> 126 | J675: 126 | K675: 0 | L675: 1574 | M675: 1 | N675: =IF(B675=C675,1,0) -> 1 | O675: =IF(I675=C675,1,0)-N675 -> 0 | P675: =IF(J675<C675,1,0) -> 0 | Q675: =M675-N675-O675 -> 0
A676: BPPC_7_5_7.txt | B676: 116 | C676: 116 | D676: 1 | E676: 1551 | I676: =MAX(B676,CEILING(F676,1)) -> 116 | J676: 116 | K676: 0 | L676: 1551 | M676: 1 | N676: =IF(B676=C676,1,0) -> 1 | O676: =IF(I676=C676,1,0)-N676 -> 0 | P676: =IF(J676<C676,1,0) -> 0 | Q676: =M676-N676-O676 -> 0
A677: BPPC_7_5_8.txt | B677: 114 | C677: 114 | D677: 0 | E677: 1619 | I677: =MAX(B677,CEILING(F677,1)) -> 114 | J677: 114 | K677: 0 | L677: 1619 | M677: 1 | N677: =IF(B677=C677,1,0) -> 1 | O677: =IF(I677=C677,1,0)-N677 -> 0 | P677: =IF(J677<C677,1,0) -> 0 | Q677: =M677-N677-O677 -> 0
A678: BPPC_7_5_9.txt | B678: 121 | C678: 122 | D678: 121 | E678: 1551 | F678: 121.5 | G678: 0 | H678: 1552 | I678: =MAX(B678,CEILING(F678,1)) -> 122 | J678: 122 | K678: 0 | L678: 1552 | M678: 1 | N678: =IF(B678=C678,1,0) -> 0 | O678: =IF(I678=C678,1,0)-N678 -> 1 | P678: =IF(J678<C678,1,0) -> 0 | Q678: =M678-N678-O678 -> 0
A679: BPPC_7_5_10.txt | B679: 134 | C679: 134 | D679: 0 | E679: 1499 | I679: =MAX(B679,CEILING(F679,1)) -> 134 | J679: 134 | K679: 0 | L679: 1499 | M679: 1 | N679: =IF(B679=C679,1,0) -> 1 | O679: =IF(I679=C679,1,0)-N679 -> 0 | P679: =IF(J679<C679,1,0) -> 0 | Q679: =M679-N679-O679 -> 0
A680: BPPC_7_6_1.txt | B680: 158 | C680: 158 | D680: 1 | E680: 1193 | I680: =MAX(B680,CEILING(F680,1)) -> 158 | J680: 158 | K680: 0 | L680: 1193 | M680: 1 | N680: =IF(B680=C680,1,0) -> 1 | O680: =IF(I680=C680,1,0)-N680 -> 0 | P680: =IF(J680<C680,1,0) -> 0 | Q680: =M680-N680-O680 -> 0
A681: BPPC_7_6_2.txt | B681: 149 | C681: 149 | D681: 0 | E681: 1381 | I681: =MAX(B681,CEILING(F681,1)) -> 149 | J681: 149 | K681: 0 | L681: 1381 | M681: 1 | N681: =IF(B681=C681,1,0) -> 1 | O681: =IF(I681=C681,1,0)-N681 -> 0 | P681: =IF(J681<C681,1,0) -> 0 | Q681: =M681-N681-O681 -> 0
A682: BPPC_7_6_3.txt | B682: 152 | C682: 152 | D682: 1 | E682: 1267 | I682: =MAX(B682,CEILING(F682,1)) -> 152 | J682: 152 | K682: 0 | L682: 1267 | M682: 1 | N682: =IF(B682=C682,1,0) -> 1 | O682: =IF(I682=C682,1,0)-N682 -> 0 | P682: =IF(J682<C682,1,0) -> 0 | Q682: =M682-N682-O682 -> 0
A683: BPPC_7_6_4.txt | B683: 145 | C683: 146 | D683: 122 | E683: 1370 | F683: 145.33332999999999 | G683: 0 | H683: 1371 | I683: =MAX(B683,CEILING(F683,1)) -> 146 | J683: 146 | K683: 0 | L683: 1371 | M683: 1 | N683: =IF(B683=C683,1,0) -> 0 | O683: =IF(I683=C683,1,0)-N683 -> 1 | P683: =IF(J683<C683,1,0) -> 0 | Q683: =M683-N683-O683 -> 0
A684: BPPC_7_6_5.txt | B684: 149 | C684: 150 | D684: 121 | E684: 1281 | F684: 149.25 | G684: 0 | H684: 1286 | I684: =MAX(B684,CEILING(F684,1)) -> 150 | J684: 150 | K684: 0 | L684: 1286 | M684: 1 | N684: =IF(B684=C684,1,0) -> 0 | O684: =IF(I684=C684,1,0)-N684 -> 1 | P684: =IF(J684<C684,1,0) -> 0 | Q684: =M684-N684-O684 -> 0
A685: BPPC_7_6_6.txt | B685: 148 | C685: 149 | D685: 122 | E685: 1251 | F685: 148.25 | G685: 0 | H685: 1255 | I685: =MAX(B685,CEILING(F685,1)) -> 149 | J685: 149 | K685: 0 | L685: 1255 | M685: 1 | N685: =IF(B685=C685,1,0) -> 0 | O685: =IF(I685=C685,1,0)-N685 -> 1 | P685: =IF(J685<C685,1,0) -> 0 | Q685: =M685-N685-O685 -> 0
A686: BPPC_7_6_7.txt | B686: 152 | C686: 152 | D686: 1 | E686: 1313 | I686: =MAX(B686,CEILING(F686,1)) -> 152 | J686: 152 | K686: 0 | L686: 1313 | M686: 1 | N686: =IF(B686=C686,1,0) -> 1 | O686: =IF(I686=C686,1,0)-N686 -> 0 | P686: =IF(J686<C686,1,0) -> 0 | Q686: =M686-N686-O686 -> 0
A687: BPPC_7_6_8.txt | B687: 137 | C687: 138 | D687: 121 | E687: 1412 | F687: 137.16667000000001 | G687: 3 | H687: 1438 | I687: =MAX(B687,CEILING(F687,1)) -> 138 | J687: 138 | K687: 3 | L687: 1438 | M687: 1 | N687: =IF(B687=C687,1,0) -> 0 | O687: =IF(I687=C687,1,0)-N687 -> 1 | P687: =IF(J687<C687,1,0) -> 0 | Q687: =M687-N687-O687 -> 0
A688: BPPC_7_6_9.txt | B688: 155 | C688: 155 | D688: 1 | E688: 1367 | I688: =MAX(B688,CEILING(F688,1)) -> 155 | J688: 155 | K688: 0 | L688: 1367 | M688: 1 | N688: =IF(B688=C688,1,0) -> 1 | O688: =IF(I688=C688,1,0)-N688 -> 0 | P688: =IF(J688<C688,1,0) -> 0 | Q688: =M688-N688-O688 -> 0
A689: BPPC_7_6_10.txt | B689: 152 | C689: 152 | D689: 0 | E689: 1254 | I689: =MAX(B689,CEILING(F689,1)) -> 152 | J689: 152 | K689: 0 | L689: 1254 | M689: 1 | N689: =IF(B689=C689,1,0) -> 1 | O689: =IF(I689=C689,1,0)-N689 -> 0 | P689: =IF(J689<C689,1,0) -> 0 | Q689: =M689-N689-O689 -> 0
A690: BPPC_7_7_1.txt | B690: 178 | C690: 178 | D690: 1 | E690: 962 | I690: =MAX(B690,CEILING(F690,1)) -> 178 | J690: 178 | K690: 0 | L690: 962 | M690: 1 | N690: =IF(B690=C690,1,0) -> 1 | O690: =IF(I690=C690,1,0)-N690 -> 0 | P690: =IF(J690<C690,1,0) -> 0 | Q690: =M690-N690-O690 -> 0
A691: BPPC_7_7_2.txt | B691: 168 | C691: 168 | D691: 0 | E691: 1062 | I691: =MAX(B691,CEILING(F691,1)) -> 168 | J691: 168 | K691: 0 | L691: 1062 | M691: 1 | N691: =IF(B691=C691,1,0) -> 1 | O691: =IF(I691=C691,1,0)-N691 -> 0 | P691: =IF(J691<C691,1,0) -> 0 | Q691: =M691-N691-O691 -> 0
A692: BPPC_7_7_3.txt | B692: 187 | C692: 187 | D692: 1 | E692: 956 | I692: =MAX(B692,CEILING(F692,1)) -> 187 | J692: 187 | K692: 0 | L692: 956 | M692: 1 | N692: =IF(B692=C692,1,0) -> 1 | O692: =IF(I692=C692,1,0)-N692 -> 0 | P692: =IF(J692<C692,1,0) -> 0 | Q692: =M692-N692-O692 -> 0
A693: BPPC_7_7_4.txt | B693: 169 | C693: 169 | D693: 0 | E693: 1058 | I693: =MAX(B693,CEILING(F693,1)) -> 169 | J693: 169 | K693: 0 | L693: 1058 | M693: 1 | N693: =IF(B693=C693,1,0) -> 1 | O693: =IF(I693=C693,1,0)-N693 -> 0 | P693: =IF(J693<C693,1,0) -> 0 | Q693: =M693-N693-O693 -> 0
A694: BPPC_7_7_5.txt | B694: 173 | C694: 173 | D694: 1 | E694: 995 | I694: =MAX(B694,CEILING(F694,1)) -> 173 | J694: 173 | K694: 0 | L694: 995 | M694: 1 | N694: =IF(B694=C694,1,0) -> 1 | O694: =IF(I694=C694,1,0)-N694 -> 0 | P694: =IF(J694<C694,1,0) -> 0 | Q694: =M694-N694-O694 -> 0
A695: BPPC_7_7_6.txt | B695: 173 | C695: 173 | D695: 0 | E695: 974 | I695: =MAX(B695,CEILING(F695,1)) -> 173 | J695: 173 | K695: 0 | L695: 974 | M695: 1 | N695: =IF(B695=C695,1,0) -> 1 | O695: =IF(I695=C695,1,0)-N695 -> 0 | P695: =IF(J695<C695,1,0) -> 0 | Q695: =M695-N695-O695 -> 0
A696: BPPC_7_7_7.txt | B696: 172 | C696: 173 | D696: 122 | E696: 1005 | F696: 172.37333000000001 | G696: 3 | H696: 1026 | I696: =MAX(B696,CEILING(F696,1)) -> 173 | J696: 173 | K696: 3 | L696: 1026 | M696: 1 | N696: =IF(B696=C696,1,0) -> 0 | O696: =IF(I696=C696,1,0)-N696 -> 1 | P696: =IF(J696<C696,1,0) -> 0 | Q696: =M696-N696-O696 -> 0
A697: BPPC_7_7_8.txt | B697: 178 | C697: 178 | D697: 1 | E697: 1045 | I697: =MAX(B697,CEILING(F697,1)) -> 178 | J697: 178 | K697: 0 | L697: 1045 | M697: 1 | N697: =IF(B697=C697,1,0) -> 1 | O697: =IF(I697=C697,1,0)-N697 -> 0 | P697: =IF(J697<C697,1,0) -> 0 | Q697: =M697-N697-O697 -> 0
A698: BPPC_7_7_9.txt | B698: 173 | C698: 173 | D698: 0 | E698: 964 | I698: =MAX(B698,CEILING(F698,1)) -> 173 | J698: 173 | K698: 0 | L698: 964 | M698: 1 | N698: =IF(B698=C698,1,0) -> 1 | O698: =IF(I698=C698,1,0)-N698 -> 0 | P698: =IF(J698<C698,1,0) -> 0 | Q698: =M698-N698-O698 -> 0
A699: BPPC_7_7_10.txt | B699: 174 | C699: 175 | D699: 122 | E699: 959 | F699: 174.33332999999999 | G699: 0 | H699: 962 | I699: =MAX(B699,CEILING(F699,1)) -> 175 | J699: 175 | K699: 0 | L699: 962 | M699: 1 | N699: =IF(B699=C699,1,0) -> 0 | O699: =IF(I699=C699,1,0)-N699 -> 1 | P699: =IF(J699<C699,1,0) -> 0 | Q699: =M699-N699-O699 -> 0
A700: BPPC_7_8_1.txt | B700: 198 | C700: 198 | D700: 1 | E700: 686 | I700: =MAX(B700,CEILING(F700,1)) -> 198 | J700: 198 | K700: 0 | L700: 686 | M700: 1 | N700: =IF(B700=C700,1,0) -> 1 | O700: =IF(I700=C700,1,0)-N700 -> 0 | P700: =IF(J700<C700,1,0) -> 0 | Q700: =M700-N700-O700 -> 0
A701: BPPC_7_8_2.txt | B701: 193 | C701: 193 | D701: 0 | E701: 823 | I701: =MAX(B701,CEILING(F701,1)) -> 193 | J701: 193 | K701: 0 | L701: 823 | M701: 1 | N701: =IF(B701=C701,1,0) -> 1 | O701: =IF(I701=C701,1,0)-N701 -> 0 | P701: =IF(J701<C701,1,0) -> 0 | Q701: =M701-N701-O701 -> 0
A702: BPPC_7_8_3.txt | B702: 212 | C702: 212 | D702: 1 | E702: 597 | I702: =MAX(B702,CEILING(F702,1)) -> 212 | J702: 212 | K702: 0 | L702: 597 | M702: 1 | N702: =IF(B702=C702,1,0) -> 1 | O702: =IF(I702=C702,1,0)-N702 -> 0 | P702: =IF(J702<C702,1,0) -> 0 | Q702: =M702-N702-O702 -> 0
A703: BPPC_7_8_4.txt | B703: 195 | C703: 195 | D703: 0 | E703: 712 | I703: =MAX(B703,CEILING(F703,1)) -> 195 | J703: 195 | K703: 0 | L703: 712 | M703: 1 | N703: =IF(B703=C703,1,0) -> 1 | O703: =IF(I703=C703,1,0)-N703 -> 0 | P703: =IF(J703<C703,1,0) -> 0 | Q703: =M703-N703-O703 -> 0
A704: BPPC_7_8_5.txt | B704: 202 | C704: 202 | D704: 0 | E704: 756 | I704: =MAX(B704,CEILING(F704,1)) -> 202 | J704: 202 | K704: 0 | L704: 756 | M704: 1 | N704: =IF(B704=C704,1,0) -> 1 | O704: =IF(I704=C704,1,0)-N704 -> 0 | P704: =IF(J704<C704,1,0) -> 0 | Q704: =M704-N704-O704 -> 0
A705: BPPC_7_8_6.txt | B705: 200 | C705: 200 | D705: 0 | E705: 700 | I705: =MAX(B705,CEILING(F705,1)) -> 200 | J705: 200 | K705: 0 | L705: 700 | M705: 1 | N705: =IF(B705=C705,1,0) -> 1 | O705: =IF(I705=C705,1,0)-N705 -> 0 | P705: =IF(J705<C705,1,0) -> 0 | Q705: =M705-N705-O705 -> 0
A706: BPPC_7_8_7.txt | B706: 203 | C706: 203 | D706: 1 | E706: 731 | I706: =MAX(B706,CEILING(F706,1)) -> 203 | J706: 203 | K706: 0 | L706: 731 | M706: 1 | N706: =IF(B706=C706,1,0) -> 1 | O706: =IF(I706=C706,1,0)-N706 -> 0 | P706: =IF(J706<C706,1,0) -> 0 | Q706: =M706-N706-O706 -> 0
A707: BPPC_7_8_8.txt | B707: 197 | C707: 197 | D707: 0 | E707: 683 | I707: =MAX(B707,CEILING(F707,1)) -> 197 | J707: 197 | K707: 1 | L707: 683 | M707: 1 | N707: =IF(B707=C707,1,0) -> 1 | O707: =IF(I707=C707,1,0)-N707 -> 0 | P707: =IF(J707<C707,1,0) -> 0 | Q707: =M707-N707-O707 -> 0
A708: BPPC_7_8_9.txt | B708: 200 | C708: 200 | D708: 0 | E708: 688 | I708: =MAX(B708,CEILING(F708,1)) -> 200 | J708: 200 | K708: 0 | L708: 688 | M708: 1 | N708: =IF(B708=C708,1,0) -> 1 | O708: =IF(I708=C708,1,0)-N708 -> 0 | P708: =IF(J708<C708,1,0) -> 0 | Q708: =M708-N708-O708 -> 0
A709: BPPC_7_8_10.txt | B709: 202 | C709: 202 | D709: 1 | E709: 699 | I709: =MAX(B709,CEILING(F709,1)) -> 202 | J709: 202 | K709: 0 | L709: 699 | M709: 1 | N709: =IF(B709=C709,1,0) -> 1 | O709: =IF(I709=C709,1,0)-N709 -> 0 | P709: =IF(J709<C709,1,0) -> 0 | Q709: =M709-N709-O709 -> 0
A710: BPPC_7_9_1.txt | B710: 221 | C710: 221 | D710: 0 | E710: 445 | I710: =MAX(B710,CEILING(F710,1)) -> 221 | J710: 221 | K710: 0 | L710: 445 | M710: 1 | N710: =IF(B710=C710,1,0) -> 1 | O710: =IF(I710=C710,1,0)-N710 -> 0 | P710: =IF(J710<C710,1,0) -> 0 | Q710: =M710-N710-O710 -> 0
A711: BPPC_7_9_2.txt | B711: 224 | C711: 224 | D711: 1 | E711: 420 | I711: =MAX(B711,CEILING(F711,1)) -> 224 | J711: 224 | K711: 0 | L711: 420 | M711: 1 | N711: =IF(B711=C711,1,0) -> 1 | O711: =IF(I711=C711,1,0)-N711 -> 0 | P711: =IF(J711<C711,1,0) -> 0 | Q711: =M711-N711-O711 -> 0
A712: BPPC_7_9_3.txt | B712: 231 | C712: 231 | D712: 0 | E712: 352 | I712: =MAX(B712,CEILING(F712,1)) -> 231 | J712: 231 | K712: 0 | L712: 352 | M712: 1 | N712: =IF(B712=C712,1,0) -> 1 | O712: =IF(I712=C712,1,0)-N712 -> 0 | P712: =IF(J712<C712,1,0) -> 0 | Q712: =M712-N712-O712 -> 0
A713: BPPC_7_9_4.txt | B713: 227 | C713: 227 | D713: 1 | E713: 421 | I713: =MAX(B713,CEILING(F713,1)) -> 227 | J713: 227 | K713: 0 | L713: 421 | M713: 1 | N713: =IF(B713=C713,1,0) -> 1 | O713: =IF(I713=C713,1,0)-N713 -> 0 | P713: =IF(J713<C713,1,0) -> 0 | Q713: =M713-N713-O713 -> 0
A714: BPPC_7_9_5.txt | B714: 219 | C714: 219 | D714: 0 | E714: 458 | I714: =MAX(B714,CEILING(F714,1)) -> 219 | J714: 219 | K714: 0 | L714: 458 | M714: 1 | N714: =IF(B714=C714,1,0) -> 1 | O714: =IF(I714=C714,1,0)-N714 -> 0 | P714: =IF(J714<C714,1,0) -> 0 | Q714: =M714-N714-O714 -> 0
A715: BPPC_7_9_6.txt | B715: 228 | C715: 228 | D715: 1 | E715: 408 | I715: =MAX(B715,CEILING(F715,1)) -> 228 | J715: 228 | K715: 0 | L715: 408 | M715: 1 | N715: =IF(B715=C715,1,0) -> 1 | O715: =IF(I715=C715,1,0)-N715 -> 0 | P715: =IF(J715<C715,1,0) -> 0 | Q715: =M715-N715-O715 -> 0
A716: BPPC_7_9_7.txt | B716: 223 | C716: 224 | D716: 121 | E716: 430 | F716: 223.25 | G716: 1 | H716: 438 | I716: =MAX(B716,CEILING(F716,1)) -> 224 | J716: 224 | K716: 1 | L716: 438 | M716: 1 | N716: =IF(B716=C716,1,0) -> 0 | O716: =IF(I716=C716,1,0)-N716 -> 1 | P716: =IF(J716<C716,1,0) -> 0 | Q716: =M716-N716-O716 -> 0
A717: BPPC_7_9_8.txt | B717: 223 | C717: 223 | D717: 1 | E717: 473 | I717: =MAX(B717,CEILING(F717,1)) -> 223 | J717: 223 | K717: 0 | L717: 473 | M717: 1 | N717: =IF(B717=C717,1,0) -> 1 | O717: =IF(I717=C717,1,0)-N717 -> 0 | P717: =IF(J717<C717,1,0) -> 0 | Q717: =M717-N717-O717 -> 0
A718: BPPC_7_9_9.txt | B718: 228 | C718: 228 | D718: 0 | E718: 439 | I718: =MAX(B718,CEILING(F718,1)) -> 228 | J718: 228 | K718: 0 | L718: 439 | M718: 1 | N718: =IF(B718=C718,1,0) -> 1 | O718: =IF(I718=C718,1,0)-N718 -> 0 | P718: =IF(J718<C718,1,0) -> 0 | Q718: =M718-N718-O718 -> 0
A719: BPPC_7_9_10.txt | B719: 226 | C719: 226 | D719: 1 | E719: 406 | I719: =MAX(B719,CEILING(F719,1)) -> 226 | J719: 226 | K719: 0 | L719: 406 | M719: 1 | N719: =IF(B719=C719,1,0) -> 1 | O719: =IF(I719=C719,1,0)-N719 -> 0 | P719: =IF(J719<C719,1,0) -> 0 | Q719: =M719-N719-O719 -> 0
A720: BPPC_8_0_1.txt | B720: 167 | C720: 167 | D720: 0 | E720: 392 | I720: =MAX(B720,CEILING(F720,1)) -> 167 | J720: 167 | K720: 0 | L720: 392 | M720: 1 | N720: =IF(B720=C720,1,0) -> 1 | O720: =IF(I720=C720,1,0)-N720 -> 0 | P720: =IF(J720<C720,1,0) -> 0 | Q720: =M720-N720-O720 -> 0
A721: BPPC_8_0_2.txt | B721: 167 | C721: 167 | D721: 0 | E721: 383 | I721: =MAX(B721,CEILING(F721,1)) -> 167 | J721: 167 | K721: 0 | L721: 383 | M721: 1 | N721: =IF(B721=C721,1,0) -> 1 | O721: =IF(I721=C721,1,0)-N721 -> 0 | P721: =IF(J721<C721,1,0) -> 0 | Q721: =M721-N721-O721 -> 0
A722: BPPC_8_0_3.txt | B722: 167 | C722: 167 | D722: 0 | E722: 397 | I722: =MAX(B722,CEILING(F722,1)) -> 167 | J722: 167 | K722: 0 | L722: 397 | M722: 1 | N722: =IF(B722=C722,1,0) -> 1 | O722: =IF(I722=C722,1,0)-N722 -> 0 | P722: =IF(J722<C722,1,0) -> 0 | Q722: =M722-N722-O722 -> 0
A723: BPPC_8_0_4.txt | B723: 167 | C723: 167 | D723: 0 | E723: 398 | I723: =MAX(B723,CEILING(F723,1)) -> 167 | J723: 167 | K723: 0 | L723: 398 | M723: 1 | N723: =IF(B723=C723,1,0) -> 1 | O723: =IF(I723=C723,1,0)-N723 -> 0 | P723: =IF(J723<C723,1,0) -> 0 | Q723: =M723-N723-O723 -> 0
A724: BPPC_8_0_5.txt | B724: 167 | C724: 167 | D724: 0 | E724: 405 | I724: =MAX(B724,CEILING(F724,1)) -> 167 | J724: 167 | K724: 0 | L724: 405 | M724: 1 | N724: =IF(B724=C724,1,0) -> 1 | O724: =IF(I724=C724,1,0)-N724 -> 0 | P724: =IF(J724<C724,1,0) -> 0 | Q724: =M724-N724-O724 -> 0
A725: BPPC_8_0_6.txt | B725: 167 | C725: 167 | D725: 0 | E725: 398 | I725: =MAX(B725,CEILING(F725,1)) -> 167 | J725: 167 | K725: 0 | L725: 398 | M725: 1 | N725: =IF(B725=C725,1,0) -> 1 | O725: =IF(I725=C725,1,0)-N725 -> 0 | P725: =IF(J725<C725,1,0) -> 0 | Q725: =M725-N725-O725 -> 0
A726: BPPC_8_0_7.txt | B726: 167 | C726: 167 | D726: 0 | E726: 396 | I726: =MAX(B726,CEILING(F726,1)) -> 167 | J726: 167 | K726: 0 | L726: 396 | M726: 1 | N726: =IF(B726=C726,1,0) -> 1 | O726: =IF(I726=C726,1,0)-N726 -> 0 | P726: =IF(J726<C726,1,0) -> 0 | Q726: =M726-N726-O726 -> 0
A727: BPPC_8_0_8.txt | B727: 167 | C727: 167 | D727: 0 | E727: 406 | I727: =MAX(B727,CEILING(F727,1)) -> 167 | J727: 167 | K727: 0 | L727: 406 | M727: 1 | N727: =IF(B727=C727,1,0) -> 1 | O727: =IF(I727=C727,1,0)-N727 -> 0 | P727: =IF(J727<C727,1,0) -> 0 | Q727: =M727-N727-O727 -> 0
A728: BPPC_8_0_9.txt | B728: 167 | C728: 167 | D728: 0 | E728: 381 | I728: =MAX(B728,CEILING(F728,1)) -> 167 | J728: 167 | K728: 0 | L728: 381 | M728: 1 | N728: =IF(B728=C728,1,0) -> 1 | O728: =IF(I728=C728,1,0)-N728 -> 0 | P728: =IF(J728<C728,1,0) -> 0 | Q728: =M728-N728-O728 -> 0
A729: BPPC_8_0_10.txt | B729: 167 | C729: 167 | D729: 0 | E729: 407 | I729: =MAX(B729,CEILING(F729,1)) -> 167 | J729: 167 | K729: 0 | L729: 407 | M729: 1 | N729: =IF(B729=C729,1,0) -> 1 | O729: =IF(I729=C729,1,0)-N729 -> 0 | P729: =IF(J729<C729,1,0) -> 0 | Q729: =M729-N729-O729 -> 0
A730: BPPC_8_1_1.txt | B730: 167 | C730: 168 | D730: 168 | E730: 2592 | F730: 167 | G730: 149 | H730: 2889 | I730: =MAX(B730,CEILING(F730,1)) -> 167 | J730: 167 | K730: 1616 | L730: 4148 | M730: 1 | N730: =IF(B730=C730,1,0) -> 0 | O730: =IF(I730=C730,1,0)-N730 -> 0 | P730: =IF(J730<C730,1,0) -> 1 | Q730: =M730-N730-O730 -> 1
A731: BPPC_8_1_2.txt | B731: 167 | C731: 168 | D731: 157 | E731: 2694 | F731: 167 | G731: 106 | H731: 2938 | I731: =MAX(B731,CEILING(F731,1)) -> 167 | J731: 167 | K731: 1407 | L731: 4200 | M731: 1 | N731: =IF(B731=C731,1,0) -> 0 | O731: =IF(I731=C731,1,0)-N731 -> 0 | P731: =IF(J731<C731,1,0) -> 1 | Q731: =M731-N731-O731 -> 1
A732: BPPC_8_1_3.txt | B732: 167 | C732: 168 | D732: 168 | E732: 2589 | F732: 167 | G732: 145 | H732: 2832 | I732: =MAX(B732,CEILING(F732,1)) -> 167 | J732: 167 | K732: 2494 | L732: 4018 | M732: 1 | N732: =IF(B732=C732,1,0) -> 0 | O732: =IF(I732=C732,1,0)-N732 -> 0 | P732: =IF(J732<C732,1,0) -> 1 | Q732: =M732-N732-O732 -> 1
A733: BPPC_8_1_4.txt | B733: 167 | C733: 168 | D733: 161 | E733: 2754 | F733: 167 | G733: 121 | H733: 2985 | I733: =MAX(B733,CEILING(F733,1)) -> 167 | J733: 167 | K733: 1323 | L733: 4109 | M733: 1 | N733: =IF(B733=C733,1,0) -> 0 | O733: =IF(I733=C733,1,0)-N733 -> 0 | P733: =IF(J733<C733,1,0) -> 1 | Q733: =M733-N733-O733 -> 1
A734: BPPC_8_1_5.txt | B734: 167 | C734: 168 | D734: 173 | E734: 2485 | F734: 167 | G734: 30 | H734: 2781 | I734: =MAX(B734,CEILING(F734,1)) -> 167 | J734: 167 | K734: 3092 | L734: 3938 | M734: 1 | N734: =IF(B734=C734,1,0) -> 0 | O734: =IF(I734=C734,1,0)-N734 -> 0 | P734: =IF(J734<C734,1,0) -> 1 | Q734: =M734-N734-O734 -> 1
A735: BPPC_8_1_6.txt | B735: 167 | C735: 168 | D735: 180 | E735: 2470 | F735: 167 | G735: 121 | H735: 2780 | I735: =MAX(B735,CEILING(F735,1)) -> 167 | J735: 167 | K735: 2344 | L735: 3928 | M735: 1 | N735: =IF(B735=C735,1,0) -> 0 | O735: =IF(I735=C735,1,0)-N735 -> 0 | P735: =IF(J735<C735,1,0) -> 1 | Q735: =M735-N735-O735 -> 1
A736: BPPC_8_1_7.txt | B736: 167 | C736: 168 | D736: 177 | E736: 2708 | F736: 167 | G736: 61 | H736: 2922 | I736: =MAX(B736,CEILING(F736,1)) -> 167 | J736: 167 | K736: 3417 | L736: 4275 | M736: 1 | N736: =IF(B736=C736,1,0) -> 0 | O736: =IF(I736=C736,1,0)-N736 -> 0 | P736: =IF(J736<C736,1,0) -> 1 | Q736: =M736-N736-O736 -> 1
A737: BPPC_8_1_8.txt | B737: 167 | C737: 168 | D737: 155 | E737: 2474 | F737: 167 | G737: 34 | H737: 2743 | I737: =MAX(B737,CEILING(F737,1)) -> 167 | J737: 167 | K737: 2504 | L737: 3963 | M737: 1 | N737: =IF(B737=C737,1,0) -> 0 | O737: =IF(I737=C737,1,0)-N737 -> 0 | P737: =IF(J737<C737,1,0) -> 1 | Q737: =M737-N737-O737 -> 1
A738: BPPC_8_1_9.txt | B738: 167 | C738: 168 | D738: 165 | E738: 2460 | F738: 167 | G738: 37 | H738: 2773 | I738: =MAX(B738,CEILING(F738,1)) -> 167 | J738: 167 | K738: 1670 | L738: 3966 | M738: 1 | N738: =IF(B738=C738,1,0) -> 0 | O738: =IF(I738=C738,1,0)-N738 -> 0 | P738: =IF(J738<C738,1,0) -> 1 | Q738: =M738-N738-O738 -> 1
A739: BPPC_8_1_10.txt | B739: 167 | C739: 168 | D739: 164 | E739: 2426 | F739: 167 | G739: 183 | H739: 2714 | I739: =MAX(B739,CEILING(F739,1)) -> 167 | J739: 167 | K739: 1936 | L739: 3957 | M739: 1 | N739: =IF(B739=C739,1,0) -> 0 | O739: =IF(I739=C739,1,0)-N739 -> 0 | P739: =IF(J739<C739,1,0) -> 1 | Q739: =M739-N739-O739 -> 1
A740: BPPC_8_2_1.txt | B740: 167 | C740: 168 | D740: 166 | E740: 4027 | F740: 167 | G740: 318 | H740: 4161 | I740: =MAX(B740,CEILING(F740,1)) -> 167 | J740: 167 | K740: 5310 | L740: 5346 | M740: 1 | N740: =IF(B740=C740,1,0) -> 0 | O740: =IF(I740=C740,1,0)-N740 -> 0 | P740: =IF(J740<C740,1,0) -> 1 | Q740: =M740-N740-O740 -> 1
A741: BPPC_8_2_2.txt | B741: 167 | C741: 168 | D741: 163 | E741: 4234 | F741: 167 | G741: 228 | H741: 4342 | I741: =MAX(B741,CEILING(F741,1)) -> 167 | J741: 167 | K741: 3303 | L741: 5724 | M741: 1 | N741: =IF(B741=C741,1,0) -> 0 | O741: =IF(I741=C741,1,0)-N741 -> 0 | P741: =IF(J741<C741,1,0) -> 1 | Q741: =M741-N741-O741 -> 1
A742: BPPC_8_2_3.txt | B742: 167 | C742: 168 | D742: 181 | E742: 3778 | F742: 167 | G742: 296 | H742: 3917 | I742: =MAX(B742,CEILING(F742,1)) -> 167 | J742: 167 | K742: 5418 | L742: 5285 | M742: 1 | N742: =IF(B742=C742,1,0) -> 0 | O742: =IF(I742=C742,1,0)-N742 -> 0 | P742: =IF(J742<C742,1,0) -> 1 | Q742: =M742-N742-O742 -> 1
A743: BPPC_8_2_4.txt | B743: 167 | C743: 168 | D743: 148 | E743: 3978 | F743: 167 | G743: 100 | H743: 4136 | I743: =MAX(B743,CEILING(F743,1)) -> 167 | J743: 167 | K743: 7036 | L743: 5450 | M743: 1 | N743: =IF(B743=C743,1,0) -> 0 | O743: =IF(I743=C743,1,0)-N743 -> 0 | P743: =IF(J743<C743,1,0) -> 1 | Q743: =M743-N743-O743 -> 1
A744: BPPC_8_2_5.txt | B744: 167 | C744: 168 | D744: 152 | E744: 3745 | F744: 167 | G744: 63 | H744: 3892 | I744: =MAX(B744,CEILING(F744,1)) -> 167 | J744: 167 | K744: 5902 | L744: 5168 | M744: 1 | N744: =IF(B744=C744,1,0) -> 0 | O744: =IF(I744=C744,1,0)-N744 -> 0 | P744: =IF(J744<C744,1,0) -> 1 | Q744: =M744-N744-O744 -> 1
A745: BPPC_8_2_6.txt | B745: 167 | C745: 168 | D745: 153 | E745: 4191 | F745: 167 | G745: 190 | H745: 4316 | I745: =MAX(B745,CEILING(F745,1)) -> 167 | J745: 167 | K745: 5995 | L745: 5837 | M745: 1 | N745: =IF(B745=C745,1,0) -> 0 | O745: =IF(I745=C745,1,0)-N745 -> 0 | P745: =IF(J745<C745,1,0) -> 1 | Q745: =M745-N745-O745 -> 1
A746: BPPC_8_2_7.txt | B746: 167 | C746: 168 | D746: 156 | E746: 3827 | F746: 167 | G746: 81 | H746: 3953 | I746: =MAX(B746,CEILING(F746,1)) -> 167 | J746: 167 | K746: 2899 | L746: 5360 | M746: 1 | N746: =IF(B746=C746,1,0) -> 0 | O746: =IF(I746=C746,1,0)-N746 -> 0 | P746: =IF(J746<C746,1,0) -> 1 | Q746: =M746-N746-O746 -> 1
A747: BPPC_8_2_8.txt | B747: 167 | C747: 168 | D747: 162 | E747: 3751 | F747: 167 | G747: 312 | H747: 3901 | I747: =MAX(B747,CEILING(F747,1)) -> 167 | J747: 167 | K747: 5281 | L747: 5323 | M747: 1 | N747: =IF(B747=C747,1,0) -> 0 | O747: =IF(I747=C747,1,0)-N747 -> 0 | P747: =IF(J747<C747,1,0) -> 1 | Q747: =M747-N747-O747 -> 1
A748: BPPC_8_2_9.txt | B748: 167 | C748: 168 | D748: 156 | E748: 3758 | F748: 167 | G748: 63 | H748: 3911 | I748: =MAX(B748,CEILING(F748,1)) -> 167 | J748: 167 | K748: 2010 | L748: 5356 | M748: 1 | N748: =IF(B748=C748,1,0) -> 0 | O748: =IF(I748=C748,1,0)-N748 -> 0 | P748: =IF(J748<C748,1,0) -> 1 | Q748: =M748-N748-O748 -> 1
A749: BPPC_8_2_10.txt | B749: 167 | C749: 168 | D749: 155 | E749: 3651 | F749: 167 | G749: 94 | H749: 3882 | I749: =MAX(B749,CEILING(F749,1)) -> 167 | J749: 167 | K749: 6087 | L749: 5355 | M749: 1 | N749: =IF(B749=C749,1,0) -> 0 | O749: =IF(I749=C749,1,0)-N749 -> 0 | P749: =IF(J749<C749,1,0) -> 1 | Q749: =M749-N749-O749 -> 1
A750: BPPC_8_3_1.txt | B750: 167 | C750: 168 | D750: 187 | E750: 5015 | F750: 167 | G750: 3814 | H750: 5219 | I750: =MAX(B750,CEILING(F750,1)) -> 167 | J750: 168 | K750: 36001 | L750: 34139 | M750: 0 | N750: =IF(B750=C750,1,0) -> 0 | O750: =IF(I750=C750,1,0)-N750 -> 0 | P750: =IF(J750<C750,1,0) -> 0 | Q750: =M750-N750-O750 -> 0
A751: BPPC_8_3_2.txt | B751: 172 | C751: 176 | D751: 130 | E751: 4557 | F751: 171.33332999999999 | G751: 1 | H751: 4561 | I751: =MAX(B751,CEILING(F751,1)) -> 172 | J751: 172 | K751: 44 | L751: 4841 | M751: 1 | N751: =IF(B751=C751,1,0) -> 0 | O751: =IF(I751=C751,1,0)-N751 -> 0 | P751: =IF(J751<C751,1,0) -> 1 | Q751: =M751-N751-O751 -> 1
A752: BPPC_8_3_3.txt | B752: 167 | C752: 168 | D752: 144 | E752: 4755 | F752: 167 | G752: 880 | H752: 4902 | I752: =MAX(B752,CEILING(F752,1)) -> 167 | J752: 167 | K752: 13683 | L752: 6434 | M752: 1 | N752: =IF(B752=C752,1,0) -> 0 | O752: =IF(I752=C752,1,0)-N752 -> 0 | P752: =IF(J752<C752,1,0) -> 1 | Q752: =M752-N752-O752 -> 1
A753: BPPC_8_3_4.txt | B753: 167 | C753: 169 | D753: 152 | E753: 4566 | F753: 167 | G753: 2361 | H753: 4884 | I753: =MAX(B753,CEILING(F753,1)) -> 167 | J753: 169 | K753: 36086 | L753: 4952 | M753: 0 | N753: =IF(B753=C753,1,0) -> 0 | O753: =IF(I753=C753,1,0)-N753 -> 0 | P753: =IF(J753<C753,1,0) -> 0 | Q753: =M753-N753-O753 -> 0
A754: BPPC_8_3_5.txt | B754: 167 | C754: 168 | D754: 160 | E754: 4879 | F754: 167 | G754: 2012 | H754: 5052 | I754: =MAX(B754,CEILING(F754,1)) -> 167 | J754: 168 | K754: 36068 | L754: 5504 | M754: 0 | N754: =IF(B754=C754,1,0) -> 0 | O754: =IF(I754=C754,1,0)-N754 -> 0 | P754: =IF(J754<C754,1,0) -> 0 | Q754: =M754-N754-O754 -> 0
A755: BPPC_8_3_6.txt | B755: 167 | C755: 169 | D755: 158 | E755: 4994 | F755: 167 | G755: 2303 | H755: 5341 | I755: =MAX(B755,CEILING(F755,1)) -> 167 | J755: 167 | K755: 28850 | L755: 6879 | M755: 1 | N755: =IF(B755=C755,1,0) -> 0 | O755: =IF(I755=C755,1,0)-N755 -> 0 | P755: =IF(J755<C755,1,0) -> 1 | Q755: =M755-N755-O755 -> 1
A756: BPPC_8_3_7.txt | B756: 167 | C756: 168 | D756: 145 | E756: 4701 | F756: 167 | G756: 496 | H756: 4945 | I756: =MAX(B756,CEILING(F756,1)) -> 167 | J756: 167 | K756: 23879 | L756: 6579 | M756: 1 | N756: =IF(B756=C756,1,0) -> 0 | O756: =IF(I756=C756,1,0)-N756 -> 0 | P756: =IF(J756<C756,1,0) -> 1 | Q756: =M756-N756-O756 -> 1
A757: BPPC_8_3_8.txt | B757: 167 | C757: 168 | D757: 151 | E757: 4932 | F757: 167 | G757: 1287 | H757: 5141 | I757: =MAX(B757,CEILING(F757,1)) -> 167 | J757: 167 | K757: 17717 | L757: 6852 | M757: 1 | N757: =IF(B757=C757,1,0) -> 0 | O757: =IF(I757=C757,1,0)-N757 -> 0 | P757: =IF(J757<C757,1,0) -> 1 | Q757: =M757-N757-O757 -> 1
A758: BPPC_8_3_9.txt | B758: 167 | C758: 168 | D758: 146 | E758: 4924 | F758: 167 | G758: 407 | H758: 5091 | I758: =MAX(B758,CEILING(F758,1)) -> 167 | J758: 167 | K758: 11058 | L758: 6753 | M758: 1 | N758: =IF(B758=C758,1,0) -> 0 | O758: =IF(I758=C758,1,0)-N758 -> 0 | P758: =IF(J758<C758,1,0) -> 1 | Q758: =M758-N758-O758 -> 1
A759: BPPC_8_3_10.txt | B759: 167 | C759: 168 | D759: 243 | E759: 4948 | F759: 167 | G759: 2001 | H759: 5200 | I759: =MAX(B759,CEILING(F759,1)) -> 167 | J759: 168 | K759: 36001 | L759: 9256 | M759: 0 | N759: =IF(B759=C759,1,0) -> 0 | O759: =IF(I759=C759,1,0)-N759 -> 0 | P759: =IF(J759<C759,1,0) -> 0 | Q759: =M759-N759-O759 -> 0
A760: BPPC_8_4_1.txt | B760: 206 | C760: 206 | D760: 1 | E760: 4386 | I760: =MAX(B760,CEILING(F760,1)) -> 206 | J760: 206 | K760: 0 | L760: 4386 | M760: 1 | N760: =IF(B760=C760,1,0) -> 1 | O760: =IF(I760=C760,1,0)-N760 -> 0 | P760: =IF(J760<C760,1,0) -> 0 | Q760: =M760-N760-O760 -> 0
A761: BPPC_8_4_2.txt | B761: 228 | C761: 228 | D761: 2 | E761: 4365 | I761: =MAX(B761,CEILING(F761,1)) -> 228 | J761: 228 | K761: 0 | L761: 4365 | M761: 1 | N761: =IF(B761=C761,1,0) -> 1 | O761: =IF(I761=C761,1,0)-N761 -> 0 | P761: =IF(J761<C761,1,0) -> 0 | Q761: =M761-N761-O761 -> 0
A762: BPPC_8_4_3.txt | B762: 188 | C762: 188 | D762: 1 | E762: 4382 | I762: =MAX(B762,CEILING(F762,1)) -> 188 | J762: 188 | K762: 0 | L762: 4382 | M762: 1 | N762: =IF(B762=C762,1,0) -> 1 | O762: =IF(I762=C762,1,0)-N762 -> 0 | P762: =IF(J762<C762,1,0) -> 0 | Q762: =M762-N762-O762 -> 0
A763: BPPC_8_4_4.txt | B763: 210 | C763: 210 | D763: 1 | E763: 4191 | I763: =MAX(B763,CEILING(F763,1)) -> 210 | J763: 210 | K763: 0 | L763: 4191 | M763: 1 | N763: =IF(B763=C763,1,0) -> 1 | O763: =IF(I763=C763,1,0)-N763 -> 0 | P763: =IF(J763<C763,1,0) -> 0 | Q763: =M763-N763-O763 -> 0
A764: BPPC_8_4_5.txt | B764: 202 | C764: 202 | D764: 1 | E764: 4325 | I764: =MAX(B764,CEILING(F764,1)) -> 202 | J764: 202 | K764: 0 | L764: 4325 | M764: 1 | N764: =IF(B764=C764,1,0) -> 1 | O764: =IF(I764=C764,1,0)-N764 -> 0 | P764: =IF(J764<C764,1,0) -> 0 | Q764: =M764-N764-O764 -> 0
A765: BPPC_8_4_6.txt | B765: 210 | C765: 210 | D765: 1 | E765: 4350 | I765: =MAX(B765,CEILING(F765,1)) -> 210 | J765: 210 | K765: 0 | L765: 4350 | M765: 1 | N765: =IF(B765=C765,1,0) -> 1 | O765: =IF(I765=C765,1,0)-N765 -> 0 | P765: =IF(J765<C765,1,0) -> 0 | Q765: =M765-N765-O765 -> 0
A766: BPPC_8_4_7.txt | B766: 202 | C766: 202 | D766: 1 | E766: 4199 | I766: =MAX(B766,CEILING(F766,1)) -> 202 | J766: 202 | K766: 0 | L766: 4199 | M766: 1 | N766: =IF(B766=C766,1,0) -> 1 | O766: =IF(I766=C766,1,0)-N766 -> 0 | P766: =IF(J766<C766,1,0) -> 0 | Q766: =M766-N766-O766 -> 0
A767: BPPC_8_4_8.txt | B767: 198 | C767: 198 | D767: 1 | E767: 4318 | I767: =MAX(B767,CEILING(F767,1)) -> 198 | J767: 198 | K767: 0 | L767: 4318 | M767: 1 | N767: =IF(B767=C767,1,0) -> 1 | O767: =IF(I767=C767,1,0)-N767 -> 0 | P767: =IF(J767<C767,1,0) -> 0 | Q767: =M767-N767-O767 -> 0
A768: BPPC_8_4_9.txt | B768: 194 | C768: 195 | D768: 123 | E768: 4274 | F768: 194.125 | G768: 1 | H768: 4279 | I768: =MAX(B768,CEILING(F768,1)) -> 195 | J768: 195 | K768: 1 | L768: 4279 | M768: 1 | N768: =IF(B768=C768,1,0) -> 0 | O768: =IF(I768=C768,1,0)-N768 -> 1 | P768: =IF(J768<C768,1,0) -> 0 | Q768: =M768-N768-O768 -> 0
A769: BPPC_8_4_10.txt | B769: 210 | C769: 210 | D769: 1 | E769: 4296 | I769: =MAX(B769,CEILING(F769,1)) -> 210 | J769: 210 | K769: 0 | L769: 4296 | M769: 1 | N769: =IF(B769=C769,1,0) -> 1 | O769: =IF(I769=C769,1,0)-N769 -> 0 | P769: =IF(J769<C769,1,0) -> 0 | Q769: =M769-N769-O769 -> 0
A770: BPPC_8_5_1.txt | B770: 254 | C770: 254 | D770: 2 | E770: 3528 | I770: =MAX(B770,CEILING(F770,1)) -> 254 | J770: 254 | K770: 0 | L770: 3528 | M770: 1 | N770: =IF(B770=C770,1,0) -> 1 | O770: =IF(I770=C770,1,0)-N770 -> 0 | P770: =IF(J770<C770,1,0) -> 0 | Q770: =M770-N770-O770 -> 0
A771: BPPC_8_5_2.txt | B771: 269 | C771: 270 | D771: 123 | E771: 3306 | F771: 269.33332999999999 | G771: 1 | H771: 3309 | I771: =MAX(B771,CEILING(F771,1)) -> 270 | J771: 270 | K771: 1 | L771: 3309 | M771: 1 | N771: =IF(B771=C771,1,0) -> 0 | O771: =IF(I771=C771,1,0)-N771 -> 1 | P771: =IF(J771<C771,1,0) -> 0 | Q771: =M771-N771-O771 -> 0
A772: BPPC_8_5_3.txt | B772: 235 | C772: 235 | D772: 2 | E772: 3675 | I772: =MAX(B772,CEILING(F772,1)) -> 235 | J772: 235 | K772: 0 | L772: 3675 | M772: 1 | N772: =IF(B772=C772,1,0) -> 1 | O772: =IF(I772=C772,1,0)-N772 -> 0 | P772: =IF(J772<C772,1,0) -> 0 | Q772: =M772-N772-O772 -> 0
A773: BPPC_8_5_4.txt | B773: 250 | C773: 250 | D773: 2 | E773: 3435 | I773: =MAX(B773,CEILING(F773,1)) -> 250 | J773: 250 | K773: 0 | L773: 3435 | M773: 1 | N773: =IF(B773=C773,1,0) -> 1 | O773: =IF(I773=C773,1,0)-N773 -> 0 | P773: =IF(J773<C773,1,0) -> 0 | Q773: =M773-N773-O773 -> 0
A774: BPPC_8_5_5.txt | B774: 260 | C774: 260 | D774: 2 | E774: 3501 | I774: =MAX(B774,CEILING(F774,1)) -> 260 | J774: 260 | K774: 0 | L774: 3501 | M774: 1 | N774: =IF(B774=C774,1,0) -> 1 | O774: =IF(I774=C774,1,0)-N774 -> 0 | P774: =IF(J774<C774,1,0) -> 0 | Q774: =M774-N774-O774 -> 0
A775: BPPC_8_5_6.txt | B775: 266 | C775: 266 | D775: 2 | E775: 3403 | I775: =MAX(B775,CEILING(F775,1)) -> 266 | J775: 266 | K775: 0 | L775: 3403 | M775: 1 | N775: =IF(B775=C775,1,0) -> 1 | O775: =IF(I775=C775,1,0)-N775 -> 0 | P775: =IF(J775<C775,1,0) -> 0 | Q775: =M775-N775-O775 -> 0
A776: BPPC_8_5_7.txt | B776: 255 | C776: 255 | D776: 2 | E776: 3398 | I776: =MAX(B776,CEILING(F776,1)) -> 255 | J776: 255 | K776: 0 | L776: 3398 | M776: 1 | N776: =IF(B776=C776,1,0) -> 1 | O776: =IF(I776=C776,1,0)-N776 -> 0 | P776: =IF(J776<C776,1,0) -> 0 | Q776: =M776-N776-O776 -> 0
A777: BPPC_8_5_8.txt | B777: 260 | C777: 260 | D777: 2 | E777: 3490 | I777: =MAX(B777,CEILING(F777,1)) -> 260 | J777: 260 | K777: 0 | L777: 3490 | M777: 1 | N777: =IF(B777=C777,1,0) -> 1 | O777: =IF(I777=C777,1,0)-N777 -> 0 | P777: =IF(J777<C777,1,0) -> 0 | Q777: =M777-N777-O777 -> 0
A778: BPPC_8_5_9.txt | B778: 243 | C778: 244 | D778: 123 | E778: 3455 | F778: 243.25 | G778: 7 | H778: 3472 | I778: =MAX(B778,CEILING(F778,1)) -> 244 | J778: 244 | K778: 7 | L778: 3472 | M778: 1 | N778: =IF(B778=C778,1,0) -> 0 | O778: =IF(I778=C778,1,0)-N778 -> 1 | P778: =IF(J778<C778,1,0) -> 0 | Q778: =M778-N778-O778 -> 0
A779: BPPC_8_5_10.txt | B779: 259 | C779: 259 | D779: 3 | E779: 3377 | I779: =MAX(B779,CEILING(F779,1)) -> 259 | J779: 259 | K779: 0 | L779: 3377 | M779: 1 | N779: =IF(B779=C779,1,0) -> 1 | O779: =IF(I779=C779,1,0)-N779 -> 0 | P779: =IF(J779<C779,1,0) -> 0 | Q779: =M779-N779-O779 -> 0
A780: BPPC_8_6_1.txt | B780: 300 | C780: 301 | D780: 125 | E780: 2876 | F780: 300.5 | G780: 1 | H780: 2877 | I780: =MAX(B780,CEILING(F780,1)) -> 301 | J780: 301 | K780: 1 | L780: 2877 | M780: 1 | N780: =IF(B780=C780,1,0) -> 0 | O780: =IF(I780=C780,1,0)-N780 -> 1 | P780: =IF(J780<C780,1,0) -> 0 | Q780: =M780-N780-O780 -> 0
A781: BPPC_8_6_2.txt | B781: 312 | C781: 312 | D781: 2 | E781: 2742 | I781: =MAX(B781,CEILING(F781,1)) -> 312 | J781: 312 | K781: 0 | L781: 2742 | M781: 1 | N781: =IF(B781=C781,1,0) -> 1 | O781: =IF(I781=C781,1,0)-N781 -> 0 | P781: =IF(J781<C781,1,0) -> 0 | Q781: =M781-N781-O781 -> 0
A782: BPPC_8_6_3.txt | B782: 284 | C782: 284 | D782: 2 | E782: 3087 | I782: =MAX(B782,CEILING(F782,1)) -> 284 | J782: 284 | K782: 0 | L782: 3087 | M782: 1 | N782: =IF(B782=C782,1,0) -> 1 | O782: =IF(I782=C782,1,0)-N782 -> 0 | P782: =IF(J782<C782,1,0) -> 0 | Q782: =M782-N782-O782 -> 0
A783: BPPC_8_6_4.txt | B783: 304 | C783: 304 | D783: 3 | E783: 2834 | I783: =MAX(B783,CEILING(F783,1)) -> 304 | J783: 304 | K783: 0 | L783: 2834 | M783: 1 | N783: =IF(B783=C783,1,0) -> 1 | O783: =IF(I783=C783,1,0)-N783 -> 0 | P783: =IF(J783<C783,1,0) -> 0 | Q783: =M783-N783-O783 -> 0
A784: BPPC_8_6_5.txt | B784: 302 | C784: 302 | D784: 3 | E784: 2848 | I784: =MAX(B784,CEILING(F784,1)) -> 302 | J784: 302 | K784: 0 | L784: 2848 | M784: 1 | N784: =IF(B784=C784,1,0) -> 1 | O784: =IF(I784=C784,1,0)-N784 -> 0 | P784: =IF(J784<C784,1,0) -> 0 | Q784: =M784-N784-O784 -> 0
A785: BPPC_8_6_6.txt | B785: 313 | C785: 314 | D785: 124 | E785: 2767 | F785: 313.5 | G785: 5 | H785: 2774 | I785: =MAX(B785,CEILING(F785,1)) -> 314 | J785: 314 | K785: 5 | L785: 2774 | M785: 1 | N785: =IF(B785=C785,1,0) -> 0 | O785: =IF(I785=C785,1,0)-N785 -> 1 | P785: =IF(J785<C785,1,0) -> 0 | Q785: =M785-N785-O785 -> 0
A786: BPPC_8_6_7.txt | B786: 312 | C786: 312 | D786: 2 | E786: 2808 | I786: =MAX(B786,CEILING(F786,1)) -> 312 | J786: 312 | K786: 0 | L786: 2808 | M786: 1 | N786: =IF(B786=C786,1,0) -> 1 | O786: =IF(I786=C786,1,0)-N786 -> 0 | P786: =IF(J786<C786,1,0) -> 0 | Q786: =M786-N786-O786 -> 0
A787: BPPC_8_6_8.txt | B787: 308 | C787: 308 | D787: 3 | E787: 2825 | I787: =MAX(B787,CEILING(F787,1)) -> 308 | J787: 308 | K787: 0 | L787: 2825 | M787: 1 | N787: =IF(B787=C787,1,0) -> 1 | O787: =IF(I787=C787,1,0)-N787 -> 0 | P787: =IF(J787<C787,1,0) -> 0 | Q787: =M787-N787-O787 -> 0
A788: BPPC_8_6_9.txt | B788: 303 | C788: 303 | D788: 2 | E788: 2891 | I788: =MAX(B788,CEILING(F788,1)) -> 303 | J788: 303 | K788: 0 | L788: 2891 | M788: 1 | N788: =IF(B788=C788,1,0) -> 1 | O788: =IF(I788=C788,1,0)-N788 -> 0 | P788: =IF(J788<C788,1,0) -> 0 | Q788: =M788-N788-O788 -> 0
A789: BPPC_8_6_10.txt | B789: 313 | C789: 313 | D789: 2 | E789: 2789 | I789: =MAX(B789,CEILING(F789,1)) -> 313 | J789: 313 | K789: 0 | L789: 2789 | M789: 1 | N789: =IF(B789=C789,1,0) -> 1 | O789: =IF(I789=C789,1,0)-N789 -> 0 | P789: =IF(J789<C789,1,0) -> 0 | Q789: =M789-N789-O789 -> 0
A790: BPPC_8_7_1.txt | B790: 349 | C790: 349 | D790: 3 | E790: 2207 | I790: =MAX(B790,CEILING(F790,1)) -> 349 | J790: 349 | K790: 1 | L790: 2207 | M790: 1 | N790: =IF(B790=C790,1,0) -> 1 | O790: =IF(I790=C790,1,0)-N790 -> 0 | P790: =IF(J790<C790,1,0) -> 0 | Q790: =M790-N790-O790 -> 0
A791: BPPC_8_7_2.txt | B791: 358 | C791: 358 | D791: 3 | E791: 2197 | I791: =MAX(B791,CEILING(F791,1)) -> 358 | J791: 358 | K791: 0 | L791: 2197 | M791: 1 | N791: =IF(B791=C791,1,0) -> 1 | O791: =IF(I791=C791,1,0)-N791 -> 0 | P791: =IF(J791<C791,1,0) -> 0 | Q791: =M791-N791-O791 -> 0
A792: BPPC_8_7_3.txt | B792: 337 | C792: 338 | D792: 124 | E792: 2554 | F792: 337.5 | G792: 1 | H792: 2555 | I792: =MAX(B792,CEILING(F792,1)) -> 338 | J792: 338 | K792: 1 | L792: 2555 | M792: 1 | N792: =IF(B792=C792,1,0) -> 0 | O792: =IF(I792=C792,1,0)-N792 -> 1 | P792: =IF(J792<C792,1,0) -> 0 | Q792: =M792-N792-O792 -> 0
A793: BPPC_8_7_4.txt | B793: 355 | C793: 355 | D793: 4 | E793: 2281 | I793: =MAX(B793,CEILING(F793,1)) -> 355 | J793: 355 | K793: 0 | L793: 2281 | M793: 1 | N793: =IF(B793=C793,1,0) -> 1 | O793: =IF(I793=C793,1,0)-N793 -> 0 | P793: =IF(J793<C793,1,0) -> 0 | Q793: =M793-N793-O793 -> 0
A794: BPPC_8_7_5.txt | B794: 358 | C794: 358 | D794: 4 | E794: 2233 | I794: =MAX(B794,CEILING(F794,1)) -> 358 | J794: 358 | K794: 0 | L794: 2233 | M794: 1 | N794: =IF(B794=C794,1,0) -> 1 | O794: =IF(I794=C794,1,0)-N794 -> 0 | P794: =IF(J794<C794,1,0) -> 0 | Q794: =M794-N794-O794 -> 0
A795: BPPC_8_7_6.txt | B795: 361 | C795: 361 | D795: 3 | E795: 2243 | I795: =MAX(B795,CEILING(F795,1)) -> 361 | J795: 361 | K795: 0 | L795: 2243 | M795: 1 | N795: =IF(B795=C795,1,0) -> 1 | O795: =IF(I795=C795,1,0)-N795 -> 0 | P795: =IF(J795<C795,1,0) -> 0 | Q795: =M795-N795-O795 -> 0
A796: BPPC_8_7_7.txt | B796: 366 | C796: 366 | D796: 3 | E796: 2040 | I796: =MAX(B796,CEILING(F796,1)) -> 366 | J796: 366 | K796: 0 | L796: 2040 | M796: 1 | N796: =IF(B796=C796,1,0) -> 1 | O796: =IF(I796=C796,1,0)-N796 -> 0 | P796: =IF(J796<C796,1,0) -> 0 | Q796: =M796-N796-O796 -> 0
A797: BPPC_8_7_8.txt | B797: 361 | C797: 361 | D797: 3 | E797: 2176 | I797: =MAX(B797,CEILING(F797,1)) -> 361 | J797: 361 | K797: 0 | L797: 2176 | M797: 1 | N797: =IF(B797=C797,1,0) -> 1 | O797: =IF(I797=C797,1,0)-N797 -> 0 | P797: =IF(J797<C797,1,0) -> 0 | Q797: =M797-N797-O797 -> 0
A798: BPPC_8_7_9.txt | B798: 351 | C798: 351 | D798: 3 | E798: 2298 | I798: =MAX(B798,CEILING(F798,1)) -> 351 | J798: 351 | K798: 0 | L798: 2298 | M798: 1 | N798: =IF(B798=C798,1,0) -> 1 | O798: =IF(I798=C798,1,0)-N798 -> 0 | P798: =IF(J798<C798,1,0) -> 0 | Q798: =M798-N798-O798 -> 0
A799: BPPC_8_7_10.txt | B799: 354 | C799: 354 | D799: 3 | E799: 2223 | I799: =MAX(B799,CEILING(F799,1)) -> 354 | J799: 354 | K799: 0 | L799: 2223 | M799: 1 | N799: =IF(B799=C799,1,0) -> 1 | O799: =IF(I799=C799,1,0)-N799 -> 0 | P799: =IF(J799<C799,1,0) -> 0 | Q799: =M799-N799-O799 -> 0
A800: BPPC_8_8_1.txt | B800: 404 | C800: 404 | D800: 4 | E800: 1599 | I800: =MAX(B800,CEILING(F800,1)) -> 404 | J800: 404 | K800: 0 | L800: 1599 | M800: 1 | N800: =IF(B800=C800,1,0) -> 1 | O800: =IF(I800=C800,1,0)-N800 -> 0 | P800: =IF(J800<C800,1,0) -> 0 | Q800: =M800-N800-O800 -> 0
A801: BPPC_8_8_2.txt | B801: 413 | C801: 413 | D801: 4 | E801: 1530 | I801: =MAX(B801,CEILING(F801,1)) -> 413 | J801: 413 | K801: 0 | L801: 1530 | M801: 1 | N801: =IF(B801=C801,1,0) -> 1 | O801: =IF(I801=C801,1,0)-N801 -> 0 | P801: =IF(J801<C801,1,0) -> 0 | Q801: =M801-N801-O801 -> 0
A802: BPPC_8_8_3.txt | B802: 380 | C802: 380 | D802: 4 | E802: 1824 | I802: =MAX(B802,CEILING(F802,1)) -> 380 | J802: 380 | K802: 0 | L802: 1824 | M802: 1 | N802: =IF(B802=C802,1,0) -> 1 | O802: =IF(I802=C802,1,0)-N802 -> 0 | P802: =IF(J802<C802,1,0) -> 0 | Q802: =M802-N802-O802 -> 0
A803: BPPC_8_8_4.txt | B803: 404 | C803: 404 | D803: 4 | E803: 1557 | I803: =MAX(B803,CEILING(F803,1)) -> 404 | J803: 404 | K803: 0 | L803: 1557 | M803: 1 | N803: =IF(B803=C803,1,0) -> 1 | O803: =IF(I803=C803,1,0)-N803 -> 0 | P803: =IF(J803<C803,1,0) -> 0 | Q803: =M803-N803-O803 -> 0
A804: BPPC_8_8_5.txt | B804: 405 | C804: 406 | D804: 124 | E804: 1481 | F804: 405.14285999999998 | G804: 20 | H804: 1508 | I804: =MAX(B804,CEILING(F804,1)) -> 406 | J804: 406 | K804: 20 | L804: 1508 | M804: 1 | N804: =IF(B804=C804,1,0) -> 0 | O804: =IF(I804=C804,1,0)-N804 -> 1 | P804: =IF(J804<C804,1,0) -> 0 | Q804: =M804-N804-O804 -> 0
A805: BPPC_8_8_6.txt | B805: 403 | C805: 403 | D805: 4 | E805: 1611 | I805: =MAX(B805,CEILING(F805,1)) -> 403 | J805: 403 | K805: 0 | L805: 1611 | M805: 1 | N805: =IF(B805=C805,1,0) -> 1 | O805: =IF(I805=C805,1,0)-N805 -> 0 | P805: =IF(J805<C805,1,0) -> 0 | Q805: =M805-N805-O805 -> 0
A806: BPPC_8_8_7.txt | B806: 418 | C806: 418 | D806: 5 | E806: 1391 | I806: =MAX(B806,CEILING(F806,1)) -> 418 | J806: 418 | K806: 0 | L806: 1391 | M806: 1 | N806: =IF(B806=C806,1,0) -> 1 | O806: =IF(I806=C806,1,0)-N806 -> 0 | P806: =IF(J806<C806,1,0) -> 0 | Q806: =M806-N806-O806 -> 0
A807: BPPC_8_8_8.txt | B807: 413 | C807: 413 | D807: 5 | E807: 1510 | I807: =MAX(B807,CEILING(F807,1)) -> 413 | J807: 413 | K807: 0 | L807: 1510 | M807: 1 | N807: =IF(B807=C807,1,0) -> 1 | O807: =IF(I807=C807,1,0)-N807 -> 0 | P807: =IF(J807<C807,1,0) -> 0 | Q807: =M807-N807-O807 -> 0
A808: BPPC_8_8_9.txt | B808: 406 | C808: 406 | D808: 4 | E808: 1606 | I808: =MAX(B808,CEILING(F808,1)) -> 406 | J808: 406 | K808: 0 | L808: 1606 | M808: 1 | N808: =IF(B808=C808,1,0) -> 1 | O808: =IF(I808=C808,1,0)-N808 -> 0 | P808: =IF(J808<C808,1,0) -> 0 | Q808: =M808-N808-O808 -> 0
A809: BPPC_8_8_10.txt | B809: 406 | C809: 406 | D809: 3 | E809: 1650 | I809: =MAX(B809,CEILING(F809,1)) -> 406 | J809: 406 | K809: 0 | L809: 1650 | M809: 1 | N809: =IF(B809=C809,1,0) -> 1 | O809: =IF(I809=C809,1,0)-N809 -> 0 | P809: =IF(J809<C809,1,0) -> 0 | Q809: =M809-N809-O809 -> 0
A810: BPPC_8_9_1.txt | B810: 451 | C810: 451 | D810: 4 | E810: 949 | I810: =MAX(B810,CEILING(F810,1)) -> 451 | J810: 451 | K810: 0 | L810: 949 | M810: 1 | N810: =IF(B810=C810,1,0) -> 1 | O810: =IF(I810=C810,1,0)-N810 -> 0 | P810: =IF(J810<C810,1,0) -> 0 | Q810: =M810-N810-O810 -> 0
A811: BPPC_8_9_2.txt | B811: 457 | C811: 457 | D811: 4 | E811: 914 | I811: =MAX(B811,CEILING(F811,1)) -> 457 | J811: 457 | K811: 0 | L811: 914 | M811: 1 | N811: =IF(B811=C811,1,0) -> 1 | O811: =IF(I811=C811,1,0)-N811 -> 0 | P811: =IF(J811<C811,1,0) -> 0 | Q811: =M811-N811-O811 -> 0
A812: BPPC_8_9_3.txt | B812: 445 | C812: 445 | D812: 3 | E812: 1169 | I812: =MAX(B812,CEILING(F812,1)) -> 445 | J812: 445 | K812: 0 | L812: 1169 | M812: 1 | N812: =IF(B812=C812,1,0) -> 1 | O812: =IF(I812=C812,1,0)-N812 -> 0 | P812: =IF(J812<C812,1,0) -> 0 | Q812: =M812-N812-O812 -> 0
A813: BPPC_8_9_4.txt | B813: 452 | C813: 452 | D813: 3 | E813: 927 | I813: =MAX(B813,CEILING(F813,1)) -> 452 | J813: 452 | K813: 0 | L813: 927 | M813: 1 | N813: =IF(B813=C813,1,0) -> 1 | O813: =IF(I813=C813,1,0)-N813 -> 0 | P813: =IF(J813<C813,1,0) -> 0 | Q813: =M813-N813-O813 -> 0
A814: BPPC_8_9_5.txt | B814: 459 | C814: 459 | D814: 6 | E814: 863 | I814: =MAX(B814,CEILING(F814,1)) -> 459 | J814: 459 | K814: 0 | L814: 863 | M814: 1 | N814: =IF(B814=C814,1,0) -> 1 | O814: =IF(I814=C814,1,0)-N814 -> 0 | P814: =IF(J814<C814,1,0) -> 0 | Q814: =M814-N814-O814 -> 0
A815: BPPC_8_9_6.txt | B815: 452 | C815: 452 | D815: 3 | E815: 1016 | I815: =MAX(B815,CEILING(F815,1)) -> 452 | J815: 452 | K815: 0 | L815: 1016 | M815: 1 | N815: =IF(B815=C815,1,0) -> 1 | O815: =IF(I815=C815,1,0)-N815 -> 0 | P815: =IF(J815<C815,1,0) -> 0 | Q815: =M815-N815-O815 -> 0
A816: BPPC_8_9_7.txt | B816: 469 | C816: 469 | D816: 4 | E816: 736 | I816: =MAX(B816,CEILING(F816,1)) -> 469 | J816: 469 | K816: 0 | L816: 736 | M816: 1 | N816: =IF(B816=C816,1,0) -> 1 | O816: =IF(I816=C816,1,0)-N816 -> 0 | P816: =IF(J816<C816,1,0) -> 0 | Q816: =M816-N816-O816 -> 0
A817: BPPC_8_9_8.txt | B817: 457 | C817: 457 | D817: 4 | E817: 907 | I817: =MAX(B817,CEILING(F817,1)) -> 457 | J817: 457 | K817: 0 | L817: 907 | M817: 1 | N817: =IF(B817=C817,1,0) -> 1 | O817: =IF(I817=C817,1,0)-N817 -> 0 | P817: =IF(J817<C817,1,0) -> 0 | Q817: =M817-N817-O817 -> 0
A818: BPPC_8_9_9.txt | B818: 447 | C818: 447 | D818: 4 | E818: 963 | I818: =MAX(B818,CEILING(F818,1)) -> 447 | J818: 447 | K818: 0 | L818: 963 | M818: 1 | N818: =IF(B818=C818,1,0) -> 1 | O818: =IF(I818=C818,1,0)-N818 -> 0 | P818: =IF(J818<C818,1,0) -> 0 | Q818: =M818-N818-O818 -> 0
A819: BPPC_8_9_10.txt | B819: 449 | C819: 449 | D819: 4 | E819: 962 | I819: =MAX(B819,CEILING(F819,1)) -> 449 | J819: 449 | K819: 0 | L819: 962 | M819: 1 | N819: =IF(B819=C819,1,0) -> 1 | O819: =IF(I819=C819,1,0)-N819 -> 0 | P819: =IF(J819<C819,1,0) -> 0 | Q819: =M819-N819-O819 -> 0
M820: =SUM(M20:M819) -> 780 | N820: =SUM(N20:N819) -> 499 | O820: =SUM(O20:O819) -> 104 | P820: =SUM(P20:P819) -> 175 | Q820: =SUM(Q20:Q819) -> 177