A1: CLASS 1
B2: N = 25 | D2: N = 50 | F2: N = 100 | H2: N = 200
A3: Instance | B3: Lb* | C3: Ub* | D3: Lb* | E3: Ub* | F3: Lb* | G3: Ub* | H3: Lb* | I3: Ub*
A4: 1 | B4: 6 | C4: 6 | D4: 13 | E4: 13 | F4: 25 | G4: 26 | H4: 50 | I4: 51
A5: 2 | B5: 7 | C5: 7 | D5: 13 | E5: 13 | F5: 26 | G5: 26 | H5: 50 | I5: 51
A6: 3 | B6: 7 | C6: 7 | D6: 13 | E6: 13 | F6: 26 | G6: 26 | H6: 50 | I6: 51
A7: 4 | B7: 7 | C7: 7 | D7: 13 | E7: 13 | F7: 25 | G7: 26 | H7: 50 | I7: 51
A8: 5 | B8: 7 | C8: 7 | D8: 13 | E8: 13 | F8: 25 | G8: 26 | H8: 50 | I8: 51
A9: 6 | B9: 7 | C9: 7 | D9: 14 | E9: 14 | F9: 25 | G9: 26 | H9: 50 | I9: 51
A10: 7 | B10: 7 | C10: 7 | D10: 14 | E10: 14 | F10: 25 | G10: 26 | H10: 50 | I10: 51
A11: 8 | B11: 7 | C11: 7 | D11: 14 | E11: 14 | F11: 26 | G11: 26 | H11: 51 | I11: 51
A12: 9 | B12: 7 | C12: 7 | D12: 14 | E12: 14 | F12: 26 | G12: 26 | H12: 51 | I12: 51
A13: 10 | B13: 7 | C13: 7 | D13: 14 | E13: 14 | F13: 26 | G13: 26 | H13: 51 | I13: 51
B14: =SUM(B4:B13) -> 69 | C14: =SUM(C4:C13) -> 69 | D14: =SUM(D4:D13) -> 135 | E14: =SUM(E4:E13) -> 135 | F14: =SUM(F4:F13) -> 255 | G14: =SUM(G4:G13) -> 260 | H14: =SUM(H4:H13) -> 503 | I14: =SUM(I4:I13) -> 510
A15: CLASS 6
B16: N = 25 | D16: N = 50 | F16: N = 100 | H16: N = 200
A17: Instance | B17: Lb* | C17: Ub* | D17: Lb* | E17: Ub* | F17: Lb* | G17: Ub* | H17: Lb* | I17: Ub*
A18: 1 | B18: 10 | C18: 10 | D18: 21 | E18: 21 | F18: 40 | G18: 41 | H18: 80 | I18: 81
A19: 2 | B19: 10 | C19: 10 | D19: 21 | E19: 21 | F19: 41 | G19: 41 | H19: 80 | I19: 81
A20: 3 | B20: 10 | C20: 10 | D20: 21 | E20: 21 | F20: 41 | G20: 41 | H20: 80 | I20: 81
A21: 4 | B21: 10 | C21: 10 | D21: 21 | E21: 21 | F21: 40 | G21: 41 | H21: 80 | I21: 81
A22: 5 | B22: 10 | C22: 10 | D22: 21 | E22: 21 | F22: 40 | G22: 41 | H22: 80 | I22: 81
A23: 6 | B23: 10 | C23: 10 | D23: 22 | E23: 22 | F23: 40 | G23: 41 | H23: 80 | I23: 81
A24: 7 | B24: 10 | C24: 10 | D24: 21 | E24: 22 | F24: 40 | G24: 41 | H24: 80 | I24: 81
A25: 8 | B25: 10 | C25: 10 | D25: 22 | E25: 22 | F25: 41 | G25: 41 | H25: 81 | I25: 81
A26: 9 | B26: 10 | C26: 10 | D26: 22 | E26: 22 | F26: 41 | G26: 41 | H26: 81 | I26: 81
A27: 10 | B27: 11 | C27: 11 | D27: 22 | E27: 22 | F27: 41 | G27: 41 | H27: 81 | I27: 82
B28: =SUM(B18:B27) -> 101 | C28: =SUM(C18:C27) -> 101 | D28: =SUM(D18:D27) -> 214 | E28: =SUM(E18:E27) -> 215 | F28: =SUM(F18:F27) -> 405 | G28: =SUM(G18:G27) -> 410 | H28: =SUM(H18:H27) -> 803 | I28: =SUM(I18:I27) -> 811
A29: CLASS 7
B30: N = 25 | D30: N = 50 | F30: N = 100 | H30: N = 200
A31: Instance | B31: Lb* | C31: Ub* | D31: Lb* | E31: Ub* | F31: Lb* | G31: Ub* | H31: Lb* | I31: Ub*
A32: 1 | B32: 9 | C32: 9 | D32: 21 | E32: 21 | F32: 40 | G32: 41 | H32: 80 | I32: 80
A33: 2 | B33: 9 | C33: 9 | D33: 18 | E33: 18 | F33: 39 | G33: 40 | H33: 80 | I33: 80
A34: 3 | B34: 10 | C34: 10 | D34: 21 | E34: 21 | F34: 41 | G34: 41 | H34: 80 | I34: 80
A35: 4 | B35: 10 | C35: 10 | D35: 18 | E35: 18 | F35: 39 | G35: 40 | H35: 80 | I35: 80
A36: 5 | B36: 10 | C36: 10 | D36: 21 | E36: 21 | F36: 40 | G36: 41 | H36: 80 | I36: 80
A37: 6 | B37: 10 | C37: 10 | D37: 18 | E37: 18 | F37: 39 | G37: 40 | H37: 79 | I37: 80
A38: 7 | B38: 10 | C38: 10 | D38: 21 | E38: 22 | F38: 40 | G38: 41 | H38: 80 | I38: 81
A39: 8 | B39: 9 | C39: 9 | D39: 18 | E39: 18 | F39: 39 | G39: 40 | H39: 79 | I39: 80
A40: 9 | B40: 10 | C40: 10 | D40: 22 | E40: 22 | F40: 41 | G40: 41 | H40: 81 | I40: 81
A41: 10 | B41: 9 | C41: 9 | D41: 18 | E41: 18 | F41: 40 | G41: 40 | H41: 80 | I41: 80
B42: =SUM(B32:B41) -> 96 | C42: =SUM(C32:C41) -> 96 | D42: =SUM(D32:D41) -> 196 | E42: =SUM(E32:E41) -> 197 | F42: =SUM(F32:F41) -> 398 | G42: =SUM(G32:G41) -> 405 | H42: =SUM(H32:H41) -> 799 | I42: =SUM(I32:I41) -> 802
A43: CLASS 9
B44: N = 25 | D44: N = 50 | F44: N = 100 | H44: N = 200
A45: Instance | B45: Lb* | C45: Ub* | D45: Lb* | E45: Ub* | F45: Lb* | G45: Ub* | H45: Lb* | I45: Ub*
A46: 1 | B46: 7 | C46: 7 | D46: 14 | E46: 14 | F46: 25 | G46: 26 | H46: 50 | I46: 51
A47: 2 | B47: 7 | C47: 7 | D47: 14 | E47: 14 | F47: 26 | G47: 27 | H47: 50 | I47: 51
A48: 3 | B48: 7 | C48: 7 | D48: 14 | E48: 14 | F48: 26 | G48: 27 | H48: 50 | I48: 51
A49: 4 | B49: 7 | C49: 7 | D49: 14 | E49: 14 | F49: 25 | G49: 26 | H49: 50 | I49: 51
A50: 5 | B50: 7 | C50: 7 | D50: 14 | E50: 14 | F50: 25 | G50: 26 | H50: 50 | I50: 51
A51: 6 | B51: 7 | C51: 7 | D51: 14 | E51: 15 | F51: 26 | G51: 27 | H51: 50 | I51: 51
A52: 7 | B52: 7 | C52: 7 | D52: 15 | E52: 15 | F52: 26 | G52: 27 | H52: 50 | I52: 51
A53: 8 | B53: 8 | C53: 8 | D53: 15 | E53: 15 | F53: 26 | G53: 27 | H53: 51 | I53: 52
A54: 9 | B54: 8 | C54: 8 | D54: 15 | E54: 15 | F54: 26 | G54: 27 | H54: 51 | I54: 52
A55: 10 | B55: 8 | C55: 8 | D55: 15 | E55: 15 | F55: 26 | G55: 27 | H55: 51 | I55: 52
B56: =SUM(B46:B55) -> 73 | C56: =SUM(C46:C55) -> 73 | D56: =SUM(D46:D55) -> 144 | E56: =SUM(E46:E55) -> 145 | F56: =SUM(F46:F55) -> 257 | G56: =SUM(G46:G55) -> 267 | H56: =SUM(H46:H55) -> 503 | I56: =SUM(I46:I55) -> 513
A57: CLASS 10
B58: N = 24 | D58: N = 51 | F58: N = 99 | H58: N = 201
A59: Instance | B59: Lb* | C59: Ub* | D59: Lb* | E59: Ub* | F59: Lb* | G59: Ub* | H59: Lb* | I59: Ub*
A60: 1 | B60: 8 | C60: 8 | D60: 17 | E60: 17 | F60: 33 | G60: 33 | H60: 67 | I60: 67
A61: 2 | B61: 8 | C61: 8 | D61: 17 | E61: 17 | F61: 33 | G61: 33 | H61: 67 | I61: 67
A62: 3 | B62: 8 | C62: 8 | D62: 17 | E62: 17 | F62: 33 | G62: 33 | H62: 67 | I62: 67
A63: 4 | B63: 8 | C63: 8 | D63: 17 | E63: 17 | F63: 33 | G63: 33 | H63: 67 | I63: 67
A64: 5 | B64: 8 | C64: 8 | D64: 17 | E64: 17 | F64: 33 | G64: 33 | H64: 67 | I64: 67
A65: 6 | B65: 8 | C65: 8 | D65: 17 | E65: 17 | F65: 33 | G65: 33 | H65: 67 | I65: 67
A66: 7 | B66: 8 | C66: 8 | D66: 17 | E66: 17 | F66: 33 | G66: 33 | H66: 67 | I66: 67
A67: 8 | B67: 8 | C67: 8 | D67: 17 | E67: 17 | F67: 33 | G67: 33 | H67: 67 | I67: 67
A68: 9 | B68: 8 | C68: 8 | D68: 17 | E68: 17 | F68: 33 | G68: 33 | H68: 67 | I68: 67
A69: 10 | B69: 8 | C69: 8 | D69: 17 | E69: 17 | F69: 33 | G69: 33 | H69: 67 | I69: 67
B70: =SUM(B60:B69) -> 80 | C70: =SUM(C60:C69) -> 80 | D70: =SUM(D60:D69) -> 170 | E70: =SUM(E60:E69) -> 170 | F70: =SUM(F60:F69) -> 330 | G70: =SUM(G60:G69) -> 330 | H70: =SUM(H60:H69) -> 670 | I70: =SUM(I60:I69) -> 670